(Parent) ASIN,(Child) ASIN,Title,Sessions - Total,Sessions - Total - B2B,Session Percentage - Total,Session Percentage - Total - B2B,Page Views - Total,Page Views - Total - B2B,Page Views Percentage - Total,Page Views Percentage - Total - B2B,Featured Offer Percentage,Featured Offer Percentage - B2B,Units Ordered,Units Ordered - B2B,Unit Session Percentage,Unit Session Percentage - B2B,Ordered Product Sales,Ordered Product Sales - B2B,Total Order Items,Total Order Items - B2B
B071VPNJLS,B071VPNJLS,"Lewitt LCT 440 Pure Single-Pattern 1"" XLR Unidirectional Large Diaphragm Studio Condenser Microphone (Black)",823,17,0.33%,0.39%,"1,207",25,0.37%,0.42%,0.00%,0.00%,0,0,0.00%,0.00%,₹0.00,₹0.00,0,0
B078JQ33SM,B078JQ33SM,SE ELECTRONICS V7 X Supercardioid Dynamic Instrument Microphone,68,1,0.03%,0.02%,79,2,0.02%,0.03%,2.70%,0.00%,0,0,0.00%,0.00%,₹0.00,₹0.00,0,0
B078WNW4YW,B078WNW4YW,"TONOR Wireless Microphone Isolation Shield, Mic Sound Absorbing Foam Reflector for Any Condenser Recording Equipment Studio (Black)",231,17,0.09%,0.39%,343,36,0.11%,0.60%,3.38%,9.52%,0,0,0.00%,0.00%,₹0.00,₹0.00,0,0
B07GVGMW59,B07GVGMW59,"TONOR G11 Conference USB Microphone, Omnidirectional Condenser PC Mic for Video Conference, Recording, Skype, Online Class, Court Reporter, Plug & Play Compatible with Mac OS X Windows PC Computer",252,22,0.10%,0.51%,386,37,0.12%,0.62%,0.87%,0.00%,0,0,0.00%,0.00%,₹0.00,₹0.00,0,0
B07NC254QQ,B07NC254QQ,"Arturia MicroFreak 25-key Paraphonic Hybrid Hardware Synth with Poly-aftertouch Flat Keyboard, Wavetable and Digital Oscillators, Analog Filters, Modulation Matrix, Arpeggiator, and Sequencer Black",164,6,0.07%,0.14%,220,8,0.07%,0.13%,21.58%,0.00%,0,0,0.00%,0.00%,₹0.00,₹0.00,0,0
B07TS7J7S3,B07TS7J7S3,"Lewitt 441 Flex Multi-Pattern 1"" Large-Diaphragm Studio Condenser Microphone",293,11,0.12%,0.25%,365,18,0.11%,0.30%,10.19%,8.33%,0,0,0.00%,0.00%,₹0.00,₹0.00,0,0
B07TSN2H9D,B07TSN2H9D,"TONOR Cardioid Condenser Microphone, USB Computer Mic Kit with 24mm Diaphragm/Spider Shock Mount for Podcasting, Gaming, Streaming, YouTube, Voice Over, Studio/Home Recording, TC-2030",230,4,0.09%,0.09%,317,4,0.10%,0.07%,2.17%,0.00%,0,0,0.00%,0.00%,₹0.00,₹0.00,0,0
B07WLWN2ZT,B07WLWN2ZT,"TONOR USB Gaming Microphone, Computer Condenser PC Mic with Tripod Stand & Pop for Streaming, Podcasting, Vocal Recording, Compatible with iMac PC Laptop Desktop Windows Computer, TC-777",301,9,0.12%,0.21%,400,11,0.12%,0.18%,4.95%,0.00%,0,0,0.00%,0.00%,₹0.00,₹0.00,0,0
B082W4B7SX,B082W4B7SX,"TONOR Microphone Arm Stand, TONOR Adjustable Suspension Boom Scissor Mic Stand with Pop , 3/8"" to 5/8"" Adapter, Mic Clip, Upgraded Heavy Duty Clamp for Blue Yeti Nano Snowball Ice and Other Mics(T20)",79,1,0.03%,0.02%,91,1,0.03%,0.02%,0.00%,0.00%,0,0,0.00%,0.00%,₹0.00,₹0.00,0,0
B087MMY6T8,B087MMY6T8,"SE Electronics RF-X Portable Vocal Booth - Studio-Grade Isolation Shield for Singers, Podcasters and Musicians - Ideal for Home Recordings, Podcasting - Achieve Professional Sound Quality - Red",1,0,0.00%,0.00%,1,0,0.00%,0.00%,0.00%,0.00%,0,0,0.00%,0.00%,₹0.00,₹0.00,0,0
B089SJGQBH,B089SJGQBH,"TONOR XLR Condenser Microphone, Professional Cardioid Studio Mic Kit with T20 Boom Arm, Shock Mount, Pop Filter for Recording, Podcasting, Voice Over, Streaming, Home Studio, YouTube (TC20)",37,0,0.01%,0.00%,54,0,0.02%,0.00%,4.00%,0.00%,0,0,0.00%,0.00%,₹0.00,₹0.00,0,0
B08CF614NK,B08CF614NK,"MAONO AU-PM422 Podcast Microphone with Zero Latency Monitoring, 192KHZ/24BIT Professional Cardioid Condenser Mic with Touch Mute Button and Mic Gain Knob for Recording, Podcasting, Gaming, YouTube","1,201",11,0.48%,0.25%,"1,691",13,0.52%,0.22%,0.19%,0.00%,0,0,0.00%,0.00%,₹0.00,₹0.00,0,0
B08CVP2HXP,B08CVP2HXP,"TONOR USB Microphone, Condenser Computer PC Mic with Tripod Stand, Metal,Pop Filter, Shock Mount for Gaming,Streaming,Podcasting,YouTube, Voice Over,Skype, Twitch,Compatible with Laptop Desktop, TC30",696,19,0.28%,0.44%,905,26,0.28%,0.44%,0.73%,0.00%,0,0,0.00%,0.00%,₹0.00,₹0.00,0,0
B08FW1Q676,B08FW1Q676,"MAONO AU-PM421 Large Diaphragm Condenser USB Unidirectional Microphone, Professional Studio Recording Mic with 1-Touch Mute and Mic Gain Knob for Pc, Singing, Podcast, Gaming, YouTube (Black)","1,365",14,0.55%,0.32%,"1,627",16,0.50%,0.27%,0.19%,0.00%,0,0,0.00%,0.00%,₹0.00,₹0.00,0,0
B08NDB5NWP,B08NDB5NWP,"TONOR USB Conference Microphone, 360 Omnidirectional PC Computer Condenser Mic with Mute Button for Online Meeting/Class, Zoom Call, Skype Chatting, Plug & Play (TM20,Red)",174,15,0.07%,0.35%,232,23,0.07%,0.39%,3.37%,9.52%,0,0,0.00%,0.00%,₹0.00,₹0.00,0,0
B08SJD466P,B08SJD466P,"Audient iD14 (MKII) 10in/6out High-Performance USB 3.0 Audio Interface with 2 Audient Preamps, Dual Headphone Outputs, 4 Line Outputs, ADAT Input, Monitor Controls & Free Software Bundle - Mac/Win/iOS",945,21,0.38%,0.48%,"1,349",30,0.42%,0.50%,6.31%,0.00%,0,0,0.00%,0.00%,₹0.00,₹0.00,0,0
B08V1JS3NY,B08V1JS3NY,"TONOR USB Microphone Kit, Streaming Podcast PC Cardioid Condenser Computer Mic for Gaming, YouTube Video, Recording Music, Voice Over, Studio Mic Bundle with Adjustment Arm Stand(TC40)",5,0,0.00%,0.00%,5,0,0.00%,0.00%,100.00%,0.00%,0,0,0.00%,0.00%,₹0.00,₹0.00,0,0
B09KLHYW1T,B09KLHYW1T,"Nektar Impact LX Mini 25-key USB MIDI Controller Keyboard with Nektar DAW Integration, 8 Velocity-Sensitive Pads, Arpeggiator and Note Repeat Mode and Software Bundle",687,1,0.28%,0.02%,812,2,0.25%,0.03%,5.04%,0.00%,0,0,0.00%,0.00%,₹0.00,₹0.00,0,0
B09LL6YPW1,B09LL6YPW1,SE-DM Group-Series,1,0,0.00%,0.00%,1,0,0.00%,0.00%,0.00%,0.00%,0,0,0.00%,0.00%,₹0.00,₹0.00,0,0
B09Z5Q194D,B09Z5Q194D,"TONOR USB Microphone Computer Gaming Condenser Mic, Noise-Canceling Zero Latency Monitoring for Podcast/Recording/Livestreaming/Teleconferencing on PC/Mac/Android Device, Plug and Play, ORCA001",14,2,0.01%,0.05%,21,2,0.01%,0.03%,0.00%,0.00%,0,0,0.00%,0.00%,₹0.00,₹0.00,0,0
B0B4DPX2J2,B0B4DPX2J2,"Audio Array AM-C1 USB Condenser Microphone Kit | 192kHz/24bit | 20-20KHz | 16mm Diaphram | BoomArm,Pop Filter, Mic Cover, Shock Mount,Tripod & 2.5M USB Cable | Podcasting,Gaming & Singing","13,983",243,5.63%,5.61%,"20,000",362,6.18%,6.06%,0.03%,0.00%,0,0,0.00%,0.00%,₹0.00,₹0.00,0,0
B0B4G19R58,B0B4G19R58,"Audio Array AM-C2 XLR Condenser Microphone Kit | Boom Arm, 2M Cable, Pop Filter & Mic Cover | Compatible with Audio Interface, Mixer & preamp | Recording, Podcasting, Streaming, Home Studio (Black)",988,9,0.40%,0.21%,"1,449",10,0.45%,0.17%,3.09%,0.00%,0,0,0.00%,0.00%,₹0.00,₹0.00,0,0
B0B4G1HPL5,B0B4G1HPL5,"Audio Array AM-C11 XLR/USB Dynamic Podcast Microphone | Built-in Monitoring | One Touch Mute and Volume Control | Premium Metal Build | 2M XLR & USB Cable | Streaming, Gaming, Podcasting, Singing",447,12,0.18%,0.28%,701,20,0.22%,0.33%,0.00%,0.00%,0,0,0.00%,0.00%,₹0.00,₹0.00,0,0
B0B4G8ZB64,B0B4G8ZB64,"Audio Array AM-C3 XLR to TRS Dynamic Handheld Karaoke Microphone | Premium Metal Built with 3M Cable | Singing, Public Meetings, Studio Recording, Live Show, Party, Church, Wedding",312,9,0.13%,0.21%,431,15,0.13%,0.25%,0.00%,0.00%,0,0,0.00%,0.00%,₹0.00,₹0.00,0,0
B0B4G94VP3,B0B4G94VP3,"Audio Array AA-03 Double Layer Professional Pop Filter | Flexible 360° Free Angle Adjustable, Durable Windshield | Metal Gooseneck Stabilizing Arm Holder with 32cm Arm Length | Suitable for Recording.",107,3,0.04%,0.07%,139,11,0.04%,0.18%,0.00%,0.00%,0,0,0.00%,0.00%,₹0.00,₹0.00,0,0
B0B4WTHLX5,B0B4WTHLX5,"TONOR RGB USB Microphone, Cardioid Condenser Computer PC Mic with Tripod Stand, Pop Filter, Shock Mount for Gaming, Streaming, Podcasting, YouTube, Twitch, Compatible with Laptop Desktop,TC30 with RGB",129,4,0.05%,0.09%,167,5,0.05%,0.08%,10.88%,40.00%,0,0,0.00%,0.00%,₹0.00,₹0.00,0,0
B0BBL47VR5,B0BBL47VR5,"TONOR RGB USB Gaming Microphone Kit, Podcast Microphone for PC, One-tap Mute for Streaming, Cardioid Condenser Microphone for PS4/5 Gamer Youtuber, Studio Mic Bundle with Adjustment Arm Stand",4,0,0.00%,0.00%,5,0,0.00%,0.00%,100.00%,0.00%,0,0,0.00%,0.00%,₹0.00,₹0.00,0,0
B0BHC6V1KT,B0BHC6V1KT,"Arturia MiniFuse 4, 4-in/4-out USB-C Audio Interface with 2 Mic/Line/Instrument Preamps, 2 Line Inputs, 2 x 250mA USB-A Hub Ports, and Included Software Suite - Mac/PC (Black)",154,0,0.06%,0.00%,187,0,0.06%,0.00%,5.68%,0.00%,0,0,0.00%,0.00%,₹0.00,₹0.00,0,0
B0BHZH13QW,B0BHZH13QW,"Lewitt Connect 6 USB-C Audio Interface: 2 Mic Preamps, Dual Headphone Outputs, Loopback, DSP - for Podcasting, Streaming, Gaming, and Pro Recording - Compatible with Mac, PC, iOS, iPadOS, Android",509,4,0.21%,0.09%,590,4,0.18%,0.07%,0.00%,0.00%,0,0,0.00%,0.00%,₹0.00,₹0.00,0,0
B0BJSB3M9W,B0BJSB3M9W,"SE ELECTRONICS DM3 Dynamite Active Direct Box with -15dB/-30dB Pads, Ground Lift Switch, Perfect for for Live & Studio.",12,0,0.00%,0.00%,13,0,0.00%,0.00%,53.85%,0.00%,0,0,0.00%,0.00%,₹0.00,₹0.00,0,0
B0BLJVJ2GN,B0BLJVJ2GN,"Audio Array AA-05 Suspension Boom Scissor Microphone Arm Stand | Universal clamp with mic Holder & 3/8″ to 5/8″ Adapter for Shock mounts | Suitable for Stages, Studios, Broadcasting, TV Stations",767,25,0.31%,0.58%,"1,130",32,0.35%,0.54%,1.15%,6.25%,0,0,0.00%,0.00%,₹0.00,₹0.00,0,0
B0BLKB6FRR,B0BLKB6FRR,"Audio Array AM-C27 XLR to TRS Cardioid Dynamic Handheld Microphone Sound for Live Events | Premium Built with 4.5M Cable | Singing, Public Meetings, Studio Recording, Live Sound, Party",18,0,0.01%,0.00%,20,0,0.01%,0.00%,47.37%,0.00%,0,0,0.00%,0.00%,₹0.00,₹0.00,0,0
B0BLKF46QG,B0BLKF46QG,"Audio Array AM-C20 USB Microphone | Unique Tilt Stand & one Touch Mute | Plug n Play, No Latency Cardioid Pickup | for PC, Smartphones, iOS | Gaming, Streaming, Podcasts, Twitch, YouTube, Discord",134,1,0.05%,0.02%,189,1,0.06%,0.02%,0.62%,0.00%,0,0,0.00%,0.00%,₹0.00,₹0.00,0,0
B0BLNCP74M,B0BLNCP74M,"Audio Array AM-C25 Premium USB Condenser Microphone Kit with Boom Arm & Pop-Filter | No Latency Headphone Monitoring, Volume Control & Mute Button | Discord, Valorant, Gaming, Podcasting & Streaming",60,1,0.02%,0.02%,89,1,0.03%,0.02%,8.54%,0.00%,0,0,0.00%,0.00%,₹0.00,₹0.00,0,0
B0BPHWH5KV,B0BPHWH5KV,SE ELECTRONICS DynaCaster DCM3 Dynamic Broadcast Cardioid Microphone,7,1,0.00%,0.02%,18,1,0.01%,0.02%,12.50%,0.00%,0,0,0.00%,0.00%,₹0.00,₹0.00,0,0
B0BPLZ5CGV,B0BPLZ5CGV,Audio Array AI-04 2x2 Gen 3 Audio Interface | Premium Mic Pre-Amps | 48V Phantom Power | 24bit/192kHz Hi-Fi Recording | XLR/MIC/LINE inputs | Plug & Play-No Drivers | 2 in 3 out | Metal Body | Red,"7,767",139,3.13%,3.21%,"11,367",216,3.51%,3.62%,0.00%,0.00%,0,0,0.00%,0.00%,₹0.00,₹0.00,0,0
B0BPMN89NG,B0BPMN89NG,"Audio Array AM-C29 4 Pickup Pattern Professional USB Plug & Play Condenser Microphone | 3.5 mm No Latency Monitoring, Volume Control & Mute Button | For Conference, Gaming, Podcasting & Live Streaming",10,0,0.00%,0.00%,11,0,0.00%,0.00%,72.73%,0.00%,0,0,0.00%,0.00%,₹0.00,₹0.00,0,0
B0BQ7H7418,B0BQ7H7418,"Audio Array AA-06 Microphone Boom Arm with 35cm+35cm=70cm Adjustable Suspension Scissor Arm Stand, Shock Mount, Base Clamp, Pop-Filter, 3/8"" to 5/8"" Universal Screw Adapter, 4x Cable Ties",246,5,0.10%,0.12%,333,6,0.10%,0.10%,0.00%,0.00%,0,0,0.00%,0.00%,₹0.00,₹0.00,0,0
B0BRCR2QQ7,B0BRCR2QQ7,"TONOR USB Gaming Microphone, RGB Streaming Microfono Set, PC Podcast Recording Computer Mic for PS4/5, Discord, Twitch, Cardioid Condenser Mic with Adjustable Boom Arm Stand TC30S+",62,1,0.02%,0.02%,81,2,0.03%,0.03%,1.41%,0.00%,0,0,0.00%,0.00%,₹0.00,₹0.00,0,0
B0BRKDLXCD,B0BRKDLXCD,"RGB Boom Arm, TONOR Adjustable Mic Stand with RGB Light for HyperX QuadCast/Blue Yeti/Shure SM7B/Rode NT1, Rotatable Suspension Boom Scissor Stand for Gaming Streaming Podcasting YouTube Recording T90",154,3,0.06%,0.07%,211,3,0.07%,0.05%,2.54%,0.00%,0,0,0.00%,0.00%,₹0.00,₹0.00,0,0
B0BRKFP94K,B0BRKFP94K,"TONOR TD510 Dynamic Microphone, USB/XLR PC Microphone for Podcast, Recording, Live Streaming & Gaming, XLR Cardioid Studio Mic Music Voice-Over with Quick Mute, Headphone Output, Volume Control",296,10,0.12%,0.23%,448,15,0.14%,0.25%,1.03%,0.00%,0,0,0.00%,0.00%,₹0.00,₹0.00,0,0
B0C4YSV3XL,B0C4YSV3XL,Audio Array AM-W15 Dual Wireless Mic with Charging Case | Upto 16hr Battery Backup & 100m Range | Active Noise Cancellation | Informative LCD Screen | BIS & WPC Certified | 2 Yr Warranty,12,0,0.00%,0.00%,13,0,0.00%,0.00%,46.15%,0.00%,0,0,0.00%,0.00%,₹0.00,₹0.00,0,0
B0C4YT43Z3,B0C4YT43Z3,"Audio Array AM-C31 USB Plug & Play Condenser Microphone Kit | Pop-Filter & Metallic Base | 3.5 mm No Latency Monitoring, Volume Control & Mute Button | for PC/Mobile, Gaming, Podcasting & Streaming",47,1,0.02%,0.02%,63,1,0.02%,0.02%,50.88%,0.00%,0,0,0.00%,0.00%,₹0.00,₹0.00,0,0
B0C4YTNJG7,B0C4YTNJG7,"Audio Array AM-C30 Metal RGB Professional USB Microphone | One-Touch Mute, Gain & No-Latency Monitoring Controls | Shock Mount and Tripod | for PC/Mobile, Gaming, Streaming, Podcasting & Voiceover",115,3,0.05%,0.07%,140,3,0.04%,0.05%,2.96%,0.00%,0,0,0.00%,0.00%,₹0.00,₹0.00,0,0
B0C539RBGL,B0C539RBGL,"Audio Array AM-C32 Professional RGB USB Condenser Microphone with Tripod/Pop Filter & Shock Mount | No Latency Monitoring & Mute Button | For PC/Mobile, Gaming, Podcast, Streaming, Recording & Singing",9,0,0.00%,0.00%,13,0,0.00%,0.00%,100.00%,0.00%,0,0,0.00%,0.00%,₹0.00,₹0.00,0,0
B0C5957W3P,B0C5957W3P,"Audio Array AM-C33 Lapel Microphone | 1M Long, Strong Cable | 3.5mm TRRS | 3.5mm TRRS Port & TRRS to TRS Adapter | Omnidirectional Pickup | Mic Cover & Leather Carry Bag Included | 1 Year Warranty",6,0,0.00%,0.00%,7,0,0.00%,0.00%,0.00%,0.00%,0,0,0.00%,0.00%,₹0.00,₹0.00,0,0
B0C598Q6PT,B0C598Q6PT,"Audio Array AM-C36 Lapel Microphone | 1M Long & Strong Cable | 3.5mm TRRS| 3.5mm TRRS Port, TRRS to TRS & TRRS to USB Type C adapters | Omnidirectional Pickup | Mic Cover & Leather Bag Included",6,0,0.00%,0.00%,7,0,0.00%,0.00%,100.00%,0.00%,0,0,0.00%,0.00%,₹0.00,₹0.00,0,0
B0C624Y9YC,B0C624Y9YC,"Arturia KeyLab Essential 49 mk3 MIDI Controller with 49 Velocity-Sensitive keys, 9 Encoders, 9 Sliders, 8 RGB Pads - USB-C, Midi Out, LCD Screen, Bundled Software and DAW Integration - Black",512,8,0.21%,0.18%,593,14,0.18%,0.23%,15.69%,8.33%,0,0,0.00%,0.00%,₹0.00,₹0.00,0,0
B0C62DNLSB,B0C62DNLSB,"Arturia KeyLab Essential 61 mk3 MIDI Controller with 61 Velocity-Sensitive Keys, 9 Encoders, 9 Sliders, 8 RGB Pads - USB-C, Midi Out, LCD Screen, Bundled Software and DAW Integration - Black","1,606",8,0.65%,0.18%,"1,856",9,0.57%,0.15%,14.81%,0.00%,0,0,0.00%,0.00%,₹0.00,₹0.00,0,0
B0C891Q6YH,B0C891Q6YH,"PreSonus Eris Sub 8BT — 8-inch Active Studio Subwoofer with Bluetooth for Multimedia, Gaming, Studio-Quality Music Production",62,5,0.02%,0.12%,89,8,0.03%,0.13%,16.88%,20.00%,0,0,0.00%,0.00%,₹0.00,₹0.00,0,0
B0C8JDHLX9,B0C8JDHLX9,"TONOR T10 Microphone Boom Arm, Adjustable Microfono Stand Mic Arm with Extra-Large Pop Filter for HyperX Quadcast Blue Yeti Shure SM7B Rode Razer Seiren Mini SoloCast Elgato Wave, Recording Equipment",192,10,0.08%,0.23%,274,12,0.08%,0.20%,10.67%,10.00%,0,0,0.00%,0.00%,₹0.00,₹0.00,0,0
B0CBCB9S14,B0CBCB9S14,"Audio Array AM-C40 Large Diaphragm USB Condenser Microphone Kit | Boom Arm & Pop-Filter | 96kHz/24bit No Latency Headphone Monitoring with Mute & Volume Control Knob | Singing, Podcasting & Streaming",128,1,0.05%,0.02%,209,1,0.06%,0.02%,6.49%,0.00%,0,0,0.00%,0.00%,₹0.00,₹0.00,0,0
B0CC39ZJQP,B0CC39ZJQP,"PreSonus Eris Studio 4,4.5-Inch XLR High-Definition Professional Studio Monitor With Woven Composite Lf Driver Speaker,1"" Silk-Dome Hf Driver,Ebm Waveguide,And Acoustic Tuning Controls-Single(Black)",81,0,0.03%,0.00%,96,0,0.03%,0.00%,100.00%,0.00%,0,0,0.00%,0.00%,₹0.00,₹0.00,0,0
B0CC3BJKGN,B0CC3BJKGN,"PreSonus Eris 3.5 2nd Gen HD Professional Studio Monitors with 3.5"" Woven Composite Woofer, 1"" Silk-Dome Tweeter, 50W Class AB Power and Tuning Controls (Auxillary) - Pair (Black)","1,634",34,0.66%,0.78%,"2,426",55,0.75%,0.92%,2.88%,3.70%,0,0,0.00%,0.00%,₹0.00,₹0.00,0,0
B0CC3TDH61,B0CC3TDH61,"PreSonus Eris Studio 5, 5.25-Inch High-Definition Professional Studio Monitor with Woven Composite LF Driver, XLR, 1"" Silk-Dome HF Driver, EBM Waveguide, and Acoustic Tuning Controls - Single (Black)",618,13,0.25%,0.30%,792,15,0.24%,0.25%,5.95%,0.00%,0,0,0.00%,0.00%,₹0.00,₹0.00,0,0
B0CCV74CL7,B0CCV74CL7,"TONOR TC310+ RGB Condenser Mic with Boom Arm Quick Mute, RGB Lighting, Pop Filter, Shock Mount,Gaming USB Microphone Set for PC Gain Control for Streaming Podcasting Recording Discord Twitch YouTube",172,2,0.07%,0.05%,237,2,0.07%,0.03%,3.92%,0.00%,0,0,0.00%,0.00%,₹0.00,₹0.00,0,0
B0CCVBQRFX,B0CCVBQRFX,"TONOR USB/XLR Microphone, Broadcast-Quality Dynamic Studio PC Mic with Boom Arm for Podcasting Recording Gaming Music Streaming Singing Voice-Over Noise Rejection, with 3.5mm Headphones Jack TD510+",34,1,0.01%,0.02%,56,1,0.02%,0.02%,100.00%,100.00%,0,0,0.00%,0.00%,₹0.00,₹0.00,0,0
B0CDQ55W2M,B0CDQ55W2M,"nexlev Travel Neck Pillow | Orthopedic Premium Memory Foam | for Airplane, Car, Train, Office use & Cervical Pain | Machine Washable | 360 Support | Carry Pouch for Storage | NP-02",11,0,0.00%,0.00%,17,0,0.01%,0.00%,0.00%,0.00%,0,0,0.00%,0.00%,₹0.00,₹0.00,0,0
B0CDQ6G4TC,B0CDQ6G4TC,"nexlev Travel Neck Pillow | Orthopedic Premium Memory Foam | for Airplane, Car, Train, Office use & Cervical Pain | Machine Washable | 360 Support | Carry Pouch for Storage | NP-03",4,0,0.00%,0.00%,6,0,0.00%,0.00%,0.00%,0.00%,0,0,0.00%,0.00%,₹0.00,₹0.00,0,0
B0CDQ98FDM,B0CDQ98FDM,"nexlev Travel Neck Pillow | Orthopedic Premium Memory Foam | for Airplane, Car, Train, Office use & Cervical Pain | Machine Washable | 360 Support | Carry Pouch for Storage | NP-01",23,2,0.01%,0.05%,28,5,0.01%,0.08%,0.00%,0.00%,0,0,0.00%,0.00%,₹0.00,₹0.00,0,0
B0CF5R3V95,B0CF5R3V95,"Audio Array AA-19 2in1 High & Low Profile Mic Stand | 71cm reach | Premium Metal design with Built In Cable Management | Flexible Position adjustments | 2Kg Weight Capacity |5/8"" to 3/8"" Screw Adapter",502,25,0.20%,0.58%,683,52,0.21%,0.87%,0.00%,0.00%,0,0,0.00%,0.00%,₹0.00,₹0.00,0,0
B0CF5RRTDJ,B0CF5RRTDJ,"Audio Array AA-20 Microphone Arm Stand | 81cm Reach | Premium light weight & slick design | Flexible height & position adjustments | 1kg Weight Capacity | 5/8"" to 3/8"" Screw Adapter | Cable Ties",164,6,0.07%,0.14%,218,19,0.07%,0.32%,3.90%,0.00%,0,0,0.00%,0.00%,₹0.00,₹0.00,0,0
B0CF5TCQKL,B0CF5TCQKL,"Audio Array AA-21 Desktop Mount Speaker Stands | 15KG Capacity | Height, Tilt & Rotation Adjustable | Smart Cable Management | for Sound Editing, Gaming, Music Production | Black (Set of 2)",826,22,0.33%,0.51%,"1,153",29,0.36%,0.49%,0.10%,0.00%,0,0,0.00%,0.00%,₹0.00,₹0.00,0,0
B0CFKHCQ8W,B0CFKHCQ8W,"Tonor Mic Arm Desk Mount, Low Profile Boom Arm, Microphone Arm, Adjustable Mic Stand with Desk Mount Clamp, Cable Management, 3/8’’ and 5/8’’ Screwadapter for Most Microphone T20LP Black",123,5,0.05%,0.12%,143,6,0.04%,0.10%,100.00%,100.00%,0,0,0.00%,0.00%,₹0.00,₹0.00,0,0
B0CH4PMR8K,B0CH4PMR8K,"Audio Array AM-C41 Plug & Play AI Noise Cancellation USB Condenser Microphone | Mute Button/Echo/Volume Knob | Kit with Tripod, Mic Cover | Gaming, Streaming, Podcast | Mac/PC/Laptop/Mobile",230,2,0.09%,0.05%,349,3,0.11%,0.05%,0.00%,0.00%,0,0,0.00%,0.00%,₹0.00,₹0.00,0,0
B0CH4R1V6S,B0CH4R1V6S,"Audio Array AM-C3a Unidirectional Dynamic Handheld Karaoke Microphone | 20Hz - 20kHz Response | Karaoke Singing, Public Meetings, Studio Recording, Live Sound, Party (no Cable Included)",398,11,0.16%,0.25%,545,16,0.17%,0.27%,0.00%,0.00%,0,0,0.00%,0.00%,₹0.00,₹0.00,0,0
B0CH4RNWJX,B0CH4RNWJX,"Audio Array AM-C43 XLR to 3.5mm Professional Condenser Microphone Kit | Boom Arm, 2M Cable & Foam Filter | Compatible with Audio Interface, Mixer | Recording, Podcast, Streaming, Home Studio (Black)",167,2,0.07%,0.05%,264,3,0.08%,0.05%,0.00%,0.00%,0,0,0.00%,0.00%,₹0.00,₹0.00,0,0
B0CH4VCD6R,B0CH4VCD6R,"Audio Array AC-6XL Mic Cable 6.35mm Jack Male to XLR 3PIN Female Cord Wire | Microphone/Guitar Cable | Black, 1pc Pack (6 Meter/19.6 Feet)",454,12,0.18%,0.28%,676,18,0.21%,0.30%,0.00%,0.00%,0,0,0.00%,0.00%,₹0.00,₹0.00,0,0
B0CH9JR3HL,B0CH9JR3HL,"TONOR Top Ring Light Kit, 10 Inch Ring Light with Heavy Duty Bracket Arm and Phone Holder for Video Recording, Live Streaming, Drawing, Nail Makeup",7,1,0.00%,0.02%,8,1,0.00%,0.02%,100.00%,100.00%,0,0,0.00%,0.00%,₹0.00,₹0.00,0,0
B0CM6NVLT9,B0CM6NVLT9,"Audio Array AI-11 USB Bluetooth Soundcard, 1Ch Mixer, Audio Interface | 2 Condenser In, 2 Out |2 Live Out+1 Accompany In | OTG for mobile and PC/MAC | Effects | Streaming, Podcasting, Gaming, Singing","1,792",34,0.72%,0.78%,"2,748",76,0.85%,1.27%,0.26%,0.00%,0,0,0.00%,0.00%,₹0.00,₹0.00,0,0
B0CM6WH4ZT,B0CM6WH4ZT,"Audio Array AI-12 USB Bluetooth Soundcard | 1Ch Mixer interface | 2 mic inputs, 2 smartphone & PC/Mac outputs | Karaoke Recording, Mobile/PC Streaming, Live Broadcasting | Singing, Recording,Gaming","1,217",15,0.49%,0.35%,"1,645",16,0.51%,0.27%,0.00%,0.00%,0,0,0.00%,0.00%,₹0.00,₹0.00,0,0
B0CM9HYVDM,B0CM9HYVDM,"Audio Array AM-W18 Wireless Karaoke Speaker with Microphone | Portable Bluetooth Speaker for Singing & Gifting with Voice Changer | Upto 8+ Hours of Playback | Bluetooth v5.3, SD Card & AUX in (Pink)","1,087",12,0.44%,0.28%,"1,575",19,0.49%,0.32%,0.15%,0.00%,0,0,0.00%,0.00%,₹0.00,₹0.00,0,0
B0CM9KJZWQ,B0CM9KJZWQ,"Audio Array AM-C44 XLR/USB Professional Dynamic Podcast Microphone | Built-in Monitoring | One Touch Mute & Volume Control | 192kHz/24bit Full Metal Build | 2M XLR & USB Cable | Streaming, Podcasting",419,7,0.17%,0.16%,649,9,0.20%,0.15%,0.69%,0.00%,0,0,0.00%,0.00%,₹0.00,₹0.00,0,0
B0CM9P5CCK,B0CM9P5CCK,"Audio Array AM-W17 Dual Wireless Lapel Mic|in-Built ANC, Plug N Play,Long Battery Life, Ultra-Low Latency,Upto 30M Range|Compatible with iPhone & Android|Vlogging, Streaming, Teaching,YouTube, Black",312,8,0.13%,0.18%,424,8,0.13%,0.13%,4.33%,0.00%,0,0,0.00%,0.00%,₹0.00,₹0.00,0,0
B0CPFS24ML,B0CPFS24ML,"White Mulberry Gaming Desk, Computer Desk with Carbon Fiber Surface, Z Shaped Gaming Table, Computer Table, Workstation, Home Office Desk with Cup Holder and Headphone Holder | (117 * 67 * 71 CM)","4,147",97,1.67%,2.24%,"6,016",153,1.86%,2.56%,0.93%,0.00%,0,0,0.00%,0.00%,₹0.00,₹0.00,0,0
B0CS3K2S7X,B0CS3K2S7X,"MAONO USB Audio interface for PC with 60 dB Pro-preamp, 24bit/192kHz, Dual USB interface for PC&Smartphone, Routing Software for Home Recording, Music Production, Guitar, Podcast, Streaming(PS22)",5,0,0.00%,0.00%,8,0,0.00%,0.00%,37.50%,0.00%,0,0,0.00%,0.00%,₹0.00,₹0.00,0,0
B0CX1XK5R6,B0CX1XK5R6,Audio Array AM-W46 Groove Wireless Bluetooth 5.3 Bookshelf Speaker 30W | 5400mAh upto 24h Long Battery | 3 EQ Modes | Stylish Premium Metal Body | Superior Bass Quality,571,10,0.23%,0.23%,687,10,0.21%,0.17%,27.74%,12.50%,0,0,0.00%,0.00%,₹0.00,₹0.00,0,0
B0D25LNDSY,B0D25LNDSY,Nexlev Electric Toothbrush|40000 vibrations/minute| USB Type C| 5 Modes| 2 Min timer| 30 sec Quad Interval| 4 Replaceable Brush Heads With Cover| IPX7 Waterproof| For Adults|Sparkle Pro ETC-04 White,17,0,0.01%,0.00%,19,0,0.01%,0.00%,0.00%,0.00%,0,0,0.00%,0.00%,₹0.00,₹0.00,0,0
B0D2LD6BYJ,B0D2LD6BYJ,"NexLev 6-in-1 trimmer | Sensitive Bikini Trimmer for Women | Skin Safe with Rounded Tips & Foil Shaver| Hair Removal for Intimate Areas, Face, Arms, Legs & Body | 90 min Runtime |2H Quick Charge |T-02",196,2,0.08%,0.05%,272,2,0.08%,0.03%,1.66%,0.00%,0,0,0.00%,0.00%,₹0.00,₹0.00,0,0
B0D2LFMY48,B0D2LFMY48,"Nexlev Hair Styling Straightener & Curler| 2 in 1 Hair Styler| 200°C in 30 Seconds| Long Ceramic Floating Plates| Rounded Body for Curls| Plate Lock| Portable HS-01, Hair Straightener Tong - Black",231,0,0.09%,0.00%,253,0,0.08%,0.00%,0.00%,0.00%,0,0,0.00%,0.00%,₹0.00,₹0.00,0,0
B0D2LGR3GG,B0D2LGR3GG,"NexLev 6-in-1 trimmer | Sensitive Bikini Trimmer for Women | Skin Safe with Rounded Tips & Safety Guards| Hair Removal for Intimate Areas, Face, Arms, Legs & Body | 90 min Runtime | Type C | T-01",125,1,0.05%,0.02%,172,1,0.05%,0.02%,0.00%,0.00%,0,0,0.00%,0.00%,₹0.00,₹0.00,0,0
B0D2LJSQXZ,B0D2LJSQXZ,NexLev Steam Mop | Chemical Free Mopping | Floor Cleaning + Carpet Steaming | 4 Extra Mop Pads | 400 ML | 1300W | Floor Disinfectant | for All Floor Types | 4mtr Long Cord | Wet & Dry Mopping | SM-01,834,17,0.34%,0.39%,"1,109",25,0.34%,0.42%,0.00%,0.00%,0,0,0.00%,0.00%,₹0.00,₹0.00,0,0
B0D2LKB4BJ,B0D2LKB4BJ,"Nexlev Hair Styling Straightener & Curler| 2 in 1 Hair Styler| 200°C in 30 Seconds| Long Ceramic Floating Plates| Rounded Body for Curls| Plate lock| Portable |HS-02, Hair Straightener Tong - Purple",252,0,0.10%,0.00%,293,0,0.09%,0.00%,76.56%,0.00%,0,0,0.00%,0.00%,₹0.00,₹0.00,0,0
B0D2P5TGWK,B0D2P5TGWK,NexLev Smart Electric Toothbrush for Adults | 2-Min Timer with Quadpacer | 2 Replaceable Heads | AAA Battery | 3 Cleaning Modes | Upto 60 Days | Waterproof | Travel Case | Soft Bristles | ET-01 Black,410,8,0.17%,0.18%,587,9,0.18%,0.15%,4.27%,0.00%,0,0,0.00%,0.00%,₹0.00,₹0.00,0,0
B0D3LZWTHV,B0D3LZWTHV,"Audio Array AM-C45 XLR/USB Professional RGB Dynamic Podcast Microphone | Built-in Monitoring | One Touch Mute Volume & Noise-Cancellation | 2M USB Cable & Metal Base | Streaming, Podcasting, Singing",673,6,0.27%,0.14%,994,9,0.31%,0.15%,0.81%,0.00%,0,0,0.00%,0.00%,₹0.00,₹0.00,0,0
B0D3Q2T5XX,B0D3Q2T5XX,Audio Array AA-19WL RGB Low Profile Boomarm Stand with Riser | 71cm reach & 20 RGB lighting effects & Built-In Cable Management | Matte finish with Flexible adjustments | 2Kg Weight Capacity | White,377,11,0.15%,0.25%,468,15,0.14%,0.25%,0.00%,0.00%,0,0,0.00%,0.00%,₹0.00,₹0.00,0,0
B0D63FKYZ5,B0D63FKYZ5,NexLev Scalp Massager for Stress Relief | Head Massager for Hair Growth | 96 Tangle Free Silicone Kneading Nodes | Hand Like Massage | 120 Min Runtime | Type C | Washable Heads | 3 Modes | HM-01,86,2,0.03%,0.05%,103,2,0.03%,0.03%,0.00%,0.00%,0,0,0.00%,0.00%,₹0.00,₹0.00,0,0
