(Parent) ASIN,(Child) ASIN,Title,Sessions - Total,Sessions - Total - B2B,Session Percentage - Total,Session Percentage - Total - B2B,Page Views - Total,Page Views - Total - B2B,Page Views Percentage - Total,Page Views Percentage - Total - B2B,Featured Offer Percentage,Featured Offer Percentage - B2B,Units Ordered,Units Ordered - B2B,Unit Session Percentage,Unit Session Percentage - B2B,Ordered Product Sales,Ordered Product Sales - B2B,Total Order Items,Total Order Items - B2B
B0D81DLSFT,B0D81DLSFT,"nexlev Hair Dryer For Women| Foldable| 1500 Watts| Cool Shot| 3 Heat & 2 Speed Settings| Overheat Protection| Concentrator Nozzle| Salon-Style Blow Dry| Just Style (Hd-02 Women), Black & Copper",99,2,0.04%,0.05%,122,2,0.04%,0.03%,4.24%,0.00%,0,0,0.00%,0.00%,₹0.00,₹0.00,0,0
B0D83Q7L8W,B0D83Q7L8W,"NexLev Ionic Hot Air Brush | 3 in 1 Blow Dryer, Straightener, Volumizer & Styler | 360° Airflow Vents | Ceramic Tourmaline Coated Brushing Head | Tangle Free Bristle |3 Speed & 2 Heat Settings | V-01",216,2,0.09%,0.05%,327,2,0.10%,0.03%,8.87%,0.00%,0,0,0.00%,0.00%,₹0.00,₹0.00,0,0
B0D8445KJN,B0D8445KJN,"NexLev Lint Remover | For Woolen Sweaters Shirts Socks Jackets Suede Leggings | Pill, Rue & Burr Remover | 30 Min Use |Type C |Defuzzer | Lint Brush for Coat | 2 Modes | SS Blade | Safety Lock | LR-01",226,6,0.09%,0.14%,268,8,0.08%,0.13%,0.00%,0.00%,0,0,0.00%,0.00%,₹0.00,₹0.00,0,0
B0D845B2DG,B0D845B2DG,"NexLev Lint Remover | for Woolen Sweaters Shirts Socks Jackets Suede Leggings Curtains & Carpets | Pill, Rue & Burr Remover | 120 Min Use |TypeC | Lint Brush for Coat| SS Blade | Safety Lock | LR-02",544,13,0.22%,0.30%,705,17,0.22%,0.28%,0.96%,0.00%,0,0,0.00%,0.00%,₹0.00,₹0.00,0,0
B0D86ZC9YT,B0D86ZC9YT,Nexlev Just Style Pro Hair Dryer |2100 W for Quick & Easy Blowdry | Double Heat Protection Technology | 3 Heat Settings & Cool Shot Function For Salon-Like Styling at Home (HD-01),127,3,0.05%,0.07%,148,3,0.05%,0.05%,7.25%,50.00%,0,0,0.00%,0.00%,₹0.00,₹0.00,0,0
B0D9KCNVNM,B0D9KCNVNM,Nexlev Oscillating Electric Toothbrush | 8000 vibrations/min | USB Type C Charging|3 modes| 2 Minute Timer |Quad Change Reminder| IPX7 Waterproof | For adults| 1 year warranty| |Sparkle Pro (ETR-06),104,3,0.04%,0.07%,148,4,0.05%,0.07%,2.24%,0.00%,0,0,0.00%,0.00%,₹0.00,₹0.00,0,0
B0D9KDQCCM,B0D9KDQCCM,Nexlev Portable Sewing Machine| 2 Speed Settings| Cordless| Battery operated| USB Type C cord for Plug-in| Quick Fix DIY|Portable & Compact| for all Fabrics| 1 Year Warranty| White,485,10,0.20%,0.23%,717,12,0.22%,0.20%,0.00%,0.00%,0,0,0.00%,0.00%,₹0.00,₹0.00,0,0
B0D9KFP4MG,B0D9KFP4MG,NexLev Ionic Hair Straightener Brush |Frizz-Free Straightening upto 12 H |Ceramic Tourmaline Coated| 60mm Wide Brush | 130-210° |Keratin Bristles| Thermo Protect Technology |No Scalp Burn|1500W|HSB-03,821,4,0.33%,0.09%,"1,119",5,0.35%,0.08%,0.52%,0.00%,0,0,0.00%,0.00%,₹0.00,₹0.00,0,0
B0D9KFQG8Q,B0D9KFQG8Q,"Nexlev Skin Scrubber |Red & Blue LED Therapy| Blackhead Remover| Pore Cleaner| Skin Lifting & tightening, wrinkle remover| 2 Silicone Cleaning Heads| Facial Cleansing|Type C Charging| Elixir Pro LE-03",148,2,0.06%,0.05%,160,2,0.05%,0.03%,0.00%,0.00%,0,0,0.00%,0.00%,₹0.00,₹0.00,0,0
B0DCGHKRXX,B0DCGHKRXX,NexLev LED Phototherapy comb | Electric Scalp Massager | Red Light for Regrowth | Blue Light for Anti Dandruff | Hairfall Control | Rechargeable TypeC | Targeted Laser Treatment Machine |3 Modes |LE-02,"5,271",19,2.12%,0.44%,"6,685",23,2.07%,0.39%,1.38%,0.00%,0,0,0.00%,0.00%,₹0.00,₹0.00,0,0
B0DCK4DR1B,B0DCK4DR1B,Nexlev Skin Lift Device | 7 Color LED | Face & Neck Skin Lifting| 3 Massage Modes| Face Sculpting Tool |Micro-currents to reduce Wrinkles| Hot Compress | Rechargeable| Type-C| 180 Min Use| Glow+ LE-04,228,6,0.09%,0.14%,293,7,0.09%,0.12%,1.95%,0.00%,0,0,0.00%,0.00%,₹0.00,₹0.00,0,0
B0DCK56Q85,B0DCK56Q85,"NexLev Cordless Vacuum Cleaner|HEPA with Stainless Steel Cover|6000 mAh|Copper Motor| Rechargeable Type C|Ideal for Home, Office & Car Use|Compact & Portable|Dust & Pet Hair Remover|3 Attachment|VC-02",371,3,0.15%,0.07%,544,4,0.17%,0.07%,0.21%,0.00%,0,0,0.00%,0.00%,₹0.00,₹0.00,0,0
B0DDC3GVZW,B0DDC3GVZW,nexlev Cordless Electric Car Vacuum Cleaner VacuSafe| Seat-Belt Cutter| Window Breaker Hammer| LED Torch|4000 mAh| High Power Suction | Copper Motor| Type-C Emergency Car Escape Tool| Portable| VC-03,103,1,0.04%,0.02%,116,1,0.04%,0.02%,0.00%,0.00%,0,0,0.00%,0.00%,₹0.00,₹0.00,0,0
B0DFCDKMWR,B0DFCDKMWR,NexLev Cordless Electric Heating Pad| Period Cramp & Back Pain Relief Massager | 9 modes| Menstrual Cramp Relief|Type C| Crampfree Periods | Portable | Gift for Women| Strap upto 40 Inch |Blue CM-01,739,23,0.30%,0.53%,"1,080",39,0.33%,0.65%,0.21%,0.00%,0,0,0.00%,0.00%,₹0.00,₹0.00,0,0
B0DFM4JZV9,B0DFM4JZV9,"Nexlev Tyre Inflator for Car | Touch Control |150 PSI |12V DC| 4 Nozzles | Digital Tyre Pressure Gauge| Carry Bag | Suitable for Bike, Bicycle or Any Inflatable | Emergency LED Light | TI-01",33,0,0.01%,0.00%,45,0,0.01%,0.00%,0.00%,0.00%,0,0,0.00%,0.00%,₹0.00,₹0.00,0,0
B0DFMKY4TT,B0DFMKY4TT,"Audio Array AM-W35 UHF Dual Wireless Premium Karaoke Microphones | 800mah 5-6 Hours Battery Backup | Range up to 50M | Karaoke Singing, Wedding, DJ, Church | PA System, Amplifier, Mixer, Party Box","1,662",16,0.67%,0.37%,"1,942",18,0.60%,0.30%,0.72%,7.69%,0,0,0.00%,0.00%,₹0.00,₹0.00,0,0
B0DFMMTWLY,B0DFMMTWLY,"Audio Array AM-W33 UHF Metal Solo Wireless Microphone Set | 2000mAh 6-8 Hours Battery Backup | Range up to 50M | Karaoke Singing, Wedding, DJ, Church | PA System, Amplifier, Mixer, Party Box",733,24,0.30%,0.55%,"1,060",44,0.33%,0.74%,0.11%,4.00%,0,0,0.00%,0.00%,₹0.00,₹0.00,0,0
B0DFMQCGT1,B0DFMQCGT1,"Audio Array AM-W21 Wireless Microphone Kit | Built in Recording, Noise Reduction & Echo | Smartphones, Cameras, Laptops | Dual-Channel Recording, 200 feet Transmission Range, 48-Hour Battery Life",38,0,0.02%,0.00%,46,0,0.01%,0.00%,0.00%,0.00%,0,0,0.00%,0.00%,₹0.00,₹0.00,0,0
B0DFMRG2K4,B0DFMRG2K4,"NexLev All in One Body Trimmer for Men | Suitable for Beard, Body, Balls, Pubic Hair, Private Parts | 90 Min Runtime |Type C | IPX 7 Waterproof | No Nicks No Cuts | 2 Safety Combs| Extra Blade | TM-02",114,3,0.05%,0.07%,138,4,0.04%,0.07%,0.00%,0.00%,0,0,0.00%,0.00%,₹0.00,₹0.00,0,0
B0DJFH4K8B,B0DJFH4K8B,NexLev Cordless Tyre Inflator for Cars & Bikes|150 PSI| 2x2000 mAh Powerbank| Type-C Port| 5 Pre Set Mode|Auto Shut-Off |Digital Display| LED Light | Multiple Nozzles| AER Pro TIC-03,86,1,0.03%,0.02%,111,1,0.03%,0.02%,1.03%,0.00%,0,0,0.00%,0.00%,₹0.00,₹0.00,0,0
B0DJFH6RTL,B0DJFH6RTL,"NexLev Portable Tyre Inflator for Car, Bike, Cycle|150 PSI Pressure| 120 Watt Air Pump|12V Car Plug| Digital Display| Auto Shut-Off| Emergency LED Light| 3m Cord| 3 Air Nozzles| Compact| AER TI-02",40,0,0.02%,0.00%,54,0,0.02%,0.00%,0.00%,0.00%,0,0,0.00%,0.00%,₹0.00,₹0.00,0,0
B0DJFJZMC6,B0DJFJZMC6,"Nexlev Cordless & Corded Tyre Inflator|150 PSI| 6000 mAh Powerbank|LED Light | Type C Port |Digital Display| 5 Pre-Set Modes|Auto Shut-Off |Multiple Nozzles for Cars, Bikes, Cycle| AER Pro Max TIC-04",62,2,0.02%,0.05%,75,2,0.02%,0.03%,0.00%,0.00%,0,0,0.00%,0.00%,₹0.00,₹0.00,0,0
B0DK9NRBWJ,B0DK9NRBWJ,NexLev Intimate Trimmer for Men|Ceramic Blade|120 Min Runtime|Type C Charge | IPX7 Waterproof | 7000RPM Copper Motor| Cordless|LED Light| Travel Lock| Wet/Dry Groin & Body Shaver | Intimate Pro TM-03,34,1,0.01%,0.02%,56,1,0.02%,0.02%,0.00%,0.00%,0,0,0.00%,0.00%,₹0.00,₹0.00,0,0
B0DKJSCLBD,B0DKJSCLBD,"NexLev Cordless Wet & Dry Vacuum Cleaner|For Home Car & Office Use|3 Attachments |HEPA to capture dust | 4000 mAh Battery|Quick Cleaning of Desk, Coffee tea or Water Spill | Compact & Portable | VC-05",335,4,0.13%,0.09%,432,5,0.13%,0.08%,2.00%,0.00%,0,0,0.00%,0.00%,₹0.00,₹0.00,0,0
B0DKJZDY72,B0DKJZDY72,nexlev Cordless Vacuum Cleaner & Blower |BLDC Copper Motor |HEPA with Stainless Steel Cover | for Home Office & Car Cleaning|4 Attachments | Blower for Dust & Inflatables | Portable & Compact | VC-04,99,2,0.04%,0.05%,118,2,0.04%,0.03%,3.77%,0.00%,0,0,0.00%,0.00%,₹0.00,₹0.00,0,0
B0DNJF1BLS,B0DNJF1BLS,nexlev Drip Coffee Maker |Filter Coffee for Home & Office | 4-6 Cups | Warming Plate|Borosilicate Carafe | Reusable & Washable Filter | Anti Drip | 750 ml | Cone Filter | Water Level Indicator |CF-01,135,5,0.05%,0.12%,180,7,0.06%,0.12%,1.97%,0.00%,0,0,0.00%,0.00%,₹0.00,₹0.00,0,0
B0DNJJKBKG,B0DNJJKBKG,NexLev Neck & Back Massager | Deep Tissue Shiatsu Roller | Cervical Pain Relief | 3 Speeds | 8 Kneading Nodes | Quick Pain Relief | Auto Shut Off | 1 year Warranty | BM-02,56,1,0.02%,0.02%,73,1,0.02%,0.02%,1.56%,0.00%,0,0,0.00%,0.00%,₹0.00,₹0.00,0,0
B0DP32F346,B0DP32F346,White Mulberry |DIY| Woodcraft - Premium Wooden Arm | Desk Mounted Monitor arm 15-32 Inch Monitor|9Kg Screen Capacity|Spring Assisted Premium Wooden Metal Desk Mount-(Single Screen),454,30,0.18%,0.69%,605,39,0.19%,0.65%,23.12%,7.69%,0,0,0.00%,0.00%,₹0.00,₹0.00,0,0
B0DQ8W1RBV,B0DQ8W1RBV,"NexLev Ionic Hot Air Brush | 3 in 1 Blow Dryer, Straightener, Volumizer & Styler | 360° Airflow Vents | Ceramic Tourmaline Coated Brushing Head | Tangle Free Bristle |3 Speed & 2 Heat Settings|V-01RG",673,4,0.27%,0.09%,"1,034",8,0.32%,0.13%,0.55%,0.00%,0,0,0.00%,0.00%,₹0.00,₹0.00,0,0
B0DTK4FY1G,B0DTK4FY1G,"NexLev Spin Scrubber with Soap Spray | 6 heads| For Kitchen, Tub, Glass, Complete cleaning tool for Home, Office & Car| 90 min runtime | 4500 mAh | Cordless Type C | Adjustable Handle|SS-01, White",291,2,0.12%,0.05%,374,4,0.12%,0.07%,6.93%,0.00%,0,0,0.00%,0.00%,₹0.00,₹0.00,0,0
B0DV8XH455,B0DV8XH455,NexLev Shiatsu Neck Shoulder & Back Massager | 8 Kneading Nodes | 4 Modes | Deep Tissue Massage for Cervical Pain Relief | Adjustable & Hands free Design | Portable | Deep Tissue Relief | BM-03,14,1,0.01%,0.02%,17,1,0.01%,0.02%,100.00%,0.00%,0,0,0.00%,0.00%,₹0.00,₹0.00,0,0
B0DVCDD5VC,B0DVCDD5VC,"nexlev Travel Neck Pillow | Orthopedic Premium Memory Foam | for Airplane, Car, Train, Office use & Cervical Pain | Machine Washable | 360 Support | Carry Pouch for Storage | NP-07",12,0,0.00%,0.00%,16,0,0.00%,0.00%,0.00%,0.00%,0,0,0.00%,0.00%,₹0.00,₹0.00,0,0
B0F2HYY7JF,B0F2HYY7JF,"Audio Array AM-W21 Dual Wireless Lapel Microphones | TFT Card Recording, Noise Cancellation & Echo | Android, iOS, DSLR, Laptops | 360° Pickup, Plug n Play, 60M Working Range, 48-Hour Battery Life",56,4,0.02%,0.09%,81,4,0.03%,0.07%,5.33%,33.33%,0,0,0.00%,0.00%,₹0.00,₹0.00,0,0
B0FCCHV183,B0FCCHV183,Nexlev Steam Cleaner SC-02 & Accessories Variation,2,0,0.00%,0.00%,2,0,0.00%,0.00%,0.00%,0.00%,0,0,0.00%,0.00%,₹0.00,₹0.00,0,0
B0FH43M37N,B0FH43M37N,"Nektar Impact LX49 mk3 MIDI Keyboard Controller | 49 Key Velocity-Sensitive Keyboard with DAW Integration, Pads, Faders, Encoders, Scale & Chord Mode, NKS Support, Compatible with Mac/PC",751,12,0.30%,0.28%,969,23,0.30%,0.39%,21.95%,23.53%,0,0,0.00%,0.00%,₹0.00,₹0.00,0,0
B0FH475LZZ,B0FH475LZZ,"Nektar Impact LX61 mk3 MIDI Keyboard Controller | 61 Key Velocity-Sensitive Keyboard with DAW Integration, Pads, Faders, Encoders, Scale & Chord Mode, NKS Support, Compatible with Mac/PC",138,1,0.06%,0.02%,175,1,0.05%,0.02%,0.00%,0.00%,0,0,0.00%,0.00%,₹0.00,₹0.00,0,0
B0FJ1ZB4G9,B0FJ1ZB4G9,Nexlev Electric Toothbrush| 40000 vibrations/min|USB Type C| 5 Modes| 2 Min timer| 30 sec Quad Interval| 4 Replaceable Brush Heads With Cover| IPX7 Waterproof| For Adults| ETC-08 MidNight Blue,44,0,0.02%,0.00%,64,0,0.02%,0.00%,0.00%,0.00%,0,0,0.00%,0.00%,₹0.00,₹0.00,0,0
B0FJ8SFNRH,B0FJ8SFNRH,"NexLev Grand Electric Water Kettle | 1.8 L | 1500 Watts | Stainless Steel | For Home, Office | Auto Cut Off | For Boiling Water, making Tea & Coffee, Instant Noodles, Soup | Cool Touch Handle |KE-03",11,1,0.00%,0.02%,13,3,0.00%,0.05%,0.00%,0.00%,0,0,0.00%,0.00%,₹0.00,₹0.00,0,0
B0FN4FHH5Y,B0FN4FHH5Y,"White Mulberry Dual Screen POS Machine Stand for 17""-32"" Monitors(9kg) w/Card Reader, Printer & Barcode Scanner Holders| VESA 75x75/100x100 Compatible| Adjustable Tilt, Swivel & Rotation| Grommet Base",19,2,0.01%,0.05%,23,2,0.01%,0.03%,100.00%,100.00%,0,0,0.00%,0.00%,₹0.00,₹0.00,0,0
B0FN4HDBN5,B0FN4HDBN5,"White Mulberry Single Screen POS Machine Stand w/Keyboard Tray, Card Reader, Printer, Barcode Scanner Holder| Fits 17""-32"" Monitors (9kg), VESA 75x75/100x100| Height Adjustable Pole, Cable Management",15,1,0.01%,0.02%,18,1,0.01%,0.02%,100.00%,100.00%,0,0,0.00%,0.00%,₹0.00,₹0.00,0,0
B0FNR244QP,B0FNR244QP,White Mulberry TV Wall Mount Variation,1,0,0.00%,0.00%,1,0,0.00%,0.00%,0.00%,0.00%,0,0,0.00%,0.00%,₹0.00,₹0.00,0,0
B0FPR7VFCH,B0FPR7VFCH,"Audio Array AM-W19 Wireless Lavalier Microphone|192kHz/24bit |AI Noise Cancellation for iPhone/Android, 32h Charging Case, Plug & Play for Vlogging, Streaming, Meetings, Video Recording",681,13,0.27%,0.30%,936,17,0.29%,0.28%,1.45%,0.00%,0,0,0.00%,0.00%,₹0.00,₹0.00,0,0
B0FQJWWDVK,B0FQJWWDVK,"Audio Array AC-3XL Mic Cable 6.35mm Jack Male to XLR 3PIN Female Cord Wire | Microphone/Guitar Cable | Black, 1pc Pack (3 Meter/10 Feet)",118,4,0.05%,0.09%,154,4,0.05%,0.07%,1.45%,0.00%,0,0,0.00%,0.00%,₹0.00,₹0.00,0,0
B0FS6TB7CP,B0FS6TB7CP,NexLev Portable Blender for Smoothies Milkshakes Crushing Ice Juices | 6 Leaf Stainless Steel Blade | 3000 mAh Battery | Type C Rechargeable | Mix Fruit Juicer | 450ml | For Kitchen & Travel | PB-01,"1,144",13,0.46%,0.30%,"1,481",19,0.46%,0.32%,1.52%,0.00%,0,0,0.00%,0.00%,₹0.00,₹0.00,0,0
B0FY62L381,B0FY62L381, ,6,0,0.00%,0.00%,6,0,0.00%,0.00%,0.00%,0.00%,0,0,0.00%,0.00%,₹0.00,₹0.00,0,0
B0FZB1SSRV,B0FZB1SSRV,Nexlev AP-01 & AP-03 Air Purifier & Accessories Variation,1,0,0.00%,0.00%,1,0,0.00%,0.00%,0.00%,0.00%,0,0,0.00%,0.00%,₹0.00,₹0.00,0,0