(Parent) ASIN,(Child) ASIN,Title,Sessions - Total,Sessions - Total - B2B,Session Percentage - Total,Session Percentage - Total - B2B,Page Views - Total,Page Views - Total - B2B,Page Views Percentage - Total,Page Views Percentage - Total - B2B,Featured Offer Percentage,Featured Offer Percentage - B2B,Units Ordered,Units Ordered - B2B,Unit Session Percentage,Unit Session Percentage - B2B,Ordered Product Sales,Ordered Product Sales - B2B,Total Order Items,Total Order Items - B2B
B07WLWN2ZT,B07WLWN2ZT,"TONOR USB Gaming Microphone, Computer Condenser PC Mic with Tripod Stand & Pop for Streaming, Podcasting, Vocal Recording, Compatible with iMac PC Laptop Desktop Windows Computer, TC-777",547,8,0.24%,0.17%,735,11,0.24%,0.17%,3.05%,0.00%,0,0,0.00%,0.00%,₹0.00,₹0.00,0,0
B084CG2ZVZ,B084CG2ZVZ,Fossil Stainless Steel Analog Black Dial Men's Watch (Grey),395,8,0.17%,0.17%,528,12,0.17%,0.18%,84.76%,75.00%,0,0,0.00%,0.00%,₹0.00,₹0.00,0,0
B086K654H9,B086K654H9,"Fossil Gwen Analogue Women's Watch (Gold Dial Womens Standard Colored)-Es4879 Gold Plated, Gold Strap - Gold-Plated",0,0,0.00%,0.00%,0,0,0.00%,0.00%,0.00%,0.00%,0,0,0.00%,0.00%,₹0.00,₹0.00,0,0
B088NYP2LX,B088NYP2LX,"MVMT Stainless Steel Caviar Analog Black Dial Men Watch-28000052-D, Black Band",2,0,0.00%,0.00%,2,0,0.00%,0.00%,100.00%,0.00%,0,0,0.00%,0.00%,₹0.00,₹0.00,0,0
B088NZCC28,B088NZCC28,MVMT Caviar Quartz Black Round Dial Men's Watch - 28000053-D,4,0,0.00%,0.00%,4,0,0.00%,0.00%,100.00%,0.00%,0,0,0.00%,0.00%,₹0.00,₹0.00,0,0
B08BCLYN66,B08BCLYN66,Armani Exchange Gold Quartz Stainless Steel Watch AX5734,93,2,0.04%,0.04%,118,2,0.04%,0.03%,91.26%,100.00%,0,0,0.00%,0.00%,₹0.00,₹0.00,0,0
B08CVP2HXP,B08CVP2HXP,"TONOR USB Microphone, Condenser Computer PC Mic with Tripod Stand, Metal,Pop Filter, Shock Mount for Gaming,Streaming,Podcasting,YouTube, Voice Over,Skype, Twitch,Compatible with Laptop Desktop, TC30",460,8,0.20%,0.17%,619,9,0.20%,0.14%,3.73%,0.00%,0,0,0.00%,0.00%,₹0.00,₹0.00,0,0
B08LNJ6Z9H,B08LNJ6Z9H,"PreSonus Revelator USB-C Microphone for podcasting, live streaming, with built-in voice effects plus loopback mixer for gaming, casting, and recording interviews over Skype, Zoom, Discord",4,0,0.00%,0.00%,4,0,0.00%,0.00%,100.00%,0.00%,0,0,0.00%,0.00%,₹0.00,₹0.00,0,0
B08R6P2518,B08R6P2518,Fossil Men Leather Everett Black Card Case Ml4398001,342,12,0.15%,0.25%,412,13,0.13%,0.20%,97.45%,100.00%,0,0,0.00%,0.00%,₹0.00,₹0.00,0,0
B08XBYKWW3,B08XBYKWW3,Emporio Armani Diver Analog Green Dial Men's Watch-AR11338,228,4,0.10%,0.08%,270,4,0.09%,0.06%,98.40%,100.00%,0,0,0.00%,0.00%,₹0.00,₹0.00,0,0
B094R8FJ6J,B094R8FJ6J,Michael Kors Analog Men Alek Silver Dial Two Tone Watch MK9183,252,5,0.11%,0.10%,371,6,0.12%,0.09%,84.64%,75.00%,0,0,0.00%,0.00%,₹0.00,₹0.00,0,0
B09BBK2LV4,B09BBK2LV4,"Emporio Armani Analog Black Dial Men's Watch-AR11360 Stainless Steel, silver Strap",363,6,0.16%,0.12%,421,6,0.14%,0.09%,69.17%,100.00%,0,0,0.00%,0.00%,₹0.00,₹0.00,0,0
B09CSXR4TR,B09CSXR4TR,Armani Exchange A?X Analog Black Dial Women's Stainless Steel Watch-Ax5911,164,1,0.07%,0.02%,207,1,0.07%,0.02%,67.89%,100.00%,0,0,0.00%,0.00%,₹0.00,₹0.00,0,0
B09GYMBKMQ,B09GYMBKMQ,Armani Exchange Black Watch AX2429,302,4,0.13%,0.08%,436,4,0.14%,0.06%,100.00%,100.00%,0,0,0.00%,0.00%,₹0.00,₹0.00,0,0
B09NC2NFR9,B09NC2NFR9,Fossil Machine Analog Black Dial Men's Watch-FS5901,161,0,0.07%,0.00%,232,0,0.08%,0.00%,89.80%,0.00%,0,0,0.00%,0.00%,₹0.00,₹0.00,0,0
B0B4KC7VBM,B0B4KC7VBM,"Audio Array AM-C5 USB Plug & Play Conference Mic for Mac OS & Windows | Conference, Recording, Skype, Online Class with Range Upto 5M | One Touch Mute Button & Light Indicator (NOT A Speaker)",372,25,0.16%,0.52%,500,35,0.16%,0.53%,0.88%,0.00%,0,0,0.00%,0.00%,₹0.00,₹0.00,0,0
B0B75LLWV6,B0B75LLWV6,Emporio Armani Analog White Dial Women's Watch-AR11484,30,2,0.01%,0.04%,32,2,0.01%,0.03%,100.00%,100.00%,0,0,0.00%,0.00%,₹0.00,₹0.00,0,0
B0BPLZ5CGV,B0BPLZ5CGV,Audio Array AI-04 2x2 Gen 3 Audio Interface | Premium Mic Pre-Amps | 48V Phantom Power | 24bit/192kHz Hi-Fi Recording | XLR/MIC/LINE inputs | Plug & Play-No Drivers | 2 in 3 out | Metal Body | Red,"2,836",50,1.25%,1.04%,"3,983",73,1.29%,1.10%,0.36%,0.00%,0,0,0.00%,0.00%,₹0.00,₹0.00,0,0
B0BQ34TRDX,B0BQ34TRDX,Fossil Raquel Analog White Dial Women's Watch-Es5271 - Stainless Steel,124,2,0.05%,0.04%,159,2,0.05%,0.03%,94.48%,100.00%,0,0,0.00%,0.00%,₹0.00,₹0.00,0,0
B0BQ35JRM3,B0BQ35JRM3,"Fossil Machine Analog Black Dial Men's Watch-FS5971 Stainless Steel, Black Strap",157,4,0.07%,0.08%,217,4,0.07%,0.06%,99.05%,100.00%,0,0,0.00%,0.00%,₹0.00,₹0.00,0,0
B0BQZG6C28,B0BQZG6C28,Emporio Armani Analog White Dial Women's Watch-AR80065SET,15,0,0.01%,0.00%,19,0,0.01%,0.00%,100.00%,0.00%,0,0,0.00%,0.00%,₹0.00,₹0.00,0,0
B0BR5DZQSN,B0BR5DZQSN,Diesel Spiked Analog Black Dial Men's Stainless Steel Watch-Dz4627,745,13,0.33%,0.27%,904,14,0.29%,0.21%,86.98%,71.43%,0,0,0.00%,0.00%,₹0.00,₹0.00,0,0
B0BS4BFLZW,B0BS4BFLZW,Michael Kors Harlowe Analog Gold Dial Women's Watch-MK4709,74,0,0.03%,0.00%,105,0,0.03%,0.00%,96.81%,0.00%,0,0,0.00%,0.00%,₹0.00,₹0.00,0,0
B0C77PPS9S,B0C77PPS9S,Fossil Analog White Dial Women's Watch-Es5310 - Leather,976,4,0.43%,0.08%,"1,186",5,0.38%,0.08%,95.91%,100.00%,0,0,0.00%,0.00%,₹0.00,₹0.00,0,0
B0C7WKTMFC,B0C7WKTMFC,Michael Kors Analog Black Dial Men's Stainless Steel Watch-Mk9113,104,3,0.05%,0.06%,151,5,0.05%,0.08%,98.52%,100.00%,0,0,0.00%,0.00%,₹0.00,₹0.00,0,0
B0C89RHY4W,B0C89RHY4W,Fossil Analog White Dial Women's Watch-Es5306 - Stainless Steel,284,8,0.13%,0.17%,340,8,0.11%,0.12%,89.52%,100.00%,0,0,0.00%,0.00%,₹0.00,₹0.00,0,0
B0CBCWGTGR,B0CBCWGTGR,"Diesel Leather Analog Blue Dial Men Watch-Dz2189, Brown Band",59,2,0.03%,0.04%,73,3,0.02%,0.05%,75.00%,100.00%,0,0,0.00%,0.00%,₹0.00,₹0.00,0,0
B0CCHGLV6Y,B0CCHGLV6Y,Skagen Analog White Dial Women's Watch-SKW3101,87,0,0.04%,0.00%,104,0,0.03%,0.00%,100.00%,0.00%,0,0,0.00%,0.00%,₹0.00,₹0.00,0,0
B0CCHHGG9B,B0CCHHGG9B,Emporio Armani Stainless Steel Analog Green Dial Men's Watch-Ar11575,69,0,0.03%,0.00%,83,0,0.03%,0.00%,98.73%,0.00%,0,0,0.00%,0.00%,₹0.00,₹0.00,0,0
B0CCHKHCTD,B0CCHKHCTD,Emporio Armani Analog Gray Dial Men's Ceramic Watch-Ar70010,464,4,0.21%,0.08%,657,4,0.21%,0.06%,48.98%,100.00%,0,0,0.00%,0.00%,₹0.00,₹0.00,0,0
B0CCHLL1ZJ,B0CCHLL1ZJ,Emporio Armani Analog Silver Dial Women's Watch-AR11568,9,0,0.00%,0.00%,17,0,0.01%,0.00%,100.00%,0.00%,0,0,0.00%,0.00%,₹0.00,₹0.00,0,0
B0CCHMD6QH,B0CCHMD6QH,Emporio Armani Gun-Metal Watch AR11561,26,0,0.01%,0.00%,30,0,0.01%,0.00%,100.00%,0.00%,0,0,0.00%,0.00%,₹0.00,₹0.00,0,0
B0CCHNK41V,B0CCHNK41V,Skagen Analog Gray Dial Men's Watch-SKW6891,564,12,0.25%,0.25%,663,12,0.21%,0.18%,100.00%,100.00%,0,0,0.00%,0.00%,₹0.00,₹0.00,0,0
B0CDQHYGLW,B0CDQHYGLW,Emporio Armani Analog Multicolor Dial Women's Watch-AR11558,28,1,0.01%,0.02%,35,1,0.01%,0.02%,100.00%,100.00%,0,0,0.00%,0.00%,₹0.00,₹0.00,0,0
B0CF5TCQKL,B0CF5TCQKL,"Audio Array AA-21 Desktop Mount Speaker Stands | 15KG Capacity | Height, Tilt & Rotation Adjustable | Smart Cable Management | for Sound Editing, Gaming, Music Production | Black (Set of 2)","1,118",57,0.49%,1.19%,"1,561",98,0.51%,1.48%,0.23%,0.00%,0,0,0.00%,0.00%,₹0.00,₹0.00,0,0
B0CF5XZR93,B0CF5XZR93,Fossil Analog Black Dial Men's Watch-Fs6032 - Stainless Steel,639,14,0.28%,0.29%,819,19,0.27%,0.29%,94.50%,87.50%,0,0,0.00%,0.00%,₹0.00,₹0.00,0,0
B0CFBB587Z,B0CFBB587Z,Fossil Stainless Steel Analog Brown Dial Men's Watch-Me3253,"2,085",34,0.92%,0.71%,"2,847",46,0.92%,0.69%,97.24%,100.00%,0,0,0.00%,0.00%,₹0.00,₹0.00,0,0
B0CFBCTN93,B0CFBCTN93,"Fossil Machine Brown Automatic Leather Watch Me3254 - Analog, Men","1,614",38,0.71%,0.79%,"2,020",50,0.65%,0.76%,92.19%,100.00%,0,0,0.00%,0.00%,₹0.00,₹0.00,0,0
B0CGSQGH17,B0CGSQGH17,Skagen Analog White Dial Women's Watch-SKW3121,103,0,0.05%,0.00%,115,0,0.04%,0.00%,100.00%,0.00%,0,0,0.00%,0.00%,₹0.00,₹0.00,0,0
B0CH4RNWJX,B0CH4RNWJX,"Audio Array AM-C43 XLR to 3.5mm Professional Condenser Microphone Kit | Boom Arm, 2M Cable & Foam Filter | Compatible with Audio Interface, Mixer | Recording, Podcast, Streaming, Home Studio (Black)","1,489",26,0.66%,0.54%,"2,272",32,0.74%,0.48%,0.00%,0.00%,0,0,0.00%,0.00%,₹0.00,₹0.00,0,0
B0CHXTNMNX,B0CHXTNMNX,"Armani Exchange Stainless Steel Analog Blue Dial Men's Watch-Ax7151Set, Band Color:Gold",365,7,0.16%,0.15%,509,9,0.16%,0.14%,97.09%,100.00%,0,0,0.00%,0.00%,₹0.00,₹0.00,0,0
B0CJ6ZW8F6,B0CJ6ZW8F6,"Fossil Watch Ring Gold dial ES5319 for Women, Analog, Stainless Steel, Gold Strap",471,2,0.21%,0.04%,571,2,0.18%,0.03%,94.64%,100.00%,0,0,0.00%,0.00%,₹0.00,₹0.00,0,0
B0CLVK5F4Q,B0CLVK5F4Q,Armani Exchange Analog Black Dial Men's Watch,2,0,0.00%,0.00%,2,0,0.00%,0.00%,0.00%,0.00%,0,0,0.00%,0.00%,₹0.00,₹0.00,0,0
B0CM6WH4ZT,B0CM6WH4ZT,"Audio Array AI-12 USB Bluetooth Soundcard | 1Ch Mixer interface | 2 mic inputs, 2 smartphone & PC/Mac outputs | Karaoke Recording, Mobile/PC Streaming, Live Broadcasting | Singing, Recording,Gaming",219,3,0.10%,0.06%,313,3,0.10%,0.05%,3.51%,0.00%,0,0,0.00%,0.00%,₹0.00,₹0.00,0,0
B0CM9L1QZG,B0CM9L1QZG,"Audio Array AM-W16 Solo Wireless Lapel Over Ear Mic|in-Built ANC,Plug N Play,LongBattery Life,Ultra-Low Latency,Upto 30M Range|Compatible with iPhone&Android|Vlogging,Streaming,Teaching,YouTube,Black",190,2,0.08%,0.04%,250,2,0.08%,0.03%,0.43%,0.00%,0,0,0.00%,0.00%,₹0.00,₹0.00,0,0
B0CMXRJYGK,B0CMXRJYGK,"Promate Screwdriver Set with 48 S2 Steel Bits, Anodic Oxidation and Magnetic Storage Box, ProTools-51M",4,0,0.00%,0.00%,5,0,0.00%,0.00%,100.00%,0.00%,0,0,0.00%,0.00%,₹0.00,₹0.00,0,0
B0CQNSQ9BJ,B0CQNSQ9BJ,"Promate Screwdriver Set with 120 CR-V Steel Bits, Foldable Cylindrical Case and Durable Construction, ProTools-126M",2,0,0.00%,0.00%,2,0,0.00%,0.00%,100.00%,0.00%,0,0,0.00%,0.00%,₹0.00,₹0.00,0,0
B0CR5RR8Z6,B0CR5RR8Z6,"Emporio Armani Stainless Steel Analog Multicolor Dial Women's Watch-Ar11596, Dial-Color:Silver, Band Color:Silver",16,0,0.01%,0.00%,21,0,0.01%,0.00%,100.00%,0.00%,0,0,0.00%,0.00%,₹0.00,₹0.00,0,0
B0CR5S175Y,B0CR5S175Y,"Armani Exchange Stainless Steel Analog Black Dial Men's Watch-Ax2454, Band Color:Grey",118,5,0.05%,0.10%,153,9,0.05%,0.14%,80.28%,100.00%,0,0,0.00%,0.00%,₹0.00,₹0.00,0,0
B0CRCTQH2C,B0CRCTQH2C,"Michael Kors Stainless Steel Analog White Dial Women's Watch-Mk4805, Band Color:Gold",36,2,0.02%,0.04%,48,2,0.02%,0.03%,100.00%,100.00%,0,0,0.00%,0.00%,₹0.00,₹0.00,0,0
B0CRCYMKY8,B0CRCYMKY8,Michael Kors Analog White Dial Silver Strap Women's Watch-Mk7474,15,0,0.01%,0.00%,29,0,0.01%,0.00%,100.00%,0.00%,0,0,0.00%,0.00%,₹0.00,₹0.00,0,0
B0CRD3QWVJ,B0CRD3QWVJ,Fossil Carlie Analog Women Silver Quartz Stainless Steel Watch ES5331,110,1,0.05%,0.02%,135,1,0.04%,0.02%,88.00%,0.00%,0,0,0.00%,0.00%,₹0.00,₹0.00,0,0
B0CRD7DH79,B0CRD7DH79,"Fossil Men Sport Tourer Silver Quartz Stainless Steel Chronograph Watch Fs6045, Black Dial, Silver Band",148,2,0.07%,0.04%,190,2,0.06%,0.03%,58.48%,0.00%,0,0,0.00%,0.00%,₹0.00,₹0.00,0,0
B0CRDG22TQ,B0CRDG22TQ,"Fossil Women Neutra Brown Quartz Leather Chronograph Watch Es5278, Dial-Color:Off-White, Band Color:Brown",575,8,0.25%,0.17%,726,9,0.24%,0.14%,97.24%,100.00%,0,0,0.00%,0.00%,₹0.00,₹0.00,0,0
B0CRSQDJJ5,B0CRSQDJJ5,"Michael Kors Analog Green Dial Men's Stainless Steel Watch-Mk9152, Band Color:Silver",190,4,0.08%,0.08%,217,4,0.07%,0.06%,85.10%,100.00%,0,0,0.00%,0.00%,₹0.00,₹0.00,0,0
B0CRT23BD5,B0CRT23BD5,"Michael Kors Stainless Steel Analog Blue Dial Men's Watch-Mk9153, Band Color:Gold",40,0,0.02%,0.00%,54,0,0.02%,0.00%,98.00%,0.00%,0,0,0.00%,0.00%,₹0.00,₹0.00,0,0
B0CSK4ZCQH,B0CSK4ZCQH,Michael Kors Analog White Dial Men's Metal Band Watch-MK9163,186,4,0.08%,0.08%,215,4,0.07%,0.06%,91.50%,100.00%,0,0,0.00%,0.00%,₹0.00,₹0.00,0,0
B0CSK63BKG,B0CSK63BKG,Michael Kors Analog Blue Dial Men's Metal Band Watch-MK9156,53,1,0.02%,0.02%,64,1,0.02%,0.02%,100.00%,0.00%,0,0,0.00%,0.00%,₹0.00,₹0.00,0,0
B0CWRLQ99S,B0CWRLQ99S,"Armani Exchange Stainless Steel Analog Gray Dial Men's Watch-Ax1764, Band Color-Silver",56,0,0.02%,0.00%,75,0,0.02%,0.00%,100.00%,0.00%,0,0,0.00%,0.00%,₹0.00,₹0.00,0,0
B0CZ8X8CBD,B0CZ8X8CBD,"Fossil Stainless Steel Analog Green Dial Men's Watch-Fs6056, Band Color-Silver",448,6,0.20%,0.12%,542,7,0.18%,0.11%,99.80%,100.00%,0,0,0.00%,0.00%,₹0.00,₹0.00,0,0
B0CZ91YKMP,B0CZ91YKMP,Fossil Blue Dive Gold Quartz Stainless Steel Watch ES5350,53,2,0.02%,0.04%,68,2,0.02%,0.03%,80.00%,100.00%,0,0,0.00%,0.00%,₹0.00,₹0.00,0,0
B0CZ93JG5X,B0CZ93JG5X,Michael Kors Emery Silver Watch MK4829,91,0,0.04%,0.00%,110,0,0.04%,0.00%,88.35%,0.00%,0,0,0.00%,0.00%,₹0.00,₹0.00,0,0
B0CZ94B6QL,B0CZ94B6QL,"Michael Kors Stainless Steel Analog Multicolor Dial Women's Watch-Mk4822, Band Color-Gold",28,0,0.01%,0.00%,34,0,0.01%,0.00%,96.43%,0.00%,0,0,0.00%,0.00%,₹0.00,₹0.00,0,0
B0D2LHNS9B,B0D2LHNS9B,"NexLev Foot Callus Remover | Electric Scrubber & Shaver for Dead, Hard & Cracked Skin | Professional Pedicure at Home | Waterproof | Type C | 3 Crystal Quartz Heads | For Men and Women| CR-01",31,0,0.01%,0.00%,37,0,0.01%,0.00%,8.82%,0.00%,0,0,0.00%,0.00%,₹0.00,₹0.00,0,0
B0D84YY632,B0D84YY632,"Armani Exchange Stainless Steel Analog Black Dial Men's Watch-Ax4180, Band Color:Gold","1,606",36,0.71%,0.75%,"2,057",51,0.67%,0.77%,94.29%,91.67%,0,0,0.00%,0.00%,₹0.00,₹0.00,0,0
B0D853Y52R,B0D853Y52R,"Armani Exchange Stainless Steel Analog Black Dial Men's Watch-Ax4181, Band Color:Multicolor",189,5,0.08%,0.10%,248,5,0.08%,0.08%,61.21%,100.00%,0,0,0.00%,0.00%,₹0.00,₹0.00,0,0
B0D8572WTJ,B0D8572WTJ,"Armani Exchange Stainless Steel Analog Black Dial Men's Watch-Ax4183, Band Color:Black",328,5,0.15%,0.10%,466,5,0.15%,0.08%,97.34%,100.00%,0,0,0.00%,0.00%,₹0.00,₹0.00,0,0
B0D85F9QCK,B0D85F9QCK,"Armani Exchange Stainless Steel Analog Gray Dial Women's Watch-Ax4614, Band Color:Gold",201,7,0.09%,0.15%,304,11,0.10%,0.17%,99.20%,100.00%,0,0,0.00%,0.00%,₹0.00,₹0.00,0,0
B0D933B79H,B0D933B79H,"Fossil Leather Analog Beige Dial Men's Watch-Fs6071, Band Color:Brown",152,2,0.07%,0.04%,188,2,0.06%,0.03%,89.94%,100.00%,0,0,0.00%,0.00%,₹0.00,₹0.00,0,0
B0D9345QY7,B0D9345QY7,"Emporio Armani Stainless Steel Analog Green Dial Men's Watch-Ar60080, Band Color:Silver",139,2,0.06%,0.04%,199,3,0.06%,0.05%,100.00%,100.00%,0,0,0.00%,0.00%,₹0.00,₹0.00,0,0
B0D935CGMF,B0D935CGMF,"Emporio Armani Leather Analog Multicolor Dial Men's Watch-Ar11635, Band Color:Black",81,0,0.04%,0.00%,107,0,0.03%,0.00%,85.71%,0.00%,0,0,0.00%,0.00%,₹0.00,₹0.00,0,0
B0D935S1B3,B0D935S1B3,"Emporio Armani Stainless Steel Analog Multicolor Dial Men's Watch-Ar11636, Band Color:Silver",29,0,0.01%,0.00%,39,0,0.01%,0.00%,94.59%,0.00%,0,0,0.00%,0.00%,₹0.00,₹0.00,0,0
B0D935TKFD,B0D935TKFD,"Emporio Armani Stainless Steel Analog Multicolor Dial Women's Watch-Ar11625, Band Color:Silver",8,0,0.00%,0.00%,13,0,0.00%,0.00%,100.00%,0.00%,0,0,0.00%,0.00%,₹0.00,₹0.00,0,0
B0D935TWSR,B0D935TWSR,"Emporio Armani Stainless Steel Analog Multicolor Dial Men's Watch-Ar11637, Band Color:Silver",51,1,0.02%,0.02%,64,1,0.02%,0.02%,94.74%,0.00%,0,0,0.00%,0.00%,₹0.00,₹0.00,0,0
B0D935VW9J,B0D935VW9J,"Emporio Armani Stainless Steel Analog Multicolor Dial Women's Watch-Ar11626, Band Color:Multicolor",21,0,0.01%,0.00%,30,0,0.01%,0.00%,100.00%,0.00%,0,0,0.00%,0.00%,₹0.00,₹0.00,0,0
B0D9363BB2,B0D9363BB2,Emporio Armani Analog Silver Dial Women's Watch-AR11623,64,1,0.03%,0.02%,74,1,0.02%,0.02%,86.96%,0.00%,0,0,0.00%,0.00%,₹0.00,₹0.00,0,0
B0D936CMG1,B0D936CMG1,"Emporio Armani Stainless Steel Analog Green Dial Men's Watch-Ar11621, Band Color:Silver",33,0,0.01%,0.00%,41,0,0.01%,0.00%,100.00%,0.00%,0,0,0.00%,0.00%,₹0.00,₹0.00,0,0
B0D936FLK4,B0D936FLK4,"Emporio Armani Stainless Steel Analog Black Dial Men's Watch-Ar11622, Band Color:Silver",28,0,0.01%,0.00%,45,0,0.01%,0.00%,100.00%,0.00%,0,0,0.00%,0.00%,₹0.00,₹0.00,0,0
B0D936P9C1,B0D936P9C1,"Fossil Leather Analog Green Dial Men's Watch-Me3261, Band Color:Brown",446,11,0.20%,0.23%,558,14,0.18%,0.21%,88.22%,100.00%,0,0,0.00%,0.00%,₹0.00,₹0.00,0,0
B0D936RRVB,B0D936RRVB,"Emporio Armani Stainless Steel Analog Blue Dial Men's Watch-Ar60079, Band Color:Silver",231,9,0.10%,0.19%,309,10,0.10%,0.15%,100.00%,100.00%,0,0,0.00%,0.00%,₹0.00,₹0.00,0,0
B0D936YHDH,B0D936YHDH,"Emporio Armani Leather Analog Silver Dial Women's Watch-Ar11624, Band Color:Black",53,0,0.02%,0.00%,66,0,0.02%,0.00%,89.29%,0.00%,0,0,0.00%,0.00%,₹0.00,₹0.00,0,0
B0D954M6YQ,B0D954M6YQ,"Fossil Stainless Steel Analog White Dial Women's Watch-Es5357, Band Color:Silver",79,0,0.03%,0.00%,117,0,0.04%,0.00%,88.79%,0.00%,0,0,0.00%,0.00%,₹0.00,₹0.00,0,0
B0D955B6SX,B0D955B6SX,Michael Kors Lexington Silver Watch MK4843,44,2,0.02%,0.04%,49,2,0.02%,0.03%,95.65%,100.00%,0,0,0.00%,0.00%,₹0.00,₹0.00,0,0
B0D955BY7N,B0D955BY7N,Michael Kors Harlowe Rose Gold Watch MK4845,37,2,0.02%,0.04%,54,4,0.02%,0.06%,100.00%,100.00%,0,0,0.00%,0.00%,₹0.00,₹0.00,0,0
B0D955GP1C,B0D955GP1C,Michael Kors Analog Women Rylee Gold Watch MK4847,287,6,0.13%,0.12%,326,6,0.11%,0.09%,100.00%,100.00%,0,0,0.00%,0.00%,₹0.00,₹0.00,0,0
B0D955L5S7,B0D955L5S7,Michael Kors Lexington Gold Watch MK4842,314,5,0.14%,0.10%,456,8,0.15%,0.12%,98.45%,100.00%,0,0,0.00%,0.00%,₹0.00,₹0.00,0,0
B0D955NZTN,B0D955NZTN,Michael Kors Accelerator 2.0 Gun-Metal Watch MK9178,30,0,0.01%,0.00%,37,0,0.01%,0.00%,100.00%,0.00%,0,0,0.00%,0.00%,₹0.00,₹0.00,0,0
B0D955VQ4S,B0D955VQ4S,Michael Kors Lennox Silver Watch MK7488,31,0,0.01%,0.00%,39,0,0.01%,0.00%,100.00%,0.00%,0,0,0.00%,0.00%,₹0.00,₹0.00,0,0
B0D955YGX7,B0D955YGX7,Michael Kors Analog Men Accelerator 2.0 Black Dial Gold Watch MK9177,167,3,0.07%,0.06%,225,4,0.07%,0.06%,97.52%,100.00%,0,0,0.00%,0.00%,₹0.00,₹0.00,0,0
B0D9568856,B0D9568856,Michael Kors Brynn Silver Watch MK7506,20,0,0.01%,0.00%,24,0,0.01%,0.00%,63.64%,0.00%,0,0,0.00%,0.00%,₹0.00,₹0.00,0,0
B0D9568SN6,B0D9568SN6,Michael Kors Brynn Gold Watch MK7504,111,4,0.05%,0.08%,170,8,0.06%,0.12%,91.03%,100.00%,0,0,0.00%,0.00%,₹0.00,₹0.00,0,0
B0D9573TBX,B0D9573TBX,Michael Kors Accelerator 2.0 Black Watch MK9179,80,0,0.04%,0.00%,119,0,0.04%,0.00%,76.64%,0.00%,0,0,0.00%,0.00%,₹0.00,₹0.00,0,0
B0D9574DPS,B0D9574DPS,"Fossil Stainless Steel Womens Analog White Dial Women's Watch-Es5358, Band Color Gold",314,5,0.14%,0.10%,420,8,0.14%,0.12%,91.93%,100.00%,0,0,0.00%,0.00%,₹0.00,₹0.00,0,0
B0D9ZN5NBD,B0D9ZN5NBD,Fossil Men's Machine Brown Quartz Analog Leather Watch FS6085,35,1,0.02%,0.02%,52,1,0.02%,0.02%,82.98%,0.00%,0,0,0.00%,0.00%,₹0.00,₹0.00,0,0
B0DB1J1HST,B0DB1J1HST,"Emporio Armani Stainless Steel Analog Blue Dial Men's Watch-Ar11620, Band Color:Silver",33,0,0.01%,0.00%,37,0,0.01%,0.00%,100.00%,0.00%,0,0,0.00%,0.00%,₹0.00,₹0.00,0,0
B0DC64BD5R,B0DC64BD5R,Fossil Leather Analog Red Dial Men's Watch-FS6086,651,10,0.29%,0.21%,841,13,0.27%,0.20%,79.23%,100.00%,0,0,0.00%,0.00%,₹0.00,₹0.00,0,0
B0DC674ZNR,B0DC674ZNR,Fossil Silicone Analog White Dial Men's Watch-FS6087,463,8,0.20%,0.17%,624,8,0.20%,0.12%,86.06%,100.00%,0,0,0.00%,0.00%,₹0.00,₹0.00,0,0
B0DJ2VFZWN,B0DJ2VFZWN,Fossil Men's Minimalist Brown Analog Quartz Leather Watch FS6094,441,7,0.20%,0.15%,599,14,0.19%,0.21%,88.87%,100.00%,0,0,0.00%,0.00%,₹0.00,₹0.00,0,0
B0DJ2WJ9R7,B0DJ2WJ9R7,Michael Kors Lexington Rose Gold Watch MK4863,105,2,0.05%,0.04%,132,4,0.04%,0.06%,100.00%,100.00%,0,0,0.00%,0.00%,₹0.00,₹0.00,0,0
B0DJ2WNH1Y,B0DJ2WNH1Y,Michael Kors Lexington Silver Watch MK4864,53,2,0.02%,0.04%,69,2,0.02%,0.03%,100.00%,100.00%,0,0,0.00%,0.00%,₹0.00,₹0.00,0,0
B0DJ2WP1M5,B0DJ2WP1M5,Michael Kors Sage Black Watch MK9193,57,0,0.03%,0.00%,69,0,0.02%,0.00%,93.55%,0.00%,0,0,0.00%,0.00%,₹0.00,₹0.00,0,0
B0DJ2X1477,B0DJ2X1477,Fossil Women's Sloan Gold Analog Quartz Stainless Steel Watch ES5380,292,4,0.13%,0.08%,339,5,0.11%,0.08%,93.63%,50.00%,0,0,0.00%,0.00%,₹0.00,₹0.00,0,0
B0DJ2XCDJ1,B0DJ2XCDJ1,Emporio Armani Women's Stainless Steel Analog Green Dial Watch-AR11639,285,4,0.13%,0.08%,348,6,0.11%,0.09%,100.00%,100.00%,0,0,0.00%,0.00%,₹0.00,₹0.00,0,0
B0DJ2XDV59,B0DJ2XDV59,Michael Kors Rylee Silver Watch MK4873,227,2,0.10%,0.04%,256,2,0.08%,0.03%,100.00%,0.00%,0,0,0.00%,0.00%,₹0.00,₹0.00,0,0
B0DJ2XNSD2,B0DJ2XNSD2,Fossil Men's Townsman Brown Analog Automatic Leather Watch ME3266,939,19,0.42%,0.40%,"1,270",23,0.41%,0.35%,75.14%,100.00%,0,0,0.00%,0.00%,₹0.00,₹0.00,0,0
B0DJ2XWYX7,B0DJ2XWYX7,Michael Kors Sage Gold Watch MK9192,105,2,0.05%,0.04%,124,3,0.04%,0.05%,98.29%,100.00%,0,0,0.00%,0.00%,₹0.00,₹0.00,0,0
B0DJ2YM76K,B0DJ2YM76K,Fossil Women's Sloan Silver Quartz Stainless Steel Analog Watch ES5381,192,4,0.08%,0.08%,214,4,0.07%,0.06%,75.12%,100.00%,0,0,0.00%,0.00%,₹0.00,₹0.00,0,0
B0DJ2Z41C1,B0DJ2Z41C1,Emporio Armani Analog Green Dial Men's Watch-AR11640,88,4,0.04%,0.08%,122,5,0.04%,0.08%,100.00%,100.00%,0,0,0.00%,0.00%,₹0.00,₹0.00,0,0
B0DJ2Z6JSW,B0DJ2Z6JSW,Fossil Men's Machine Brown Analog Quartz Leather Watch FS6081Set,12,0,0.01%,0.00%,12,0,0.00%,0.00%,91.67%,0.00%,0,0,0.00%,0.00%,₹0.00,₹0.00,0,0
B0DKJJBBTS,B0DKJJBBTS,Armani Exchange Analog Gray Dial Men's Stainless Steel Watch-AX1885,0,0,0.00%,0.00%,0,0,0.00%,0.00%,0.00%,0.00%,0,0,0.00%,0.00%,₹0.00,₹0.00,0,0
B0DKJQDKPD,B0DKJQDKPD,Armani Exchange Analog Black Dial Men's Watch-AX1964,113,2,0.05%,0.04%,152,2,0.05%,0.03%,99.25%,100.00%,0,0,0.00%,0.00%,₹0.00,₹0.00,0,0
B0DM66B2DW,B0DM66B2DW,"NexLev Knee Massager for Joint Pain Relief |Controlled Vibration & Heating for Arthritis, Knee, Shoulder or Elbow pain | 15 modes |2 Extension Belt |Graphene Heating pad for Consistent Heating | KM-01",67,0,0.03%,0.00%,89,0,0.03%,0.00%,67.07%,0.00%,0,0,0.00%,0.00%,₹0.00,₹0.00,0,0
B0DP5HM2ZR,B0DP5HM2ZR,Michael Kors Emery Multicolor Quartz Stainless Steel Watch MK4882,15,0,0.01%,0.00%,15,0,0.00%,0.00%,100.00%,0.00%,0,0,0.00%,0.00%,₹0.00,₹0.00,0,0
B0DP5J7VF3,B0DP5J7VF3,Michael Kors Panorama Silver Quartz Stainless Steel Watch MK9196,65,3,0.03%,0.06%,81,3,0.03%,0.05%,100.00%,100.00%,0,0,0.00%,0.00%,₹0.00,₹0.00,0,0
B0DP5JYG31,B0DP5JYG31,Michael Kors Panorama Black Quartz Stainless Steel Watch MK9198,65,4,0.03%,0.08%,84,4,0.03%,0.06%,100.00%,100.00%,0,0,0.00%,0.00%,₹0.00,₹0.00,0,0
B0DQ8W1RBV,B0DQ8W1RBV,"NexLev Ionic Hot Air Brush for Woman | 3 in 1 Hair Dryer, Straightener, Volumizer & Styler | 360° Airflow Vents | Ceramic Coated Brushing Head | Tangle Free Bristle |3 Speed & 2 Heat Settings | V-01RG",878,4,0.39%,0.08%,"1,196",4,0.39%,0.06%,3.05%,100.00%,0,0,0.00%,0.00%,₹0.00,₹0.00,0,0
B0DRD8J8R5,B0DRD8J8R5,nexlev Handheld Vacuum Cleaner| 600 W | 17.5 Kpa Suction | 5 M Cord | Lightweight | Washable Hepa Filter and Dust Container| 4 Attachments | Compact Size | Home & Office Use| VC-06,0,0,0.00%,0.00%,0,0,0.00%,0.00%,0.00%,0.00%,0,0,0.00%,0.00%,₹0.00,₹0.00,0,0
B0DSBN63D1,B0DSBN63D1,Armani Exchange Silver Quartz Stainless Steel Watch AX1767,20,0,0.01%,0.00%,29,0,0.01%,0.00%,95.83%,0.00%,0,0,0.00%,0.00%,₹0.00,₹0.00,0,0
B0DSBPGKDR,B0DSBPGKDR,Armani Exchange Gold Quartz Stainless Steel Watch AX5916,80,1,0.04%,0.02%,113,1,0.04%,0.02%,86.00%,100.00%,0,0,0.00%,0.00%,₹0.00,₹0.00,0,0
B0DSBPPPJ9,B0DSBPPPJ9,Fossil Womens Raquel Gold Quartz Stainless Steel White Dial Analog Watch ES5398,56,2,0.02%,0.04%,70,4,0.02%,0.06%,87.30%,100.00%,0,0,0.00%,0.00%,₹0.00,₹0.00,0,0
B0DSBPRB2W,B0DSBPRB2W,Armani Exchange Silver Quartz Stainless Steel Watch AX7166SET,35,0,0.02%,0.00%,59,0,0.02%,0.00%,100.00%,0.00%,0,0,0.00%,0.00%,₹0.00,₹0.00,0,0
B0DSBPT3J3,B0DSBPT3J3,Fossil Mens Everett Brown Quartz Leather Dark Brown Dial Analog Watch FS6108,188,3,0.08%,0.06%,269,3,0.09%,0.05%,81.97%,50.00%,0,0,0.00%,0.00%,₹0.00,₹0.00,0,0
B0DSBQ8JV7,B0DSBQ8JV7,Michael Kors Lexington Blue Quartz Stainless Steel Watch MK7519LE,17,0,0.01%,0.00%,20,0,0.01%,0.00%,100.00%,0.00%,0,0,0.00%,0.00%,₹0.00,₹0.00,0,0
B0DSBQDZNV,B0DSBQDZNV,Fossil Men Everett Silver Quartz Stainless Steel Blue Dial Analog Watch FS6104,700,16,0.31%,0.33%,928,17,0.30%,0.26%,93.04%,100.00%,0,0,0.00%,0.00%,₹0.00,₹0.00,0,0
B0DSBQN2B9,B0DSBQN2B9,Fossil Men Everett Grey Quartz Stainless Steel Analog Watch FS6107,239,3,0.11%,0.06%,310,4,0.10%,0.06%,88.58%,100.00%,0,0,0.00%,0.00%,₹0.00,₹0.00,0,0
B0DSBQWH32,B0DSBQWH32,Fossil Womens Raquel Silver Quartz Stainless Steel White Dial Analog Watch ES5400,47,1,0.02%,0.02%,58,1,0.02%,0.02%,91.84%,0.00%,0,0,0.00%,0.00%,₹0.00,₹0.00,0,0
B0DSBR61QS,B0DSBR61QS,Michael Kors Gramercy Gold Quartz Stainless Steel Watch MK7527,54,0,0.02%,0.00%,63,0,0.02%,0.00%,100.00%,0.00%,0,0,0.00%,0.00%,₹0.00,₹0.00,0,0
B0DSBR8G7Y,B0DSBR8G7Y,Armani Exchange Multicolor Quartz Stainless Steel Watch AX5176,111,2,0.05%,0.04%,139,3,0.05%,0.05%,100.00%,100.00%,0,0,0.00%,0.00%,₹0.00,₹0.00,0,0
B0DSBRPS7R,B0DSBRPS7R,Armani Exchange Pink Quartz Stainless Steel Watch AX7167SET,41,2,0.02%,0.04%,79,2,0.03%,0.03%,93.22%,100.00%,0,0,0.00%,0.00%,₹0.00,₹0.00,0,0
B0DSBRQNM8,B0DSBRQNM8,Fossil Women Raquel Multicolor Quartz Stainless Steel White Dial Analog Watch ES5399,95,2,0.04%,0.04%,108,2,0.03%,0.03%,93.27%,0.00%,0,0,0.00%,0.00%,₹0.00,₹0.00,0,0
B0DSBS17RY,B0DSBS17RY,Armani Exchange Silver Quartz Stainless Steel Watch AX4186,177,1,0.08%,0.02%,239,1,0.08%,0.02%,99.07%,100.00%,0,0,0.00%,0.00%,₹0.00,₹0.00,0,0
B0DSBSVS4X,B0DSBSVS4X,Fossil Womens Raquel Silver Quartz Stainless Steel Blue Dial Analog Watch ES5402,388,4,0.17%,0.08%,518,5,0.17%,0.08%,91.20%,100.00%,0,0,0.00%,0.00%,₹0.00,₹0.00,0,0
B0DSBT4S4K,B0DSBT4S4K,Fossil Men Carraway Brown Quartz Leather Blue Dial Analog Watch FS6110,574,6,0.25%,0.12%,802,11,0.26%,0.17%,86.21%,100.00%,0,0,0.00%,0.00%,₹0.00,₹0.00,0,0
B0DT2KTXK3,B0DT2KTXK3,Emporio Armani Silver Quartz Stainless Steel Watch AR11676,26,0,0.01%,0.00%,35,0,0.01%,0.00%,78.57%,0.00%,0,0,0.00%,0.00%,₹0.00,₹0.00,0,0
B0DT2XZNK5,B0DT2XZNK5,Emporio Armani Silver Quartz Stainless Steel Watch AR11664,77,1,0.03%,0.02%,102,1,0.03%,0.02%,100.00%,100.00%,0,0,0.00%,0.00%,₹0.00,₹0.00,0,0
