(Parent) ASIN,(Child) ASIN,Title,Sessions - Total,Sessions - Total - B2B,Session Percentage - Total,Session Percentage - Total - B2B,Page Views - Total,Page Views - Total - B2B,Page Views Percentage - Total,Page Views Percentage - Total - B2B,Featured Offer Percentage,Featured Offer Percentage - B2B,Units Ordered,Units Ordered - B2B,Unit Session Percentage,Unit Session Percentage - B2B,Ordered Product Sales,Ordered Product Sales - B2B,Total Order Items,Total Order Items - B2B
B0DT2Y9HRM,B0DT2Y9HRM,Emporio Armani Black Quartz Leather Watch AR11677,94,1,0.04%,0.02%,131,2,0.04%,0.03%,50.86%,0.00%,0,0,0.00%,0.00%,₹0.00,₹0.00,0,0
B0DT2ZQV18,B0DT2ZQV18,Emporio Armani Green Quartz Leather Watch AR11661,34,3,0.02%,0.06%,48,7,0.02%,0.11%,79.55%,28.57%,0,0,0.00%,0.00%,₹0.00,₹0.00,0,0
B0DT31Q99D,B0DT31Q99D,Emporio Armani Silver Quartz Stainless Steel Watch AR11669,5,0,0.00%,0.00%,5,0,0.00%,0.00%,100.00%,0.00%,0,0,0.00%,0.00%,₹0.00,₹0.00,0,0
B0DT322B7L,B0DT322B7L,Emporio Armani Silver Quartz Stainless Steel Watch AR11662,9,0,0.00%,0.00%,13,0,0.00%,0.00%,100.00%,0.00%,0,0,0.00%,0.00%,₹0.00,₹0.00,0,0
B0DT32JDPV,B0DT32JDPV,Emporio Armani Gold Quartz Stainless Steel Watch AR11663,9,0,0.00%,0.00%,11,0,0.00%,0.00%,100.00%,0.00%,0,0,0.00%,0.00%,₹0.00,₹0.00,0,0
B0DT34RQM2,B0DT34RQM2,Michael Kors Gramercy Pink Quartz Stainless Steel Watch MK7528,38,0,0.02%,0.00%,56,0,0.02%,0.00%,100.00%,0.00%,0,0,0.00%,0.00%,₹0.00,₹0.00,0,0
B0DT36621X,B0DT36621X,Emporio Armani Brown Quartz Leather Watch AR11672,34,1,0.02%,0.02%,46,2,0.01%,0.03%,92.68%,100.00%,0,0,0.00%,0.00%,₹0.00,₹0.00,0,0
B0DT37Y5FY,B0DT37Y5FY,Michael Kors Gramercy Silver Quartz Stainless Steel Watch MK7529,16,0,0.01%,0.00%,19,0,0.01%,0.00%,100.00%,0.00%,0,0,0.00%,0.00%,₹0.00,₹0.00,0,0
B0DT381WY9,B0DT381WY9,Emporio Armani Silver Quartz Stainless Steel Watch AR11674,47,1,0.02%,0.02%,73,1,0.02%,0.02%,91.80%,100.00%,0,0,0.00%,0.00%,₹0.00,₹0.00,0,0
B0DT3F8L97,B0DT3F8L97,Emporio Armani Black Quartz Leather Watch AR11660,7,1,0.00%,0.02%,7,1,0.00%,0.02%,100.00%,100.00%,0,0,0.00%,0.00%,₹0.00,₹0.00,0,0
B0DTYDTKN8,B0DTYDTKN8,NexLev Cordless Spin Mop|50 Min Runtime|2 Extra Mop Pads | Type C | For Home Kitchen & Office Use | Water Spray Function|Self Propelling|Mopping for All Floor Types|LED for Corners and Underbed|SPM-01,315,10,0.14%,0.21%,420,13,0.14%,0.20%,0.28%,0.00%,0,0,0.00%,0.00%,₹0.00,₹0.00,0,0
B0DVC968P1,B0DVC968P1,"NexLev Cool Mist Humidifier | 3.5L| For Office, Indoor Plants, Baby Nursery | Quiet Operation | Works 44Hrs on Low Setting | 360° Nozzle | Auto Shut-Off | Adjustable Knob | Leak Proof | HU-01",92,5,0.04%,0.10%,132,5,0.04%,0.08%,8.55%,66.67%,0,0,0.00%,0.00%,₹0.00,₹0.00,0,0
B0FCVBJX29,B0FCVBJX29,Fossil Neutra Brown Quartz Leather Watch FS6129,104,3,0.05%,0.06%,137,4,0.04%,0.06%,97.67%,0.00%,0,0,0.00%,0.00%,₹0.00,₹0.00,0,0
B0FCVBY986,B0FCVBY986,Fossil Raquel Gold Quartz Stainless Steel Watch ES5434,151,3,0.07%,0.06%,203,4,0.07%,0.06%,90.80%,100.00%,0,0,0.00%,0.00%,₹0.00,₹0.00,0,0
B0FCVFDZP7,B0FCVFDZP7,Fossil Grant Metallic Quartz Stainless Steel Watch FS6133,105,0,0.05%,0.00%,135,0,0.04%,0.00%,97.62%,0.00%,0,0,0.00%,0.00%,₹0.00,₹0.00,0,0
B0FCVGHVV7,B0FCVGHVV7,Fossil Gilmore Multicolor Quartz Stainless Steel Watch ES5422,15,1,0.01%,0.02%,21,1,0.01%,0.02%,86.36%,0.00%,0,0,0.00%,0.00%,₹0.00,₹0.00,0,0
B0FCVHPY4B,B0FCVHPY4B,Fossil Gilmore Gold Quartz Stainless Steel Watch ES5421,24,2,0.01%,0.04%,30,2,0.01%,0.03%,75.86%,0.00%,0,0,0.00%,0.00%,₹0.00,₹0.00,0,0
B0FCVKH4TS,B0FCVKH4TS,Fossil Raquel Gold Quartz Stainless Steel Watch ES5417,68,3,0.03%,0.06%,82,4,0.03%,0.06%,90.54%,100.00%,0,0,0.00%,0.00%,₹0.00,₹0.00,0,0
B0FCVLB3FG,B0FCVLB3FG,Fossil Gilmore Rose Gold Quartz Stainless Steel Watch ES5420,59,2,0.03%,0.04%,82,3,0.03%,0.05%,78.87%,0.00%,0,0,0.00%,0.00%,₹0.00,₹0.00,0,0
B0FCVRKB8C,B0FCVRKB8C,Fossil Grant Multicolor Quartz Stainless Steel Watch FS6132,216,5,0.10%,0.10%,297,6,0.10%,0.09%,94.09%,100.00%,0,0,0.00%,0.00%,₹0.00,₹0.00,0,0
B0FF51KX2Q,B0FF51KX2Q,Fossil Nate Chronograph Analog Black Dial Grey Band Men's Watch,1,0,0.00%,0.00%,1,0,0.00%,0.00%,0.00%,0.00%,0,0,0.00%,0.00%,₹0.00,₹0.00,0,0
B0FFD4KBM7,B0FFD4KBM7,Armani Exchange Blue Quartz Stainless Steel Watch AX5730,77,1,0.03%,0.02%,96,1,0.03%,0.02%,95.24%,0.00%,0,0,0.00%,0.00%,₹0.00,₹0.00,0,0
B0FFD8Q4K6,B0FFD8Q4K6,Armani Exchange Gold Quartz Stainless Steel Watch AX5735,31,0,0.01%,0.00%,41,0,0.01%,0.00%,100.00%,0.00%,0,0,0.00%,0.00%,₹0.00,₹0.00,0,0
B0FFDJHKR5,B0FFDJHKR5,Armani Exchange Silver Quartz Stainless Steel Watch AX2820,27,0,0.01%,0.00%,35,0,0.01%,0.00%,60.00%,0.00%,0,0,0.00%,0.00%,₹0.00,₹0.00,0,0
B0FFDJNB8T,B0FFDJNB8T,Armani Exchange Black Quartz Stainless Steel Watch AX5732,25,0,0.01%,0.00%,28,0,0.01%,0.00%,80.00%,0.00%,0,0,0.00%,0.00%,₹0.00,₹0.00,0,0
B0FFDLZV1H,B0FFDLZV1H,Armani Exchange Gold Quartz Stainless Steel Watch AX2822,198,6,0.09%,0.12%,260,9,0.08%,0.14%,97.38%,100.00%,0,0,0.00%,0.00%,₹0.00,₹0.00,0,0
B0FFDM5QJX,B0FFDM5QJX,Armani Exchange Metallic Quartz Stainless Steel Watch AX2823,36,0,0.02%,0.00%,50,0,0.02%,0.00%,100.00%,0.00%,0,0,0.00%,0.00%,₹0.00,₹0.00,0,0
B0FFDSN4S1,B0FFDSN4S1,Armani Exchange Multicolor Quartz Stainless Steel Watch AX2821,63,1,0.03%,0.02%,82,1,0.03%,0.02%,95.71%,100.00%,0,0,0.00%,0.00%,₹0.00,₹0.00,0,0
B0FFHXRJNS,B0FFHXRJNS,Emporio Armani Multicolor Quartz Plastic Watch AR11694,6,0,0.00%,0.00%,7,0,0.00%,0.00%,100.00%,0.00%,0,0,0.00%,0.00%,₹0.00,₹0.00,0,0
B0FFJ2583H,B0FFJ2583H,Emporio Armani Silver Quartz Stainless Steel Watch AR11706,11,0,0.00%,0.00%,13,0,0.00%,0.00%,100.00%,0.00%,0,0,0.00%,0.00%,₹0.00,₹0.00,0,0
B0FFJ4N8BK,B0FFJ4N8BK,Emporio Armani Multicolor Quartz Stainless Steel Watch AR11692,173,4,0.08%,0.08%,226,4,0.07%,0.06%,99.50%,100.00%,0,0,0.00%,0.00%,₹0.00,₹0.00,0,0
B0FFJ6T8YY,B0FFJ6T8YY,Emporio Armani Silver Quartz Stainless Steel Watch AR11688,71,0,0.03%,0.00%,105,0,0.03%,0.00%,89.66%,0.00%,0,0,0.00%,0.00%,₹0.00,₹0.00,0,0
B0FFJ939GQ,B0FFJ939GQ,Emporio Armani Brown Quartz Leather Watch AR11708,38,3,0.02%,0.06%,52,3,0.02%,0.05%,93.48%,100.00%,0,0,0.00%,0.00%,₹0.00,₹0.00,0,0
B0FFJG71QJ,B0FFJG71QJ,Emporio Armani Silver Quartz Stainless Steel Watch AR11691,13,0,0.01%,0.00%,18,0,0.01%,0.00%,100.00%,0.00%,0,0,0.00%,0.00%,₹0.00,₹0.00,0,0
B0FFJJM7DS,B0FFJJM7DS,Emporio Armani Gold Quartz Stainless Steel Watch AR11707,32,2,0.01%,0.04%,47,5,0.02%,0.08%,100.00%,100.00%,0,0,0.00%,0.00%,₹0.00,₹0.00,0,0
B0FFJPKHZL,B0FFJPKHZL,Emporio Armani Black Quartz Leather Watch AR11690,16,0,0.01%,0.00%,17,0,0.01%,0.00%,100.00%,0.00%,0,0,0.00%,0.00%,₹0.00,₹0.00,0,0
B0FFJQB51R,B0FFJQB51R,Emporio Armani Green Quartz Rubber Watch AR11693,6,0,0.00%,0.00%,6,0,0.00%,0.00%,100.00%,0.00%,0,0,0.00%,0.00%,₹0.00,₹0.00,0,0
B0FJ2SQTNR,B0FJ2SQTNR,Fossil Everett Silver Quartz Stainless Steel Watch FS6128,130,4,0.06%,0.08%,176,4,0.06%,0.06%,95.36%,100.00%,0,0,0.00%,0.00%,₹0.00,₹0.00,0,0
B0FJ2SSSZR,B0FJ2SSSZR,Fossil Raquel Brown Quartz Leather Watch ES5418,62,2,0.03%,0.04%,78,2,0.03%,0.03%,88.89%,0.00%,0,0,0.00%,0.00%,₹0.00,₹0.00,0,0
B0FJZZ4X7Q,B0FJZZ4X7Q,Michael Kors Billie Multicolor Quartz Stainless Steel Watch MK9221,10,1,0.00%,0.02%,12,2,0.00%,0.03%,100.00%,0.00%,0,0,0.00%,0.00%,₹0.00,₹0.00,0,0
B0FJZZ6J3R,B0FJZZ6J3R,Michael Kors Billie Gold Quartz Stainless Steel Watch MK9220,20,0,0.01%,0.00%,27,0,0.01%,0.00%,100.00%,0.00%,0,0,0.00%,0.00%,₹0.00,₹0.00,0,0
B0FK1995CB,B0FK1995CB,Michael Kors Bryant Brown Quartz Stainless Steel Watch MK7559,57,1,0.03%,0.02%,76,1,0.02%,0.02%,92.65%,100.00%,0,0,0.00%,0.00%,₹0.00,₹0.00,0,0
B0FK1FC978,B0FK1FC978,Michael Kors Phoebe Gold Quartz Stainless Steel Watch MK4923,92,4,0.04%,0.08%,101,4,0.03%,0.06%,91.75%,66.67%,0,0,0.00%,0.00%,₹0.00,₹0.00,0,0
B0FK237HV4,B0FK237HV4,Michael Kors Billie Silver Quartz Stainless Steel Watch MK9222,22,0,0.01%,0.00%,29,0,0.01%,0.00%,96.30%,0.00%,0,0,0.00%,0.00%,₹0.00,₹0.00,0,0
B0FKBV3N4Y,B0FKBV3N4Y,Michael Kors Georgie Rose Gold Quartz Stainless Steel Watch MK4932,16,0,0.01%,0.00%,21,0,0.01%,0.00%,88.24%,0.00%,0,0,0.00%,0.00%,₹0.00,₹0.00,0,0
B0FKBV4H32,B0FKBV4H32,Michael Kors Billie Black Quartz Stainless Steel Watch MK9223,77,2,0.03%,0.04%,100,3,0.03%,0.05%,78.89%,100.00%,0,0,0.00%,0.00%,₹0.00,₹0.00,0,0
B0FKBVB3YH,B0FKBVB3YH,Michael Kors Georgie Multicolor Quartz Stainless Steel Watch MK4935,2,0,0.00%,0.00%,2,0,0.00%,0.00%,100.00%,0.00%,0,0,0.00%,0.00%,₹0.00,₹0.00,0,0
B0FKBVVZ7P,B0FKBVVZ7P,Michael Kors Georgie Silver Quartz Stainless Steel Watch MK4933,2,0,0.00%,0.00%,2,0,0.00%,0.00%,100.00%,0.00%,0,0,0.00%,0.00%,₹0.00,₹0.00,0,0
B0FKBW8L5H,B0FKBW8L5H,Michael Kors Georgie Gold Quartz Stainless Steel Watch MK4931,12,0,0.01%,0.00%,18,0,0.01%,0.00%,100.00%,0.00%,0,0,0.00%,0.00%,₹0.00,₹0.00,0,0
B0FKBWS861,B0FKBWS861,Michael Kors Georgie Gold Quartz Stainless Steel Watch MK4934,25,0,0.01%,0.00%,33,0,0.01%,0.00%,100.00%,0.00%,0,0,0.00%,0.00%,₹0.00,₹0.00,0,0
B0FQ7WTM8P,B0FQ7WTM8P,Michael Kors Phoebe Rose Gold Quartz Stainless Steel Watch MK4962,90,2,0.04%,0.04%,111,3,0.04%,0.05%,95.19%,0.00%,0,0,0.00%,0.00%,₹0.00,₹0.00,0,0
B0FQ832739,B0FQ832739,Michael Kors Lexington Gold Quartz Stainless Steel Watch MK9245SET,26,0,0.01%,0.00%,29,0,0.01%,0.00%,100.00%,0.00%,0,0,0.00%,0.00%,₹0.00,₹0.00,0,0
B0FQ8BFNPN,B0FQ8BFNPN,Michael Kors Phoebe Silver Quartz Stainless Steel Watch MK4963,3,0,0.00%,0.00%,5,0,0.00%,0.00%,100.00%,0.00%,0,0,0.00%,0.00%,₹0.00,₹0.00,0,0
B0FQ8K147H,B0FQ8K147H,Michael Kors Lexington Silver Quartz Stainless Steel Watch MK9242,43,0,0.02%,0.00%,64,0,0.02%,0.00%,91.23%,0.00%,0,0,0.00%,0.00%,₹0.00,₹0.00,0,0
B0FRVBBDM9,B0FRVBBDM9,Armani Exchange Black Watch AX4621,231,0,0.10%,0.00%,300,0,0.10%,0.00%,98.88%,0.00%,0,0,0.00%,0.00%,₹0.00,₹0.00,0,0
B0FRVG8SR6,B0FRVG8SR6,Armani Exchange Analog Green Dial Men's Watch-AX1970,57,4,0.03%,0.08%,71,4,0.02%,0.06%,100.00%,100.00%,0,0,0.00%,0.00%,₹0.00,₹0.00,0,0
B0FRVT4SJ1,B0FRVT4SJ1,Armani Exchange Analog Green Dial Men's Watch-AX2765,84,4,0.04%,0.08%,109,5,0.04%,0.08%,94.74%,100.00%,0,0,0.00%,0.00%,₹0.00,₹0.00,0,0
B0FRVZ29NP,B0FRVZ29NP,Armani Exchange Silver Watch Set AX7176SET,252,9,0.11%,0.19%,347,10,0.11%,0.15%,97.33%,100.00%,0,0,0.00%,0.00%,₹0.00,₹0.00,0,0
B0FRW51FQF,B0FRW51FQF,Armani Exchange Black Watch AX4173,21,0,0.01%,0.00%,26,0,0.01%,0.00%,100.00%,0.00%,0,0,0.00%,0.00%,₹0.00,₹0.00,0,0
B0FRWJ5N3P,B0FRWJ5N3P,Armani Exchange Rose Gold Watch Set AX7175SET,44,1,0.02%,0.02%,51,1,0.02%,0.02%,89.36%,0.00%,0,0,0.00%,0.00%,₹0.00,₹0.00,0,0
B0FS6JY8XW,B0FS6JY8XW,Michael Kors Essex Nude Watch MK4964,15,0,0.01%,0.00%,19,0,0.01%,0.00%,100.00%,0.00%,0,0,0.00%,0.00%,₹0.00,₹0.00,0,0
B0FS6M8FSK,B0FS6M8FSK,Michael Kors Essex Red Watch MK4966,0,0,0.00%,0.00%,0,0,0.00%,0.00%,0.00%,0.00%,0,0,0.00%,0.00%,₹0.00,₹0.00,0,0
B0FTK3KCY6,B0FTK3KCY6,Fossil Campbell Silver Quartz Stainless Steel Watch FS6140,69,1,0.03%,0.02%,100,2,0.03%,0.03%,94.62%,0.00%,0,0,0.00%,0.00%,₹0.00,₹0.00,0,0
B0FTK7KQ1P,B0FTK7KQ1P,Fossil Machine Silver Quartz Stainless Steel Watch FS6144,84,2,0.04%,0.04%,105,2,0.03%,0.03%,97.96%,100.00%,0,0,0.00%,0.00%,₹0.00,₹0.00,0,0
B0FTKCRHPQ,B0FTKCRHPQ,Emporio Armani Brown Quartz Rubber Watch AR11714,33,0,0.01%,0.00%,39,0,0.01%,0.00%,100.00%,0.00%,0,0,0.00%,0.00%,₹0.00,₹0.00,0,0
B0FTKNBJY4,B0FTKNBJY4,Fossil Campbell Silver Quartz Stainless Steel Watch FS6139,55,0,0.02%,0.00%,72,0,0.02%,0.00%,94.03%,0.00%,0,0,0.00%,0.00%,₹0.00,₹0.00,0,0
B0FTKWD4HQ,B0FTKWD4HQ,Fossil Crosby Black Quartz Leather Watch FS6151,146,5,0.06%,0.10%,205,5,0.07%,0.08%,93.02%,66.67%,0,0,0.00%,0.00%,₹0.00,₹0.00,0,0
B0FTL6L4WG,B0FTL6L4WG,Michael Kors Rhys Multicolor Quartz Stainless Steel Watch MK9240,9,0,0.00%,0.00%,10,0,0.00%,0.00%,88.89%,0.00%,0,0,0.00%,0.00%,₹0.00,₹0.00,0,0
B0FTL6PH2Z,B0FTL6PH2Z,Fossil Machine Black Quartz Silicone Watch FS6145SET,270,9,0.12%,0.19%,345,10,0.11%,0.15%,94.86%,100.00%,0,0,0.00%,0.00%,₹0.00,₹0.00,0,0
B0FTL71V28,B0FTL71V28,Michael Kors Essex Black Quartz Leather Watch MK4965,73,0,0.03%,0.00%,92,0,0.03%,0.00%,87.95%,0.00%,0,0,0.00%,0.00%,₹0.00,₹0.00,0,0
B0FTMKHR8H,B0FTMKHR8H,Emporio Armani Blue Quartz Leather Watch AR11718,11,0,0.00%,0.00%,11,0,0.00%,0.00%,100.00%,0.00%,0,0,0.00%,0.00%,₹0.00,₹0.00,0,0
B0FTMNTYMX,B0FTMNTYMX,Fossil Crosby Blue Quartz Leather Watch FS6149,143,4,0.06%,0.08%,194,5,0.06%,0.08%,68.13%,100.00%,0,0,0.00%,0.00%,₹0.00,₹0.00,0,0