(Parent) ASIN,(Child) ASIN,Title,Sessions - Total,Sessions - Total - B2B,Session Percentage - Total,Session Percentage - Total - B2B,Page Views - Total,Page Views - Total - B2B,Page Views Percentage - Total,Page Views Percentage - Total - B2B,Featured Offer Percentage,Featured Offer Percentage - B2B,Units Ordered,Units Ordered - B2B,Unit Session Percentage,Unit Session Percentage - B2B,Ordered Product Sales,Ordered Product Sales - B2B,Total Order Items,Total Order Items - B2B
B00AG37H8Y,B00AG37H8Y,"Fossil Analog White Dial Men's Watch-FS4795 Stainless Steel, Multicolor Strap","17,531",407,7.76%,8.48%,"23,883",600,7.73%,9.06%,99.92%,100.00%,44,5,0.25%,1.23%,"₹6,37,736.00","₹72,470.00",44,5
B01KNMEVDG,B01KNMEVDG,Fossil Grant Sport Blue Watch FS5237,"24,544",516,10.86%,10.75%,"35,371",748,11.45%,11.30%,15.59%,13.17%,23,0,0.09%,0.00%,"₹1,79,285.00",₹0.00,23,0
B004D4S7AY,B004D4S7AY,Fossil Riley Analog Gold Dial Women's Watch - ES2811,"4,416",46,1.95%,0.96%,"5,998",51,1.94%,0.77%,97.73%,100.00%,17,0,0.38%,0.00%,"₹2,29,398.00",₹0.00,17,0
B008AXYWHQ,B008AXYWHQ,Fossil Nate Chronograph Analog Black Dial Grey Band Men's Stainless Steel Watch - JR1401,"6,356",128,2.81%,2.67%,"8,846",179,2.86%,2.70%,94.84%,93.42%,16,0,0.25%,0.00%,"₹1,91,940.00",₹0.00,16,0
B07CSNG8XL,B07CSNG8XL,Fossil Carlie Analog White Dial Women's Watch - ES4433,"1,843",13,0.82%,0.27%,"2,591",20,0.84%,0.30%,95.17%,100.00%,13,1,0.71%,7.69%,"₹1,23,422.00","₹9,494.00",13,1
B0BFXL8ZP9,B0BFXL8ZP9,Fossil Neutra Analog Green Dial Men's Watch-FS5963,914,17,0.40%,0.35%,"1,236",22,0.40%,0.33%,98.21%,100.00%,8,1,0.88%,5.88%,"₹1,03,960.00","₹12,995.00",8,1
B0846PJPW9,B0846PJPW9,Armani Exchange Black Dial Analog Men's Watch,"30,271",954,13.39%,19.87%,"41,894","1,247",13.56%,18.83%,4.43%,3.44%,7,0,0.02%,0.00%,"₹48,279.00",₹0.00,7,0
B0DKJHSD8R,B0DKJHSD8R,Armani Exchange Analog Gray Dial Men's Stainless Steel Watch-AX4184,"4,963",104,2.20%,2.17%,"6,616",137,2.14%,2.07%,98.65%,96.20%,7,0,0.14%,0.00%,"₹1,11,965.00",₹0.00,7,0
B007NM84PQ,B007NM84PQ,Fossil Women Jesse Analog Rose Gold Dial Watch - ES3020,"2,079",14,0.92%,0.29%,"2,630",18,0.85%,0.27%,96.00%,100.00%,7,0,0.34%,0.00%,"₹83,958.00",₹0.00,6,0
B00AFTTQQ0,B00AFTTQQ0,Fossil Grant Chronograph Black Dial Men's Watch - FS4812,"1,430",24,0.63%,0.50%,"1,991",35,0.64%,0.53%,84.08%,71.43%,6,0,0.42%,0.00%,"₹54,582.00",₹0.00,6,0
B00NVAWTLY,B00NVAWTLY,"Fossil Nate Analog Black Dial Men's Watch-JR1487 Genuine Leather, Brown Strap","1,677",27,0.74%,0.56%,"2,260",37,0.73%,0.56%,85.33%,95.45%,6,0,0.36%,0.00%,"₹63,780.00",₹0.00,6,0
B0CRCWV9DV,B0CRCWV9DV,"Fossil Men Sport Tourer Silver Quartz Stainless Steel Chronograph Watch Fs6048, Green Dial, Silver Band","1,092",29,0.48%,0.60%,"1,453",44,0.47%,0.66%,88.07%,93.33%,6,1,0.55%,3.45%,"₹81,573.00","₹15,994.00",6,1
B01487C7CO,B01487C7CO,Fossil Analog Brown Dial Men's Leather Band Watch - ME3098,"5,465",93,2.42%,1.94%,"6,882",123,2.23%,1.86%,89.59%,90.00%,5,0,0.09%,0.00%,"₹99,970.00",₹0.00,5,0
B06VV5QB6Q,B06VV5QB6Q,"Fossil Analog Black Dial Men's Watch-FS5308 Stainless Steel, Black Strap","1,775",32,0.79%,0.67%,"2,360",49,0.76%,0.74%,96.13%,100.00%,5,0,0.28%,0.00%,"₹47,470.00",₹0.00,5,0
B07M7P7VLX,B07M7P7VLX,"Fossil Riley Analog Black Dial Women's Watch-ES4519 Stainless Steel, Black Strap","1,203",24,0.53%,0.50%,"1,632",34,0.53%,0.51%,96.07%,100.00%,5,0,0.42%,0.00%,"₹47,235.00",₹0.00,5,0
B0DSBQCZTK,B0DSBQCZTK,Armani Exchange Men Analogue Black Band Black Quartz Stainless Steel Watch AX2463,"1,772",32,0.78%,0.67%,"2,459",41,0.80%,0.62%,94.62%,100.00%,5,0,0.28%,0.00%,"₹1,19,955.00",₹0.00,5,0
B0DSBRWZ8N,B0DSBRWZ8N,Fossil Chronograph Men Neutra Brown Quartz Leather Gold Dial Watch FS6113,842,14,0.37%,0.29%,"1,178",16,0.38%,0.24%,85.52%,83.33%,5,0,0.59%,0.00%,"₹49,383.00",₹0.00,5,0
B0DSBSD26P,B0DSBSD26P,Fossil Chronograph Men Neutra Grey Quartz Stainless Steel Blue Dial Watch FS6111,"1,310",29,0.58%,0.60%,"1,829",43,0.59%,0.65%,90.50%,100.00%,5,1,0.38%,3.45%,"₹72,475.00","₹14,495.00",5,1
B00EVZ83J0,B00EVZ83J0,"Fossil Decker Brown Watch Ch2885 - Chronograph, Men, Leather","17,907",392,7.92%,8.16%,"25,893",536,8.38%,8.10%,1.85%,1.44%,4,0,0.02%,0.00%,"₹28,738.00",₹0.00,4,0
B07RZ1R1HJ,B07RZ1R1HJ,"Fossil Analog Gold Dial Women's Watch-ES4628 Stainless Steel, Rose Gold Strap",712,10,0.32%,0.21%,"1,010",19,0.33%,0.29%,96.98%,100.00%,4,0,0.56%,0.00%,"₹51,976.00",₹0.00,4,0
B0DKJG6R31,B0DKJG6R31,Armani Exchange Analog Black Dial Men's Stainless Steel Watch-AX2459,976,19,0.43%,0.40%,"1,526",26,0.49%,0.39%,44.90%,80.00%,4,0,0.41%,0.00%,"₹32,992.00",₹0.00,4,0
B0DKJJDZSF,B0DKJJDZSF,Armani Exchange Analog Gray Dial Men's Watch-AX2462,"1,211",32,0.54%,0.67%,"1,603",42,0.52%,0.63%,67.23%,86.67%,4,0,0.33%,0.00%,"₹39,992.00",₹0.00,4,0
B0FTMMNCK7,B0FTMMNCK7,Fossil Sloan Gold Quartz Stainless Steel Watch ES5444,356,2,0.16%,0.04%,514,2,0.17%,0.03%,80.45%,100.00%,4,0,1.12%,0.00%,"₹63,980.00",₹0.00,4,0
B0058XWUHA,B0058XWUHA,Michael Kors Parker Analog White Dial Gold Band Women's Stainless Steel Watch-MK5491,621,13,0.27%,0.27%,885,19,0.29%,0.29%,96.63%,100.00%,3,0,0.48%,0.00%,"₹68,985.00",₹0.00,3,0
B00AFTTQ8I,B00AFTTQ8I,Fossil Chronograph men Grant Brown Quartz Leather Watch FS4813IE,"1,577",24,0.70%,0.50%,"2,073",34,0.67%,0.51%,99.89%,100.00%,3,0,0.19%,0.00%,"₹38,982.00",₹0.00,3,0
B00AMWDOEK,B00AMWDOEK,Fossil Grant Chronograph Beige Dial Men's Watch - FS4735,"3,141",50,1.39%,1.04%,"3,976",69,1.29%,1.04%,97.49%,100.00%,3,0,0.10%,0.00%,"₹38,982.00",₹0.00,3,0
B0B4G7VWXD,B0B4G7VWXD,"Audio Array AA-04 Metal Spider Shock Mount for Condenser Microphone | Anti Vibration, Suspension, Isolation | 4 Size Bottom Screws & Extra Replacement Elastic Bands | Recommended For Rode, Samson, etc",188,7,0.08%,0.15%,306,8,0.10%,0.12%,20.29%,60.00%,3,0,1.60%,0.00%,"₹4,697.00",₹0.00,3,0
B0CF61X2BG,B0CF61X2BG,Fossil Analog Blue Dial Men's Watch-Fs6029 - Stainless Steel,627,18,0.28%,0.37%,881,33,0.29%,0.50%,88.58%,82.35%,3,0,0.48%,0.00%,"₹32,389.00",₹0.00,3,0
B0D9362N4Q,B0D9362N4Q,"Fossil Stainless Steel Analog Beige Dial Women's Watch-Es5363, Band Color:Silver",917,14,0.41%,0.29%,"1,104",17,0.36%,0.26%,87.33%,100.00%,3,0,0.33%,0.00%,"₹40,485.00",₹0.00,3,0
B0D9568SNM,B0D9568SNM,Michael Kors Alek Gold Watch MK9184,234,3,0.10%,0.06%,360,5,0.12%,0.08%,97.77%,100.00%,3,0,1.28%,0.00%,"₹48,291.00",₹0.00,3,0
B0FJ2RND61,B0FJ2RND61,Fossil Townsman Brown Automatic Leather Watch ME3270,841,19,0.37%,0.40%,"1,101",21,0.36%,0.32%,85.77%,77.78%,3,0,0.36%,0.00%,"₹59,985.00",₹0.00,3,0
B0FTMM455Z,B0FTMM455Z,Fossil Raquel Gold Quartz Stainless Steel Watch ES5452,946,17,0.42%,0.35%,"1,383",34,0.45%,0.51%,72.14%,40.00%,3,0,0.32%,0.00%,"₹40,485.00",₹0.00,3,0
B00DUCIUDY,B00DUCIUDY,"Fossil Chronograph Rose Gold Dial Women Watch ES3352 Stainless Steel, Rose Gold Strap","2,332",46,1.03%,0.96%,"3,752",76,1.21%,1.15%,11.60%,3.13%,2,0,0.09%,0.00%,"₹14,390.00",₹0.00,2,0
B00WM0CF4A,B00WM0CF4A,"Fossil Women Leather Jacqueline Analog White Dial Watch - Es3843, Band Color-Blue","1,452",20,0.64%,0.42%,"1,990",27,0.64%,0.41%,95.55%,100.00%,2,0,0.14%,0.00%,"₹19,988.00",₹0.00,2,0
B01GZZYSRO,B01GZZYSRO,Emporio Armani Analog Blue Dial Men's Watch-Ar1979 - Stainless Steel,304,9,0.13%,0.19%,437,17,0.14%,0.26%,90.67%,100.00%,2,0,0.66%,0.00%,"₹36,394.00",₹0.00,2,0
B07MM5MH6F,B07MM5MH6F,"Fossil Watch, Black, Free Size, (FS5512)",988,7,0.44%,0.15%,"1,302",9,0.42%,0.14%,97.89%,100.00%,2,0,0.20%,0.00%,"₹25,988.00",₹0.00,2,0
B08QVCPDVT,B08QVCPDVT,Fossil Neutra Silver Watch FS5792,"1,494",14,0.66%,0.29%,"2,003",17,0.65%,0.26%,93.14%,88.89%,2,0,0.13%,0.00%,"₹28,988.00",₹0.00,2,0
B0CH4PMR8K,B0CH4PMR8K,"Audio Array AM-C41 Plug & Play AI Noise Cancellation USB Condenser Microphone | Mute Button/Echo/Volume Knob | Kit with Tripod, Mic Cover | Gaming, Streaming, Podcast | Mac/PC/Laptop/Mobile",144,0,0.06%,0.00%,239,0,0.08%,0.00%,1.41%,0.00%,2,0,1.39%,0.00%,"₹1,549.00",₹0.00,2,0
B0CJ6ZHK1S,B0CJ6ZHK1S,"Fossil Stainless Steel Analog Brown Dial Women's Watch-Es5323, Band Color:Rose Gold",408,6,0.18%,0.12%,537,11,0.17%,0.17%,94.33%,100.00%,2,0,0.49%,0.00%,"₹31,988.00",₹0.00,2,0
B0CRCZ8TGK,B0CRCZ8TGK,"Fossil Women Carlie Gold Quartz Stainless Steel Analogue Watch Es5329, Dial-Color:White",756,7,0.33%,0.15%,974,7,0.32%,0.11%,90.91%,100.00%,2,0,0.26%,0.00%,"₹23,986.00",₹0.00,2,0
B0CRD1DRXG,B0CRD1DRXG,"Fossil Men Townsman Silver Automatic Stainless Steel Analogue Watch Me3260, Blue Dial, Silver Band","2,711",34,1.20%,0.71%,"3,418",43,1.11%,0.65%,95.04%,100.00%,2,1,0.07%,2.94%,"₹43,990.00","₹21,995.00",2,1
B0CZ9HTWNC,B0CZ9HTWNC,Michael Kors Sage Silver Watch MK4824,76,3,0.03%,0.06%,112,6,0.04%,0.09%,70.19%,100.00%,2,0,2.63%,0.00%,"₹25,890.00",₹0.00,2,0
B0D936GPVL,B0D936GPVL,"Fossil Stainless Steel Analog Beige Dial Women's Watch-Es5361, Band Color:Gold",512,3,0.23%,0.06%,660,3,0.21%,0.05%,26.15%,0.00%,2,0,0.39%,0.00%,"₹26,990.00",₹0.00,2,0
B0DJ2V3TH2,B0DJ2V3TH2,Fossil Men's Everett Gold Quartz Analog Stainless Steel Watch FS6090,627,14,0.28%,0.29%,833,20,0.27%,0.30%,94.09%,100.00%,2,0,0.32%,0.00%,"₹26,990.00",₹0.00,2,0
B0DJ2XQB3P,B0DJ2XQB3P,Fossil Men's Everett Black Analog Quartz Leather Watch FS6089,432,7,0.19%,0.15%,552,9,0.18%,0.14%,74.61%,100.00%,2,0,0.46%,0.00%,"₹20,392.00",₹0.00,2,0
B0DJ2Y1BG6,B0DJ2Y1BG6,Fossil Women's Carlie Gold Analog Quartz Stainless Steel Watch ES5387Set,374,1,0.17%,0.02%,486,1,0.16%,0.02%,90.13%,0.00%,2,0,0.53%,0.00%,"₹27,192.00",₹0.00,2,0
B0DP5KBJ7H,B0DP5KBJ7H,Michael Kors Panorama Gold Quartz Stainless Steel Watch MK9195,104,1,0.05%,0.02%,181,1,0.06%,0.02%,88.39%,100.00%,2,0,1.92%,0.00%,"₹22,996.00",₹0.00,2,0
B0DSBQYVSM,B0DSBQYVSM,Fossil Men Neutra Multicolor Quartz Stainless Steel White Dial Analog Watch FS6112,576,11,0.25%,0.23%,754,15,0.24%,0.23%,92.51%,100.00%,2,0,0.35%,0.00%,"₹28,988.00",₹0.00,2,0
B0DSBSGK17,B0DSBSGK17,Fossil Men Everett Multicolor Quartz Stainless Steel Green Dial Analog Watch FS6106,"1,778",49,0.79%,1.02%,"2,394",74,0.78%,1.12%,93.96%,100.00%,2,0,0.11%,0.00%,"₹31,990.00",₹0.00,2,0
B0FCVPBY7Y,B0FCVPBY7Y,Fossil Grant Multicolor Quartz Stainless Steel Watch FS6131,"1,312",51,0.58%,1.06%,"2,061",88,0.67%,1.33%,53.63%,45.24%,2,0,0.15%,0.00%,"₹28,990.00",₹0.00,2,0
B0FS5QZRYB,B0FS5QZRYB,Fossil Analog Blue Dial Women's Watch-ES5443,146,1,0.06%,0.02%,202,1,0.07%,0.02%,96.72%,0.00%,2,0,1.37%,0.00%,"₹23,990.00",₹0.00,2,0
B0FTK1RVG8,B0FTK1RVG8,Fossil Crosby Brown Quartz Leather Watch FS6150,243,7,0.11%,0.15%,330,10,0.11%,0.15%,68.73%,57.14%,2,0,0.82%,0.00%,"₹23,990.00",₹0.00,2,0
B0FTML3VHG,B0FTML3VHG,Fossil Harlow Gold Quartz Stainless Steel Watch ES5451,261,6,0.12%,0.12%,368,10,0.12%,0.15%,73.50%,50.00%,2,0,0.77%,0.00%,"₹26,990.00",₹0.00,2,0
B00944CXEY,B00944CXEY,Michael Kors Darci Analog Silver Dial Women's Watch - MK3190,173,3,0.08%,0.06%,224,3,0.07%,0.05%,91.63%,100.00%,1,0,0.58%,0.00%,"₹20,494.00",₹0.00,1,0
B00DUCIK7U,B00DUCIK7U,Fossil Decker Brown Watch CH2882,391,11,0.17%,0.23%,464,14,0.15%,0.21%,91.69%,100.00%,1,0,0.26%,0.00%,"₹7,995.00",₹0.00,1,0
B00Z52HG6O,B00Z52HG6O,Michael Kors Slim Runway Analog Rose Gold Dial Women's Watch-MK3197,118,1,0.05%,0.02%,154,1,0.05%,0.02%,100.00%,100.00%,1,0,0.85%,0.00%,"₹8,997.00",₹0.00,1,0
B012R0UNAW,B012R0UNAW,"Emporio Armani Stainless Steel Gianni T-Bar Analog White Dial Women Watch - Ar1926, Multi-Color Band","1,130",15,0.50%,0.31%,"1,457",19,0.47%,0.29%,97.86%,100.00%,1,0,0.09%,0.00%,"₹32,494.00",₹0.00,1,0
B0769YW2KN,B0769YW2KN,"Fossil Leather Analog Black Dial Men's Watch - Me3154, Band Color-Brown",347,6,0.15%,0.12%,500,8,0.16%,0.12%,61.28%,80.00%,1,0,0.29%,0.00%,"₹19,994.00",₹0.00,1,0
B077SMJP9Z,B077SMJP9Z,"Skagen Stainless Steel Analog White Dial Women Watch - Skw2694, Rose Gold Band",681,1,0.30%,0.02%,823,1,0.27%,0.02%,8.98%,0.00%,1,0,0.15%,0.00%,"₹10,994.00",₹0.00,1,0
B078Y2PJL4,B078Y2PJL4,"Fossil Stainless Steel Women Karli Rose Gold Dial Analog Watch Bq3181, Rose Gold Band",380,5,0.17%,0.10%,479,12,0.16%,0.18%,82.69%,100.00%,1,0,0.26%,0.00%,"₹8,397.00",₹0.00,1,0
B079XB5RXH,B079XB5RXH,Michael Kors Ritz Analogue Women's Watch (Rose Gold Dial Rose Gold Colored Strap),"1,164",30,0.52%,0.62%,"1,604",36,0.52%,0.54%,99.50%,100.00%,1,0,0.09%,0.00%,"₹24,494.00",₹0.00,1,0
B07MFZ6S2Q,B07MFZ6S2Q,Fossil Neutra Analog Black Dial Men's Watch - FS5525,621,11,0.27%,0.23%,863,14,0.28%,0.21%,93.37%,100.00%,1,0,0.16%,0.00%,"₹14,495.00",₹0.00,1,0
B0846PC77Q,B0846PC77Q,Armani Exchange Analogue Men's Watch (Black Dial Black Colored Strap),249,2,0.11%,0.04%,324,2,0.10%,0.03%,98.03%,100.00%,1,0,0.40%,0.00%,"₹15,494.00",₹0.00,1,0
B0846Q1JT5,B0846Q1JT5,Armani Exchange Analog Silver Dial Women's Stainless Steel Watch-Ax5901,962,10,0.43%,0.21%,"1,253",12,0.41%,0.18%,97.64%,100.00%,1,0,0.10%,0.00%,"₹15,495.00",₹0.00,1,0
B09GYQ4RS7,B09GYQ4RS7,Fossil Everett Analog Gray Dial Men's Stainless Steel Watch-Me3206,"2,143",59,0.95%,1.23%,"2,829",84,0.92%,1.27%,89.45%,87.80%,1,0,0.05%,0.00%,"₹21,994.00",₹0.00,1,0
B09SHQSHBF,B09SHQSHBF,"Fossil Bronson Analog Black Dial Men's Watch-ME3218 Stainless Steel, Grey Strap","1,838",42,0.81%,0.87%,"2,165",56,0.70%,0.85%,93.63%,96.15%,1,0,0.05%,0.00%,"₹22,995.00",₹0.00,1,0
B0BFZL8NN2,B0BFZL8NN2,Emporio Armani Analog Mother of Pearl Dial Women's Watch-AR11499,107,2,0.05%,0.04%,165,3,0.05%,0.05%,92.52%,100.00%,1,1,0.93%,50.00%,"₹17,147.00","₹17,147.00",1,1
B0BFZRGPJ6,B0BFZRGPJ6,Emporio Armani Analog Green Dial Men's Watch-AR11500,642,15,0.28%,0.31%,783,20,0.25%,0.30%,93.54%,100.00%,1,0,0.16%,0.00%,"₹27,995.00",₹0.00,1,0
B0BRKFP94K,B0BRKFP94K,"TONOR TD510 Dynamic Microphone, USB/XLR PC Microphone for Podcast, Recording, Live Streaming & Gaming, XLR Cardioid Studio Mic Music Voice-Over with Quick Mute, Headphone Output, Volume Control",267,4,0.12%,0.08%,395,4,0.13%,0.06%,34.73%,33.33%,1,0,0.37%,0.00%,"₹3,899.00",₹0.00,1,0
B0BS4BHNVN,B0BS4BHNVN,Michael Kors Harlowe Analog Rose Gold Dial Women's Stainless Steel Watch-Mk4710,241,6,0.11%,0.12%,338,12,0.11%,0.18%,89.61%,100.00%,1,1,0.41%,16.67%,"₹24,495.00","₹24,495.00",1,1
B0C77Q5TQ5,B0C77Q5TQ5,Fossil Analog Gray Dial Women's Watch-Es5303 - Leather,544,5,0.24%,0.10%,682,6,0.22%,0.09%,93.63%,100.00%,1,0,0.18%,0.00%,"₹11,995.00",₹0.00,1,0
B0CR5PZRNY,B0CR5PZRNY,"Emporio Armani Stainless Steel Analog Blue Dial Men's Watch-Ar11582, Band Color:Silver",115,3,0.05%,0.06%,147,3,0.05%,0.05%,97.66%,100.00%,1,0,0.87%,0.00%,"₹26,994.00",₹0.00,1,0
B0CRCZYDY6,B0CRCZYDY6,"Michael Kors Stainless Steel Analog White Dial Women's Watch-Mk4817Set, Band Color:Two-Tone",110,0,0.05%,0.00%,155,0,0.05%,0.00%,97.12%,0.00%,1,0,0.91%,0.00%,"₹24,495.00",₹0.00,1,0
B0CRD2CVZL,B0CRD2CVZL,Fossil Analog Women Gold Gold Scarlette Quartz Stainless Steel Watch ES5338,293,2,0.13%,0.04%,409,2,0.13%,0.03%,86.54%,50.00%,1,0,0.34%,0.00%,"₹11,995.00",₹0.00,1,0
B0CYMWQCKL,B0CYMWQCKL,"Emporio Armani Leather Analog Beige Dial Men's Watch-Ar11610, Band Color-Brown",122,1,0.05%,0.02%,155,1,0.05%,0.02%,93.48%,0.00%,1,0,0.82%,0.00%,"₹14,494.00",₹0.00,1,0
B0CZ8ZKPJ9,B0CZ8ZKPJ9,Fossil Analog Women Blue Dive Black Dial Multi-Colour Quartz Stainless Steel Watch ES5349,560,11,0.25%,0.23%,688,15,0.22%,0.23%,89.35%,87.50%,1,0,0.18%,0.00%,"₹11,196.00",₹0.00,1,0
B0D84YD59Y,B0D84YD59Y,"Armani Exchange Stainless Steel Analog Silver Dial Women's Watch-Ax5725, Band Color:Gold",188,1,0.08%,0.02%,212,1,0.07%,0.02%,83.25%,100.00%,1,0,0.53%,0.00%,"₹12,494.00",₹0.00,1,0
B0D85171BL,B0D85171BL,"Armani Exchange Stainless Steel Analog Silver Dial Women's Watch-Ax5724, Band Color:Silver",133,1,0.06%,0.02%,186,4,0.06%,0.06%,78.79%,100.00%,1,0,0.75%,0.00%,"₹10,994.00",₹0.00,1,0
B0D854LDQM,B0D854LDQM,"Armani Exchange Stainless Steel Analog Blue Dial Men's Watch-Ax4182, Band Color:Gray",452,13,0.20%,0.27%,630,25,0.20%,0.38%,99.47%,100.00%,1,0,0.22%,0.00%,"₹15,995.00",₹0.00,1,0
B0D858SPK4,B0D858SPK4,"Armani Exchange Stainless Steel Analog Silver Dial Women's Watch-Ax7161Set, Band Color:Multicolor",69,1,0.03%,0.02%,84,1,0.03%,0.02%,98.67%,100.00%,1,0,1.45%,0.00%,"₹16,994.00",₹0.00,1,0
B0D9369MTM,B0D9369MTM,"Fossil Leather Analog Beige Dial Women's Watch-Es5364, Band Color:Brown","1,207",12,0.53%,0.25%,"1,427",16,0.46%,0.24%,95.37%,100.00%,1,0,0.08%,0.00%,"₹11,995.00",₹0.00,1,0
B0D955H882,B0D955H882,Michael Kors Analog Men Alek Black Watch MK9185,229,5,0.10%,0.10%,297,5,0.10%,0.08%,82.67%,100.00%,1,0,0.44%,0.00%,"₹16,097.00",₹0.00,1,0
B0D9564Z9T,B0D9564Z9T,Michael Kors Accelerator 2.0 Silver Watch MK9176,114,4,0.05%,0.08%,145,4,0.05%,0.06%,94.62%,100.00%,1,1,0.88%,25.00%,"₹11,998.00","₹11,998.00",1,1
B0DCK56Q85,B0DCK56Q85,"NexLev Cordless Vacuum Cleaner|HEPA with Stainless Steel Cover|6000 mAh|Copper Motor| Rechargeable Type C|Ideal for Home, Office & Car Use|Compact & Portable|Dust & Pet Hair Remover|3 Attachment|VC-02",50,1,0.02%,0.02%,70,1,0.02%,0.02%,100.00%,100.00%,1,0,2.00%,0.00%,"₹2,599.00",₹0.00,1,0
B0DJ2VY8GL,B0DJ2VY8GL,Michael Kors Accelerator 2.0 Silver Watch MK9188,472,8,0.21%,0.17%,612,9,0.20%,0.14%,98.01%,100.00%,1,0,0.21%,0.00%,"₹14,697.00",₹0.00,1,0
B0DJ2W8W79,B0DJ2W8W79,Michael Kors Sage Silver Watch MK9191,334,7,0.15%,0.15%,454,7,0.15%,0.11%,97.55%,100.00%,1,0,0.30%,0.00%,"₹20,495.00",₹0.00,1,0
B0DJ2Y4J4Q,B0DJ2Y4J4Q,Fossil Men's Townsman Brown Analog Automatic Leather Watch ME3265,254,5,0.11%,0.10%,399,15,0.13%,0.23%,88.22%,100.00%,1,0,0.39%,0.00%,"₹19,495.00",₹0.00,1,0
B0DKJBJBX6,B0DKJBJBX6,Armani Exchange Analog Black Dial Men's Watch-AX7163SET,170,2,0.08%,0.04%,241,2,0.08%,0.03%,93.06%,0.00%,1,0,0.59%,0.00%,"₹19,995.00",₹0.00,1,0
B0DP2VVRND,B0DP2VVRND,White Mulberry |DIY| Height Adjustable Monitor Stand Mount | Supports 17-32 Inch Screens| 10 Kg Screen Load | VESA 75X75 & 100X100 | Freestanding Monitor Mount | Black - (Single Screen),"1,075",81,0.48%,1.69%,"1,600",136,0.52%,2.05%,0.07%,1.14%,1,1,0.09%,1.23%,"₹1,999.00","₹1,999.00",1,1
B0DP5J526J,B0DP5J526J,Michael Kors Panorama Black Quartz Leather Watch MK9201,28,1,0.01%,0.02%,35,1,0.01%,0.02%,93.33%,100.00%,1,0,3.57%,0.00%,"₹12,297.00",₹0.00,1,0
B0DSBN62LR,B0DSBN62LR,Armani Exchange Black Quartz Silicone Watch AX7165SET,154,3,0.07%,0.06%,204,3,0.07%,0.05%,96.76%,100.00%,1,0,0.65%,0.00%,"₹15,995.00",₹0.00,1,0
B0DSBPCW8R,B0DSBPCW8R,Armani Exchange Pink Quartz Stainless Steel Watch AX5729,73,2,0.03%,0.04%,98,2,0.03%,0.03%,62.65%,100.00%,1,0,1.37%,0.00%,"₹12,495.00",₹0.00,1,0
B0DSBT6FW8,B0DSBT6FW8,Armani Exchange Brown Quartz Leather Watch AX4617,175,3,0.08%,0.06%,234,3,0.08%,0.05%,100.00%,100.00%,1,0,0.57%,0.00%,"₹8,397.00",₹0.00,1,0
B0DT2Q1R2H,B0DT2Q1R2H,Emporio Armani Black Quartz Leather Watch AR11666,"1,456",22,0.64%,0.46%,"1,822",22,0.59%,0.33%,95.58%,100.00%,1,0,0.07%,0.00%,"₹15,995.00",₹0.00,1,0
B0DT2QDBS3,B0DT2QDBS3,Emporio Armani Brown Quartz Leather Watch AR11665,150,2,0.07%,0.04%,205,2,0.07%,0.03%,93.89%,0.00%,1,0,0.67%,0.00%,"₹15,995.00",₹0.00,1,0
B0DT2ZS8T4,B0DT2ZS8T4,Emporio Armani Pink Quartz Stainless Steel Watch AR11671,11,1,0.00%,0.02%,15,1,0.00%,0.02%,100.00%,100.00%,1,0,9.09%,0.00%,"₹17,147.00",₹0.00,1,0
B0FCVLFLGF,B0FCVLFLGF,Fossil Gilmore Silver Quartz Stainless Steel Watch ES5419,36,1,0.02%,0.02%,71,1,0.02%,0.02%,92.73%,0.00%,1,0,2.78%,0.00%,"₹11,995.00",₹0.00,1,0
B0FRV4KDN4,B0FRV4KDN4,Armani Exchange Sync Multicolor Quartz Stainless Steel Watch AX4199,55,1,0.02%,0.02%,77,1,0.02%,0.02%,89.55%,100.00%,1,0,1.82%,0.00%,"₹15,995.00",₹0.00,1,0
B0FRVZCYH9,B0FRVZCYH9,Armani Exchange Black Quartz Rubber Watch AX1769,76,0,0.03%,0.00%,115,0,0.04%,0.00%,98.96%,0.00%,1,0,1.32%,0.00%,"₹16,495.00",₹0.00,1,0
B0FS6N1YT5,B0FS6N1YT5,Michael Kors Essex 2-Tone Watch MK4967,50,0,0.02%,0.00%,81,0,0.03%,0.00%,94.03%,0.00%,1,0,2.00%,0.00%,"₹15,995.00",₹0.00,1,0
B0FTL6QH21,B0FTL6QH21,Emporio Armani Multicolor Quartz Stainless Steel Watch AR11713,62,2,0.03%,0.04%,104,5,0.03%,0.08%,98.77%,100.00%,1,0,1.61%,0.00%,"₹19,995.00",₹0.00,1,0
B0FTMMBT5P,B0FTMMBT5P,Emporio Armani Multicolor Quartz Leather Watch AR80083SET,5,0,0.00%,0.00%,12,0,0.00%,0.00%,100.00%,0.00%,1,0,20.00%,0.00%,"₹17,495.00",₹0.00,1,0
B001J1772I,B001J1772I,Diesel Mega Chief Analog Grey Over sized dial Men's Watch - DZ1206,423,13,0.19%,0.27%,552,15,0.18%,0.23%,90.04%,100.00%,0,0,0.00%,0.00%,₹0.00,₹0.00,0,0
B002LZUAFM,B002LZUAFM,Emporio Armani Mens Chronograph Stainless Steel Watch (Black_Free Size),"1,398",10,0.62%,0.21%,"1,897",11,0.61%,0.17%,74.87%,50.00%,0,0,0.00%,0.00%,₹0.00,₹0.00,0,0
B00786VY22,B00786VY22,Armani Exchange Mens Hampton Leather Analogue Watch - AX2101 (Black_Free Size),84,1,0.04%,0.02%,111,1,0.04%,0.02%,64.49%,100.00%,0,0,0.00%,0.00%,₹0.00,₹0.00,0,0
B00AFTT8KE,B00AFTT8KE,"Fossil Analog Silver Dial Women's Watch - ES3284 Stainless Steel, Gold Strap",425,7,0.19%,0.15%,581,17,0.19%,0.26%,98.07%,100.00%,0,0,0.00%,0.00%,₹0.00,₹0.00,0,0
B00PW3J8LM,B00PW3J8LM,"Fossil Men Leather Townsman Analog Black Dial Watch -Me3061, Band Color-Brown",351,7,0.16%,0.15%,462,7,0.15%,0.11%,89.34%,100.00%,0,0,0.00%,0.00%,₹0.00,₹0.00,0,0
B01GZZZ328,B01GZZZ328,Emporio Armani Luigi Analog White Dial Men's Watch - AR2502,192,4,0.08%,0.08%,248,5,0.08%,0.08%,99.56%,100.00%,0,0,0.00%,0.00%,₹0.00,₹0.00,0,0
B01ISNU3X4,B01ISNU3X4,"TONOR Dynamic Karaoke Microphone for Singing with 4.5m XLR Cable, Metal Handheld Mic Compatible with Karaoke Machine/Speaker/Amp/Mixer for Karaoke Singing, Speech, Wedding, Stage and Outdoor Activity","1,482",42,0.66%,0.87%,"2,222",63,0.72%,0.95%,0.00%,0.00%,0,0,0.00%,0.00%,₹0.00,₹0.00,0,0
B01MTYS3BW,B01MTYS3BW,Diesel Analog Stainless Steel Black Dial and Band (Big dial) Men's Watch-DZ7395,"2,034",54,0.90%,1.12%,"2,653",92,0.86%,1.39%,0.30%,0.00%,0,0,0.00%,0.00%,₹0.00,₹0.00,0,0
B077SN2LNP,B077SN2LNP,Michael Kors Lexington Analog Black Dial Men's Watch-MK8603,105,0,0.05%,0.00%,146,0,0.05%,0.00%,97.76%,0.00%,0,0,0.00%,0.00%,₹0.00,₹0.00,0,0
B07LDHVWTF,B07LDHVWTF,Saregama Carvaan Mini 2.0 Gurbani- Music Player with Bluetooth/FM/AM/AUX (Saffron Orange),"1,468",27,0.65%,0.56%,"2,070",33,0.67%,0.50%,0.17%,0.00%,0,0,0.00%,0.00%,₹0.00,₹0.00,0,0
B07QL3PH84,B07QL3PH84,Fossil Men's Elgin Card Case Leather Wallet,2,0,0.00%,0.00%,2,0,0.00%,0.00%,0.00%,0.00%,0,0,0.00%,0.00%,₹0.00,₹0.00,0,0
B07QSK7DHR,B07QSK7DHR,Michael Kors Analog Gold Dial Women's Watch-MK4339,44,0,0.02%,0.00%,51,0,0.02%,0.00%,84.78%,0.00%,0,0,0.00%,0.00%,₹0.00,₹0.00,0,0
B07QW9DDGB,B07QW9DDGB,Michael Kors Maci Blue Watch MK2833,9,0,0.00%,0.00%,10,0,0.00%,0.00%,100.00%,0.00%,0,0,0.00%,0.00%,₹0.00,₹0.00,0,0
B07RPQWF6B,B07RPQWF6B,Fossil Women Tillie Mini White Dial Rosegold Band Quartz Stainless Steel Analog Watch BQ3502,0,0,0.00%,0.00%,0,0,0.00%,0.00%,0.00%,0.00%,0,0,0.00%,0.00%,₹0.00,₹0.00,0,0
B07SZSVT1F,B07SZSVT1F,"Diesel Stainless Steel Analog Silver Dial Men's Watch-Dz2213, Band Color:Black",124,1,0.05%,0.02%,155,1,0.05%,0.02%,99.31%,0.00%,0,0,0.00%,0.00%,₹0.00,₹0.00,0,0
B07T1X89FZ,B07T1X89FZ,"Diesel Stainless Steel Analog Silver Dial Men's Watch-Dz2215, Band Color:Green",28,1,0.01%,0.02%,37,1,0.01%,0.02%,96.88%,0.00%,0,0,0.00%,0.00%,₹0.00,₹0.00,0,0
B07T1X8TKH,B07T1X8TKH,"Diesel Stainless Steel Analog White Dial Men's Watch-Dz2214, Band Color:Gold",17,0,0.01%,0.00%,25,0,0.01%,0.00%,100.00%,0.00%,0,0,0.00%,0.00%,₹0.00,₹0.00,0,0
B07T1X96CL,B07T1X96CL,"Diesel Leather Analog Multicolor Dial Men's Watch-Dz4667, Band Color -Black",113,0,0.05%,0.00%,167,0,0.05%,0.00%,40.71%,0.00%,0,0,0.00%,0.00%,₹0.00,₹0.00,0,0
B07T2XY7V5,B07T2XY7V5,Diesel Spiked Black Quartz Leather Watch DZ4671,23,0,0.01%,0.00%,30,0,0.01%,0.00%,100.00%,0.00%,0,0,0.00%,0.00%,₹0.00,₹0.00,0,0
B07T2XYGR5,B07T2XYGR5,Diesel Men Spiked Green Quartz Stainless Steel Chronograph Watch DZ4670,108,1,0.05%,0.02%,137,1,0.04%,0.02%,97.50%,100.00%,0,0,0.00%,0.00%,₹0.00,₹0.00,0,0
B07T2XYHYD,B07T2XYHYD,Diesel D-Era White Quartz Leather Watch DZ5613,7,0,0.00%,0.00%,7,0,0.00%,0.00%,100.00%,0.00%,0,0,0.00%,0.00%,₹0.00,₹0.00,0,0
B07T2XZ5K4,B07T2XZ5K4,Diesel Analog Silver Dial Men's Watch-DZ2219,42,1,0.02%,0.02%,54,1,0.02%,0.02%,95.92%,100.00%,0,0,0.00%,0.00%,₹0.00,₹0.00,0,0
B07T3ZLNM3,B07T3ZLNM3,"Diesel Leather Analog Silver Dial Men's Watch-Dz4665, Band Color -Brown","1,018",18,0.45%,0.37%,"1,221",20,0.40%,0.30%,88.40%,85.71%,0,0,0.00%,0.00%,₹0.00,₹0.00,0,0
B07T3ZPD9X,B07T3ZPD9X,Diesel D-Era Black Quartz Leather Watch DZ5612,34,0,0.02%,0.00%,41,0,0.01%,0.00%,100.00%,0.00%,0,0,0.00%,0.00%,₹0.00,₹0.00,0,0
B07T53T1KV,B07T53T1KV,Diesel Mr. Daddy Slim Grey Quartz Stainless Steel Watch DZ7487,403,8,0.18%,0.17%,551,8,0.18%,0.12%,97.51%,100.00%,0,0,0.00%,0.00%,₹0.00,₹0.00,0,0
B07T53XXCF,B07T53XXCF,Diesel Analog Black Dial Men's Watch-DZ2196,24,1,0.01%,0.02%,31,1,0.01%,0.02%,100.00%,0.00%,0,0,0.00%,0.00%,₹0.00,₹0.00,0,0
B07T62VK1C,B07T62VK1C,"Diesel Stainless Steel Analog White Dial Men's Watch-Dz2212, Band Color:Silver",186,3,0.08%,0.06%,279,3,0.09%,0.05%,98.20%,50.00%,0,0,0.00%,0.00%,₹0.00,₹0.00,0,0
B07T62XNWY,B07T62XNWY,Diesel D-Era Silver Quartz Stainless Steel Watch DZ5609,14,0,0.01%,0.00%,14,0,0.00%,0.00%,92.86%,0.00%,0,0,0.00%,0.00%,₹0.00,₹0.00,0,0
B07T63MQ9G,B07T63MQ9G,"Diesel Leather Analog Black Dial Men's Watch-Dz2210Set, Band Color -Black",12,0,0.01%,0.00%,13,0,0.00%,0.00%,100.00%,0.00%,0,0,0.00%,0.00%,₹0.00,₹0.00,0,0
B07T63ZJTR,B07T63ZJTR,"Diesel Stainless Steel Analog Yellow Dial Men's Watch-Dz4662, Band Color -Gold",82,5,0.04%,0.10%,106,10,0.03%,0.15%,93.18%,100.00%,0,0,0.00%,0.00%,₹0.00,₹0.00,0,0
B07T64HT6R,B07T64HT6R,Diesel D-Era Gold Quartz Stainless Steel Watch DZ5611,51,2,0.02%,0.04%,55,2,0.02%,0.03%,94.34%,100.00%,0,0,0.00%,0.00%,₹0.00,₹0.00,0,0
