(Parent) ASIN,(Child) ASIN,Title,Sessions - Total,Sessions - Total - B2B,Session Percentage - Total,Session Percentage - Total - B2B,Page Views - Total,Page Views - Total - B2B,Page Views Percentage - Total,Page Views Percentage - Total - B2B,Featured Offer Percentage,Featured Offer Percentage - B2B,Units Ordered,Units Ordered - B2B,Unit Session Percentage,Unit Session Percentage - B2B,Ordered Product Sales,Ordered Product Sales - B2B,Total Order Items,Total Order Items - B2B
B0FTKNBJY4,B0FTKNBJY4,Fossil Campbell Silver Quartz Stainless Steel Watch FS6139,36,1,0.02%,0.03%,43,1,0.02%,0.02%,89.74%,100.00%,0,0,0.00%,0.00%,₹0.00,₹0.00,0,0
B0FTL6L4WG,B0FTL6L4WG,Michael Kors Rhys Multicolor Quartz Stainless Steel Watch MK9240,13,0,0.01%,0.00%,18,0,0.01%,0.00%,100.00%,0.00%,0,0,0.00%,0.00%,₹0.00,₹0.00,0,0
B0FTL6PH2Z,B0FTL6PH2Z,Fossil Machine Black Quartz Silicone Watch FS6145SET,164,6,0.08%,0.15%,241,6,0.09%,0.11%,96.77%,100.00%,0,0,0.00%,0.00%,₹0.00,₹0.00,0,0
B0FTL6QH21,B0FTL6QH21,Emporio Armani Multicolor Quartz Stainless Steel Watch AR11713,112,4,0.05%,0.10%,156,8,0.06%,0.15%,94.78%,100.00%,0,0,0.00%,0.00%,₹0.00,₹0.00,0,0
B0FTL71V28,B0FTL71V28,Michael Kors Essex Black Quartz Leather Watch MK4965,61,0,0.03%,0.00%,70,0,0.02%,0.00%,89.39%,0.00%,0,0,0.00%,0.00%,₹0.00,₹0.00,0,0
B0FTMKHR8H,B0FTMKHR8H,Emporio Armani Blue Quartz Leather Watch AR11718,18,0,0.01%,0.00%,21,0,0.01%,0.00%,100.00%,0.00%,0,0,0.00%,0.00%,₹0.00,₹0.00,0,0
B0FTMMBT5P,B0FTMMBT5P,Emporio Armani Multicolor Quartz Leather Watch AR80083SET,6,0,0.00%,0.00%,6,0,0.00%,0.00%,100.00%,0.00%,0,0,0.00%,0.00%,₹0.00,₹0.00,0,0
B0FTMMHDNH,B0FTMMHDNH,Michael Kors Parker Multicolor Quartz Stainless Steel Watch MKO1224,51,2,0.02%,0.05%,80,3,0.03%,0.06%,98.65%,0.00%,0,0,0.00%,0.00%,₹0.00,₹0.00,0,0
B0FTMRC37L,B0FTMRC37L,Fossil Carlie Multicolor Quartz Stainless Steel Watch ES5438,96,4,0.04%,0.10%,106,4,0.04%,0.07%,80.20%,50.00%,0,0,0.00%,0.00%,₹0.00,₹0.00,0,0
B0FY62L381,B0FY62L381, ,14,1,0.01%,0.03%,17,1,0.01%,0.02%,0.00%,0.00%,0,0,0.00%,0.00%,₹0.00,₹0.00,0,0