(Parent) ASIN,(Child) ASIN,Title,Sessions - Total,Sessions - Total - B2B,Session Percentage - Total,Session Percentage - Total - B2B,Page Views - Total,Page Views - Total - B2B,Page Views Percentage - Total,Page Views Percentage - Total - B2B,Featured Offer Percentage,Featured Offer Percentage - B2B,Units Ordered,Units Ordered - B2B,Unit Session Percentage,Unit Session Percentage - B2B,Ordered Product Sales,Ordered Product Sales - B2B,Total Order Items,Total Order Items - B2B
B0D936P9C1,B0D936P9C1,"Fossil Leather Analog Green Dial Men's Watch-Me3261, Band Color:Brown",348,7,0.16%,0.18%,442,14,0.16%,0.26%,76.44%,100.00%,0,0,0.00%,0.00%,₹0.00,₹0.00,0,0
B0D936RRVB,B0D936RRVB,"Emporio Armani Stainless Steel Analog Blue Dial Men's Watch-Ar60079, Band Color:Silver",451,11,0.21%,0.28%,591,16,0.21%,0.30%,99.25%,100.00%,0,0,0.00%,0.00%,₹0.00,₹0.00,0,0
B0D936YHDH,B0D936YHDH,"Emporio Armani Leather Analog Silver Dial Women's Watch-Ar11624, Band Color:Black",95,4,0.04%,0.10%,124,4,0.04%,0.07%,72.90%,66.67%,0,0,0.00%,0.00%,₹0.00,₹0.00,0,0
B0D954M6YQ,B0D954M6YQ,"Fossil Stainless Steel Analog White Dial Women's Watch-Es5357, Band Color:Silver",41,1,0.02%,0.03%,51,1,0.02%,0.02%,32.61%,0.00%,0,0,0.00%,0.00%,₹0.00,₹0.00,0,0
B0D955B6SX,B0D955B6SX,Michael Kors Lexington Silver Watch MK4843,21,1,0.01%,0.03%,24,2,0.01%,0.04%,100.00%,100.00%,0,0,0.00%,0.00%,₹0.00,₹0.00,0,0
B0D955BY7N,B0D955BY7N,Michael Kors Harlowe Rose Gold Watch MK4845,32,0,0.01%,0.00%,34,0,0.01%,0.00%,100.00%,0.00%,0,0,0.00%,0.00%,₹0.00,₹0.00,0,0
B0D955GP1C,B0D955GP1C,Michael Kors Analog Women Rylee Gold Watch MK4847,109,2,0.05%,0.05%,121,2,0.04%,0.04%,98.25%,100.00%,0,0,0.00%,0.00%,₹0.00,₹0.00,0,0
B0D955L5S7,B0D955L5S7,Michael Kors Lexington Gold Watch MK4842,168,3,0.08%,0.08%,242,4,0.09%,0.07%,100.00%,100.00%,0,0,0.00%,0.00%,₹0.00,₹0.00,0,0
B0D955NZTN,B0D955NZTN,Michael Kors Accelerator 2.0 Gun-Metal Watch MK9178,15,0,0.01%,0.00%,16,0,0.01%,0.00%,93.33%,0.00%,0,0,0.00%,0.00%,₹0.00,₹0.00,0,0
B0D955VQ4S,B0D955VQ4S,Michael Kors Lennox Silver Watch MK7488,16,0,0.01%,0.00%,19,0,0.01%,0.00%,100.00%,0.00%,0,0,0.00%,0.00%,₹0.00,₹0.00,0,0
B0D955YGX7,B0D955YGX7,Michael Kors Analog Men Accelerator 2.0 Black Dial Gold Watch MK9177,109,1,0.05%,0.03%,144,2,0.05%,0.04%,99.26%,100.00%,0,0,0.00%,0.00%,₹0.00,₹0.00,0,0
B0D9564Z9T,B0D9564Z9T,Michael Kors Accelerator 2.0 Silver Watch MK9176,69,0,0.03%,0.00%,86,0,0.03%,0.00%,96.05%,0.00%,0,0,0.00%,0.00%,₹0.00,₹0.00,0,0
B0D9568SN6,B0D9568SN6,Michael Kors Brynn Gold Watch MK7504,88,0,0.04%,0.00%,111,0,0.04%,0.00%,76.42%,0.00%,0,0,0.00%,0.00%,₹0.00,₹0.00,0,0
B0D9568SNM,B0D9568SNM,Michael Kors Alek Gold Watch MK9184,151,3,0.07%,0.08%,223,3,0.08%,0.06%,99.04%,100.00%,0,0,0.00%,0.00%,₹0.00,₹0.00,0,0
B0D9573TBX,B0D9573TBX,Michael Kors Accelerator 2.0 Black Watch MK9179,58,1,0.03%,0.03%,87,1,0.03%,0.02%,94.67%,0.00%,0,0,0.00%,0.00%,₹0.00,₹0.00,0,0
B0D9574DPS,B0D9574DPS,"Fossil Stainless Steel Womens Analog White Dial Women's Watch-Es5358, Band Color Gold",239,2,0.11%,0.05%,329,5,0.12%,0.09%,38.59%,0.00%,0,0,0.00%,0.00%,₹0.00,₹0.00,0,0
B0D9KCNVNM,B0D9KCNVNM,Nexlev Oscillating Electric Toothbrush | 8000 vibrations/min | USB Type C Charging|3 modes| 2 Minute Timer |Quad Change Reminder| IPX7 Waterproof | For adults| 1 year warranty| |Sparkle Pro (ETR-06),76,2,0.04%,0.05%,100,2,0.04%,0.04%,2.33%,0.00%,0,0,0.00%,0.00%,₹0.00,₹0.00,0,0
B0D9KFP4MG,B0D9KFP4MG,NexLev Ionic Hair Straightener Brush |Frizz-Free Straightening upto 12 H |Ceramic Tourmaline Coated| 60mm Wide Brush | 130-210° |Keratin Bristles| Thermo Protect Technology |No Scalp Burn|1500W|HSB-03,697,7,0.33%,0.18%,927,9,0.33%,0.17%,0.37%,100.00%,0,0,0.00%,0.00%,₹0.00,₹0.00,0,0
B0D9ZN5NBD,B0D9ZN5NBD,Fossil Men's Machine Brown Quartz Analog Leather Watch FS6085,33,0,0.02%,0.00%,50,0,0.02%,0.00%,69.05%,0.00%,0,0,0.00%,0.00%,₹0.00,₹0.00,0,0
B0DB1J1HST,B0DB1J1HST,"Emporio Armani Stainless Steel Analog Blue Dial Men's Watch-Ar11620, Band Color:Silver",100,3,0.05%,0.08%,145,5,0.05%,0.09%,98.28%,100.00%,0,0,0.00%,0.00%,₹0.00,₹0.00,0,0
B0DB5VG39T,B0DB5VG39T,White Mulberry |DIY| Economical Gas Spring Monitor Arm | Desk Mounted Monitor Stand for 15-32 Inch Monitors |9Kg Screen Capacity|VESA 75X75&100X100| Adjustable Metal Desk Monitor Mount-(Single Screen),454,26,0.21%,0.67%,671,30,0.24%,0.56%,0.00%,0.00%,0,0,0.00%,0.00%,₹0.00,₹0.00,0,0
B0DC64BD5R,B0DC64BD5R,Fossil Leather Analog Red Dial Men's Watch-FS6086,766,17,0.36%,0.44%,954,25,0.34%,0.47%,59.59%,20.00%,0,0,0.00%,0.00%,₹0.00,₹0.00,0,0
B0DC674ZNR,B0DC674ZNR,Fossil Silicone Analog White Dial Men's Watch-FS6087,437,10,0.20%,0.26%,557,13,0.20%,0.24%,53.86%,25.00%,0,0,0.00%,0.00%,₹0.00,₹0.00,0,0
B0DCGHKRXX,B0DCGHKRXX,NexLev LED Phototherapy comb | Electric Scalp Massager | Red Light for Regrowth | Blue Light for Anti Dandruff | Hairfall Control | Rechargeable TypeC | Targeted Laser Treatment Machine |3 Modes |LE-02,"4,518",10,2.11%,0.26%,"5,669",12,2.02%,0.22%,0.15%,100.00%,0,0,0.00%,0.00%,₹0.00,₹0.00,0,0
B0DCK4DR1B,B0DCK4DR1B,Nexlev Skin Lift Device | 7 Color LED | Face & Neck Skin Lifting| 3 Massage Modes| Face Sculpting Tool |Micro-currents to reduce Wrinkles| Hot Compress | Rechargeable| Type-C| 180 Min Use| Glow+ LE-04,115,2,0.05%,0.05%,150,2,0.05%,0.04%,3.05%,0.00%,0,0,0.00%,0.00%,₹0.00,₹0.00,0,0
B0DDC3GVZW,B0DDC3GVZW,nexlev Cordless Electric Car Vacuum Cleaner VacuSafe| Seat-Belt Cutter| Window Breaker Hammer| LED Torch|4000 mAh| High Power Suction | Copper Motor| Type-C Emergency Car Escape Tool| Portable| VC-03,85,3,0.04%,0.08%,101,3,0.04%,0.06%,0.99%,50.00%,0,0,0.00%,0.00%,₹0.00,₹0.00,0,0
B0DFCDKMWR,B0DFCDKMWR,NexLev Cordless Electric Heating Pad| Period Cramp & Back Pain Relief Massager | 9 modes| Menstrual Cramp Relief|Type C| Crampfree Periods | Portable | Gift for Women| Strap upto 40 Inch |Blue CM-01,"1,113",29,0.52%,0.74%,"1,500",50,0.53%,0.93%,0.15%,10.53%,0,0,0.00%,0.00%,₹0.00,₹0.00,0,0
B0DFMRG2K4,B0DFMRG2K4,"NexLev All in One Body Trimmer for Men | Suitable for Beard, Body, Balls, Pubic Hair, Private Parts | 90 Min Runtime |Type C | IPX 7 Waterproof | No Nicks No Cuts | 2 Safety Combs| Extra Blade | TM-02",79,0,0.04%,0.00%,94,0,0.03%,0.00%,0.00%,0.00%,0,0,0.00%,0.00%,₹0.00,₹0.00,0,0
B0DJ2V3TH2,B0DJ2V3TH2,Fossil Men's Everett Gold Quartz Analog Stainless Steel Watch FS6090,370,4,0.17%,0.10%,463,6,0.16%,0.11%,89.98%,80.00%,0,0,0.00%,0.00%,₹0.00,₹0.00,0,0
B0DJ2VY8GL,B0DJ2VY8GL,Michael Kors Accelerator 2.0 Silver Watch MK9188,396,8,0.18%,0.20%,489,8,0.17%,0.15%,87.31%,100.00%,0,0,0.00%,0.00%,₹0.00,₹0.00,0,0
B0DJ2WJ9R7,B0DJ2WJ9R7,Michael Kors Lexington Rose Gold Watch MK4863,91,1,0.04%,0.03%,114,1,0.04%,0.02%,100.00%,100.00%,0,0,0.00%,0.00%,₹0.00,₹0.00,0,0
B0DJ2WNH1Y,B0DJ2WNH1Y,Michael Kors Lexington Silver Watch MK4864,51,2,0.02%,0.05%,69,2,0.02%,0.04%,88.33%,100.00%,0,0,0.00%,0.00%,₹0.00,₹0.00,0,0
B0DJ2WP1M5,B0DJ2WP1M5,Michael Kors Sage Black Watch MK9193,70,0,0.03%,0.00%,84,0,0.03%,0.00%,89.19%,0.00%,0,0,0.00%,0.00%,₹0.00,₹0.00,0,0
B0DJ2XQB3P,B0DJ2XQB3P,Fossil Men's Everett Black Analog Quartz Leather Watch FS6089,111,2,0.05%,0.05%,136,2,0.05%,0.04%,88.24%,0.00%,0,0,0.00%,0.00%,₹0.00,₹0.00,0,0
B0DJ2XWYX7,B0DJ2XWYX7,Michael Kors Sage Gold Watch MK9192,74,0,0.03%,0.00%,92,0,0.03%,0.00%,82.50%,0.00%,0,0,0.00%,0.00%,₹0.00,₹0.00,0,0
B0DJ2Y1BG6,B0DJ2Y1BG6,Fossil Women's Carlie Gold Analog Quartz Stainless Steel Watch ES5387Set,304,2,0.14%,0.05%,414,2,0.15%,0.04%,41.58%,100.00%,0,0,0.00%,0.00%,₹0.00,₹0.00,0,0
B0DJ2Y4J4Q,B0DJ2Y4J4Q,Fossil Men's Townsman Brown Analog Automatic Leather Watch ME3265,144,5,0.07%,0.13%,201,7,0.07%,0.13%,84.62%,100.00%,0,0,0.00%,0.00%,₹0.00,₹0.00,0,0
B0DJ2Z41C1,B0DJ2Z41C1,Emporio Armani Analog Green Dial Men's Watch-AR11640,61,2,0.03%,0.05%,80,3,0.03%,0.06%,100.00%,100.00%,0,0,0.00%,0.00%,₹0.00,₹0.00,0,0
B0DJ2Z6JSW,B0DJ2Z6JSW,Fossil Men's Machine Brown Analog Quartz Leather Watch FS6081Set,26,1,0.01%,0.03%,28,1,0.01%,0.02%,96.30%,100.00%,0,0,0.00%,0.00%,₹0.00,₹0.00,0,0
B0DJFH4K8B,B0DJFH4K8B,NexLev Cordless Tyre Inflator for Cars & Bikes|150 PSI| 2x2000 mAh Powerbank| Type-C Port| 5 Pre Set Mode|Auto Shut-Off |Digital Display| LED Light | Multiple Nozzles| AER Pro TIC-03,118,2,0.06%,0.05%,145,2,0.05%,0.04%,0.00%,0.00%,0,0,0.00%,0.00%,₹0.00,₹0.00,0,0
B0DJFH6RTL,B0DJFH6RTL,"NexLev Portable Tyre Inflator for Car, Bike, Cycle|150 PSI Pressure| 120 Watt Air Pump|12V Car Plug| Digital Display| Auto Shut-Off| Emergency LED Light| 3m Cord| 3 Air Nozzles| Compact| AER TI-02",45,1,0.02%,0.03%,53,1,0.02%,0.02%,4.08%,100.00%,0,0,0.00%,0.00%,₹0.00,₹0.00,0,0
B0DK9NRBWJ,B0DK9NRBWJ,NexLev Intimate Trimmer for Men|Ceramic Blade|120 Min Runtime|Type C Charge | IPX7 Waterproof | 7000RPM Copper Motor| Cordless|LED Light| Travel Lock| Wet/Dry Groin & Body Shaver | Intimate Pro TM-03,22,0,0.01%,0.00%,32,0,0.01%,0.00%,0.00%,0.00%,0,0,0.00%,0.00%,₹0.00,₹0.00,0,0
B0DKJBJBX6,B0DKJBJBX6,Armani Exchange Analog Black Dial Men's Watch-AX7163SET,78,4,0.04%,0.10%,116,5,0.04%,0.09%,94.90%,50.00%,0,0,0.00%,0.00%,₹0.00,₹0.00,0,0
B0DKJH623H,B0DKJH623H,Armani Exchange Analog Black Dial Men's Stainless Steel Watch-AX2461,164,3,0.08%,0.08%,249,3,0.09%,0.06%,76.15%,0.00%,0,0,0.00%,0.00%,₹0.00,₹0.00,0,0
B0DKJQDKPD,B0DKJQDKPD,Armani Exchange Analog Black Dial Men's Watch-AX1964,41,2,0.02%,0.05%,64,2,0.02%,0.04%,100.00%,100.00%,0,0,0.00%,0.00%,₹0.00,₹0.00,0,0
B0DNJP9T35,B0DNJP9T35,"NexLev Spin Scrubber|6 Scrubbing Heads| For Kitchen, Bathroom, Tub, Glass | Complete cleaning tool for Home, Office & Car| 90 min runtime | 2600 mAh | Cordless Type C | 2 Modes|Adjustable Handle|SS-02",309,7,0.14%,0.18%,413,9,0.15%,0.17%,1.90%,75.00%,0,0,0.00%,0.00%,₹0.00,₹0.00,0,0
B0DP2WC5VW,B0DP2WC5VW,White Mulberry |DIY| Wall Mounted Monitor Stand Mount | Supports 15-32 Inch Screens| 9 Kg Screen Load | VESA 75X75 & 100X100 | Spring Assisted Wall Mounted Monitor Mount | Black - (Single Screen),"1,130",79,0.53%,2.02%,"1,542",121,0.55%,2.26%,0.57%,11.27%,0,0,0.00%,0.00%,₹0.00,₹0.00,0,0
B0DP32F346,B0DP32F346,White Mulberry |DIY| Woodcraft - Premium Wooden Arm | Desk Mounted Monitor arm 15-32 Inch Monitor|9Kg Screen Capacity|Spring Assisted Premium Wooden Metal Desk Mount-(Single Screen),355,41,0.17%,1.05%,510,63,0.18%,1.18%,9.91%,87.50%,0,0,0.00%,0.00%,₹0.00,₹0.00,0,0
B0DP5HM2ZR,B0DP5HM2ZR,Michael Kors Emery Multicolor Quartz Stainless Steel Watch MK4882,43,0,0.02%,0.00%,47,0,0.02%,0.00%,97.87%,0.00%,0,0,0.00%,0.00%,₹0.00,₹0.00,0,0
B0DP5J526J,B0DP5J526J,Michael Kors Panorama Black Quartz Leather Watch MK9201,41,0,0.02%,0.00%,53,0,0.02%,0.00%,88.64%,0.00%,0,0,0.00%,0.00%,₹0.00,₹0.00,0,0
B0DP5J7VF3,B0DP5J7VF3,Michael Kors Panorama Silver Quartz Stainless Steel Watch MK9196,50,2,0.02%,0.05%,56,2,0.02%,0.04%,98.15%,100.00%,0,0,0.00%,0.00%,₹0.00,₹0.00,0,0
B0DP5JYG31,B0DP5JYG31,Michael Kors Panorama Black Quartz Stainless Steel Watch MK9198,54,1,0.03%,0.03%,75,1,0.03%,0.02%,100.00%,0.00%,0,0,0.00%,0.00%,₹0.00,₹0.00,0,0
B0DSBN62LR,B0DSBN62LR,Armani Exchange Black Quartz Silicone Watch AX7165SET,86,2,0.04%,0.05%,106,2,0.04%,0.04%,96.94%,0.00%,0,0,0.00%,0.00%,₹0.00,₹0.00,0,0
B0DSBN63D1,B0DSBN63D1,Armani Exchange Silver Quartz Stainless Steel Watch AX1767,5,0,0.00%,0.00%,7,0,0.00%,0.00%,100.00%,0.00%,0,0,0.00%,0.00%,₹0.00,₹0.00,0,0
B0DSBPGKDR,B0DSBPGKDR,Armani Exchange Gold Quartz Stainless Steel Watch AX5916,48,0,0.02%,0.00%,60,0,0.02%,0.00%,96.30%,0.00%,0,0,0.00%,0.00%,₹0.00,₹0.00,0,0
B0DSBPPPJ9,B0DSBPPPJ9,Fossil Womens Raquel Gold Quartz Stainless Steel White Dial Analog Watch ES5398,38,0,0.02%,0.00%,64,0,0.02%,0.00%,87.50%,0.00%,0,0,0.00%,0.00%,₹0.00,₹0.00,0,0
B0DSBPRB2W,B0DSBPRB2W,Armani Exchange Silver Quartz Stainless Steel Watch AX7166SET,27,0,0.01%,0.00%,39,0,0.01%,0.00%,100.00%,0.00%,0,0,0.00%,0.00%,₹0.00,₹0.00,0,0
B0DSBQ8JV7,B0DSBQ8JV7,Michael Kors Lexington Blue Quartz Stainless Steel Watch MK7519LE,59,2,0.03%,0.05%,74,2,0.03%,0.04%,98.57%,100.00%,0,0,0.00%,0.00%,₹0.00,₹0.00,0,0
B0DSBQN2B9,B0DSBQN2B9,Fossil Men Everett Grey Quartz Stainless Steel Analog Watch FS6107,203,5,0.09%,0.13%,258,8,0.09%,0.15%,92.67%,100.00%,0,0,0.00%,0.00%,₹0.00,₹0.00,0,0
B0DSBQWH32,B0DSBQWH32,Fossil Womens Raquel Silver Quartz Stainless Steel White Dial Analog Watch ES5400,33,1,0.02%,0.03%,37,1,0.01%,0.02%,70.59%,100.00%,0,0,0.00%,0.00%,₹0.00,₹0.00,0,0
B0DSBR61QS,B0DSBR61QS,Michael Kors Gramercy Gold Quartz Stainless Steel Watch MK7527,53,0,0.02%,0.00%,65,0,0.02%,0.00%,98.28%,0.00%,0,0,0.00%,0.00%,₹0.00,₹0.00,0,0
B0DSBR8G7Y,B0DSBR8G7Y,Armani Exchange Multicolor Quartz Stainless Steel Watch AX5176,80,1,0.04%,0.03%,108,1,0.04%,0.02%,96.77%,0.00%,0,0,0.00%,0.00%,₹0.00,₹0.00,0,0
B0DSBRPS7R,B0DSBRPS7R,Armani Exchange Pink Quartz Stainless Steel Watch AX7167SET,22,1,0.01%,0.03%,29,2,0.01%,0.04%,96.43%,0.00%,0,0,0.00%,0.00%,₹0.00,₹0.00,0,0
B0DSBRQNM8,B0DSBRQNM8,Fossil Women Raquel Multicolor Quartz Stainless Steel White Dial Analog Watch ES5399,82,0,0.04%,0.00%,102,0,0.04%,0.00%,95.65%,0.00%,0,0,0.00%,0.00%,₹0.00,₹0.00,0,0
B0DSBRWZ8N,B0DSBRWZ8N,Fossil Chronograph Men Neutra Brown Quartz Leather Gold Dial Watch FS6113,592,6,0.28%,0.15%,791,9,0.28%,0.17%,53.05%,50.00%,0,0,0.00%,0.00%,₹0.00,₹0.00,0,0
B0DSBS17RY,B0DSBS17RY,Armani Exchange Silver Quartz Stainless Steel Watch AX4186,140,5,0.07%,0.13%,195,5,0.07%,0.09%,97.04%,100.00%,0,0,0.00%,0.00%,₹0.00,₹0.00,0,0
B0DSBSVS4X,B0DSBSVS4X,Fossil Womens Raquel Silver Quartz Stainless Steel Blue Dial Analog Watch ES5402,140,1,0.07%,0.03%,202,1,0.07%,0.02%,79.39%,0.00%,0,0,0.00%,0.00%,₹0.00,₹0.00,0,0
B0DSBT4S4K,B0DSBT4S4K,Fossil Men Carraway Brown Quartz Leather Blue Dial Analog Watch FS6110,279,9,0.13%,0.23%,387,10,0.14%,0.19%,70.77%,100.00%,0,0,0.00%,0.00%,₹0.00,₹0.00,0,0
B0DT2KTXK3,B0DT2KTXK3,Emporio Armani Silver Quartz Stainless Steel Watch AR11676,73,1,0.03%,0.03%,100,1,0.04%,0.02%,100.00%,100.00%,0,0,0.00%,0.00%,₹0.00,₹0.00,0,0
B0DT2QDBS3,B0DT2QDBS3,Emporio Armani Brown Quartz Leather Watch AR11665,215,9,0.10%,0.23%,277,9,0.10%,0.17%,91.56%,71.43%,0,0,0.00%,0.00%,₹0.00,₹0.00,0,0
B0DT2XZNK5,B0DT2XZNK5,Emporio Armani Silver Quartz Stainless Steel Watch AR11664,186,9,0.09%,0.23%,231,10,0.08%,0.19%,92.20%,100.00%,0,0,0.00%,0.00%,₹0.00,₹0.00,0,0
B0DT2ZQV18,B0DT2ZQV18,Emporio Armani Green Quartz Leather Watch AR11661,16,0,0.01%,0.00%,23,0,0.01%,0.00%,100.00%,0.00%,0,0,0.00%,0.00%,₹0.00,₹0.00,0,0
B0DT2ZS8T4,B0DT2ZS8T4,Emporio Armani Pink Quartz Stainless Steel Watch AR11671,20,0,0.01%,0.00%,25,0,0.01%,0.00%,100.00%,0.00%,0,0,0.00%,0.00%,₹0.00,₹0.00,0,0
B0DT31Q99D,B0DT31Q99D,Emporio Armani Silver Quartz Stainless Steel Watch AR11669,8,0,0.00%,0.00%,10,0,0.00%,0.00%,100.00%,0.00%,0,0,0.00%,0.00%,₹0.00,₹0.00,0,0
B0DT322B7L,B0DT322B7L,Emporio Armani Silver Quartz Stainless Steel Watch AR11662,11,0,0.01%,0.00%,15,0,0.01%,0.00%,100.00%,0.00%,0,0,0.00%,0.00%,₹0.00,₹0.00,0,0
B0DT32JDPV,B0DT32JDPV,Emporio Armani Gold Quartz Stainless Steel Watch AR11663,11,0,0.01%,0.00%,21,0,0.01%,0.00%,100.00%,0.00%,0,0,0.00%,0.00%,₹0.00,₹0.00,0,0
B0DT34RQM2,B0DT34RQM2,Michael Kors Gramercy Pink Quartz Stainless Steel Watch MK7528,37,0,0.02%,0.00%,39,0,0.01%,0.00%,97.30%,0.00%,0,0,0.00%,0.00%,₹0.00,₹0.00,0,0
B0DT36621X,B0DT36621X,Emporio Armani Brown Quartz Leather Watch AR11672,102,4,0.05%,0.10%,158,9,0.06%,0.17%,82.86%,85.71%,0,0,0.00%,0.00%,₹0.00,₹0.00,0,0
B0DT37Y5FY,B0DT37Y5FY,Michael Kors Gramercy Silver Quartz Stainless Steel Watch MK7529,73,0,0.03%,0.00%,86,0,0.03%,0.00%,89.16%,0.00%,0,0,0.00%,0.00%,₹0.00,₹0.00,0,0
B0DTK4FY1G,B0DTK4FY1G,"NexLev Spin Scrubber with Soap Spray | 6 heads| For Kitchen, Tub, Glass, Complete cleaning tool for Home, Office & Car| 90 min runtime | 4500 mAh | Cordless Type C | Adjustable Handle|SS-01, White",425,9,0.20%,0.23%,523,18,0.19%,0.34%,0.42%,12.50%,0,0,0.00%,0.00%,₹0.00,₹0.00,0,0
B0DTYDTKN8,B0DTYDTKN8,NexLev Cordless Spin Mop|50 Min Runtime|2 Extra Mop Pads | Type C | For Home Kitchen & Office Use | Water Spray Function|Self Propelling|Mopping for All Floor Types|LED for Corners and Underbed|SPM-01,421,6,0.20%,0.15%,583,7,0.21%,0.13%,1.00%,100.00%,0,0,0.00%,0.00%,₹0.00,₹0.00,0,0
B0DV931G48,B0DV931G48,"NexLev Cordless Body Massager | Neck, Shoulder, Back, Legs & Thigh Pain Relief | 10 Intensity and 12 Modes | 6 Attachments | Deep Tissue Kneading for Complete Pain Relief | Charging Indicator | PM-02",10,0,0.00%,0.00%,11,0,0.00%,0.00%,0.00%,0.00%,0,0,0.00%,0.00%,₹0.00,₹0.00,0,0
B0DVC7VJP1,B0DVC7VJP1,"NexLev Stand Mixer |5.5L SS Bowl | 1500W |10 Speeds | Pulse Function |Planetary Rotation | Whisk, Beater & Dough Hook|100% Copper Motor | For Roti & Cookie Dough, Cake Making, Whip Cream & more |ST-01","1,711",28,0.80%,0.72%,"2,279",38,0.81%,0.71%,1.21%,100.00%,0,0,0.00%,0.00%,₹0.00,₹0.00,0,0
B0DVCBR11D,B0DVCBR11D,"nexlev Travel Neck Pillow | Orthopedic Premium Memory Foam | for Airplane, Car, Train, Office use & Cervical Pain | Machine Washable | 360 Support | Carry Pouch for Storage | NP-06",5,1,0.00%,0.03%,7,3,0.00%,0.06%,0.00%,0.00%,0,0,0.00%,0.00%,₹0.00,₹0.00,0,0
B0FCVBJX29,B0FCVBJX29,Fossil Neutra Brown Quartz Leather Watch FS6129,91,3,0.04%,0.08%,108,3,0.04%,0.06%,93.00%,100.00%,0,0,0.00%,0.00%,₹0.00,₹0.00,0,0
B0FCVBY986,B0FCVBY986,Fossil Raquel Gold Quartz Stainless Steel Watch ES5434,126,2,0.06%,0.05%,159,2,0.06%,0.04%,83.33%,100.00%,0,0,0.00%,0.00%,₹0.00,₹0.00,0,0
B0FCVFDZP7,B0FCVFDZP7,Fossil Grant Metallic Quartz Stainless Steel Watch FS6133,87,3,0.04%,0.08%,115,4,0.04%,0.07%,60.95%,100.00%,0,0,0.00%,0.00%,₹0.00,₹0.00,0,0
B0FCVGHVV7,B0FCVGHVV7,Fossil Gilmore Multicolor Quartz Stainless Steel Watch ES5422,14,0,0.01%,0.00%,21,0,0.01%,0.00%,50.00%,0.00%,0,0,0.00%,0.00%,₹0.00,₹0.00,0,0
B0FCVHPY4B,B0FCVHPY4B,Fossil Gilmore Gold Quartz Stainless Steel Watch ES5421,12,0,0.01%,0.00%,18,0,0.01%,0.00%,93.75%,0.00%,0,0,0.00%,0.00%,₹0.00,₹0.00,0,0
B0FCVKH4TS,B0FCVKH4TS,Fossil Raquel Gold Quartz Stainless Steel Watch ES5417,45,0,0.02%,0.00%,62,0,0.02%,0.00%,66.07%,0.00%,0,0,0.00%,0.00%,₹0.00,₹0.00,0,0
B0FCVLB3FG,B0FCVLB3FG,Fossil Gilmore Rose Gold Quartz Stainless Steel Watch ES5420,51,1,0.02%,0.03%,78,1,0.03%,0.02%,68.18%,0.00%,0,0,0.00%,0.00%,₹0.00,₹0.00,0,0
B0FCVLFLGF,B0FCVLFLGF,Fossil Gilmore Silver Quartz Stainless Steel Watch ES5419,40,3,0.02%,0.08%,59,3,0.02%,0.06%,76.92%,100.00%,0,0,0.00%,0.00%,₹0.00,₹0.00,0,0
B0FCVRKB8C,B0FCVRKB8C,Fossil Grant Multicolor Quartz Stainless Steel Watch FS6132,209,5,0.10%,0.13%,294,7,0.10%,0.13%,99.25%,100.00%,0,0,0.00%,0.00%,₹0.00,₹0.00,0,0
B0FF51KX2Q,B0FF51KX2Q,Fossil Nate Chronograph Analog Black Dial Grey Band Men's Watch,1,0,0.00%,0.00%,1,0,0.00%,0.00%,0.00%,0.00%,0,0,0.00%,0.00%,₹0.00,₹0.00,0,0
B0FFD8Q4K6,B0FFD8Q4K6,Armani Exchange Gold Quartz Stainless Steel Watch AX5735,19,0,0.01%,0.00%,24,0,0.01%,0.00%,91.67%,0.00%,0,0,0.00%,0.00%,₹0.00,₹0.00,0,0
B0FFDJHKR5,B0FFDJHKR5,Armani Exchange Silver Quartz Stainless Steel Watch AX2820,23,0,0.01%,0.00%,29,0,0.01%,0.00%,96.43%,0.00%,0,0,0.00%,0.00%,₹0.00,₹0.00,0,0
B0FFDJNB8T,B0FFDJNB8T,Armani Exchange Black Quartz Stainless Steel Watch AX5732,16,0,0.01%,0.00%,21,0,0.01%,0.00%,57.89%,0.00%,0,0,0.00%,0.00%,₹0.00,₹0.00,0,0
B0FFDM5QJX,B0FFDM5QJX,Armani Exchange Metallic Quartz Stainless Steel Watch AX2823,22,1,0.01%,0.03%,24,2,0.01%,0.04%,100.00%,100.00%,0,0,0.00%,0.00%,₹0.00,₹0.00,0,0
B0FFDSN4S1,B0FFDSN4S1,Armani Exchange Multicolor Quartz Stainless Steel Watch AX2821,63,2,0.03%,0.05%,86,3,0.03%,0.06%,95.65%,0.00%,0,0,0.00%,0.00%,₹0.00,₹0.00,0,0
B0FFHXRJNS,B0FFHXRJNS,Emporio Armani Multicolor Quartz Plastic Watch AR11694,19,0,0.01%,0.00%,23,0,0.01%,0.00%,100.00%,0.00%,0,0,0.00%,0.00%,₹0.00,₹0.00,0,0
B0FFJ2583H,B0FFJ2583H,Emporio Armani Silver Quartz Stainless Steel Watch AR11706,20,0,0.01%,0.00%,28,0,0.01%,0.00%,88.46%,0.00%,0,0,0.00%,0.00%,₹0.00,₹0.00,0,0
B0FFJ6T8YY,B0FFJ6T8YY,Emporio Armani Silver Quartz Stainless Steel Watch AR11688,172,6,0.08%,0.15%,237,9,0.08%,0.17%,88.38%,0.00%,0,0,0.00%,0.00%,₹0.00,₹0.00,0,0
B0FFJ939GQ,B0FFJ939GQ,Emporio Armani Brown Quartz Leather Watch AR11708,64,1,0.03%,0.03%,90,1,0.03%,0.02%,96.15%,100.00%,0,0,0.00%,0.00%,₹0.00,₹0.00,0,0
B0FFJG71QJ,B0FFJG71QJ,Emporio Armani Silver Quartz Stainless Steel Watch AR11691,35,0,0.02%,0.00%,48,0,0.02%,0.00%,95.12%,0.00%,0,0,0.00%,0.00%,₹0.00,₹0.00,0,0
B0FFJJM7DS,B0FFJJM7DS,Emporio Armani Gold Quartz Stainless Steel Watch AR11707,76,1,0.04%,0.03%,107,1,0.04%,0.02%,97.89%,100.00%,0,0,0.00%,0.00%,₹0.00,₹0.00,0,0
B0FFJPKHZL,B0FFJPKHZL,Emporio Armani Black Quartz Leather Watch AR11690,80,3,0.04%,0.08%,114,3,0.04%,0.06%,98.89%,100.00%,0,0,0.00%,0.00%,₹0.00,₹0.00,0,0
B0FFJQB51R,B0FFJQB51R,Emporio Armani Green Quartz Rubber Watch AR11693,33,3,0.02%,0.08%,41,3,0.01%,0.06%,100.00%,100.00%,0,0,0.00%,0.00%,₹0.00,₹0.00,0,0
B0FJ1ZB4G9,B0FJ1ZB4G9,Nexlev Electric Toothbrush| 40000 vibrations/min|USB Type C| 5 Modes| 2 Min timer| 30 sec Quad Interval| 4 Replaceable Brush Heads With Cover| IPX7 Waterproof| For Adults| ETC-08 MidNight Blue,37,1,0.02%,0.03%,49,1,0.02%,0.02%,2.27%,100.00%,0,0,0.00%,0.00%,₹0.00,₹0.00,0,0
B0FJ2RND61,B0FJ2RND61,Fossil Townsman Brown Automatic Leather Watch ME3270,577,15,0.27%,0.38%,694,18,0.25%,0.34%,62.42%,100.00%,0,0,0.00%,0.00%,₹0.00,₹0.00,0,0
B0FJ2SQTNR,B0FJ2SQTNR,Fossil Everett Silver Quartz Stainless Steel Watch FS6128,90,2,0.04%,0.05%,119,2,0.04%,0.04%,93.52%,100.00%,0,0,0.00%,0.00%,₹0.00,₹0.00,0,0
B0FJZZ4X7Q,B0FJZZ4X7Q,Michael Kors Billie Multicolor Quartz Stainless Steel Watch MK9221,27,1,0.01%,0.03%,35,1,0.01%,0.02%,93.33%,100.00%,0,0,0.00%,0.00%,₹0.00,₹0.00,0,0
B0FJZZ6J3R,B0FJZZ6J3R,Michael Kors Billie Gold Quartz Stainless Steel Watch MK9220,16,0,0.01%,0.00%,17,0,0.01%,0.00%,94.12%,0.00%,0,0,0.00%,0.00%,₹0.00,₹0.00,0,0
B0FK1995CB,B0FK1995CB,Michael Kors Bryant Brown Quartz Stainless Steel Watch MK7559,92,2,0.04%,0.05%,113,2,0.04%,0.04%,81.48%,100.00%,0,0,0.00%,0.00%,₹0.00,₹0.00,0,0
B0FK1FC978,B0FK1FC978,Michael Kors Phoebe Gold Quartz Stainless Steel Watch MK4923,115,1,0.05%,0.03%,140,1,0.05%,0.02%,61.72%,0.00%,0,0,0.00%,0.00%,₹0.00,₹0.00,0,0
B0FK237HV4,B0FK237HV4,Michael Kors Billie Silver Quartz Stainless Steel Watch MK9222,20,0,0.01%,0.00%,25,0,0.01%,0.00%,91.30%,0.00%,0,0,0.00%,0.00%,₹0.00,₹0.00,0,0
B0FKBV3N4Y,B0FKBV3N4Y,Michael Kors Georgie Rose Gold Quartz Stainless Steel Watch MK4932,22,2,0.01%,0.05%,27,2,0.01%,0.04%,57.69%,100.00%,0,0,0.00%,0.00%,₹0.00,₹0.00,0,0
B0FKBV4H32,B0FKBV4H32,Michael Kors Billie Black Quartz Stainless Steel Watch MK9223,90,2,0.04%,0.05%,119,3,0.04%,0.06%,82.73%,100.00%,0,0,0.00%,0.00%,₹0.00,₹0.00,0,0
B0FKBVB3YH,B0FKBVB3YH,Michael Kors Georgie Multicolor Quartz Stainless Steel Watch MK4935,20,0,0.01%,0.00%,23,0,0.01%,0.00%,66.67%,0.00%,0,0,0.00%,0.00%,₹0.00,₹0.00,0,0
B0FKBVVZ7P,B0FKBVVZ7P,Michael Kors Georgie Silver Quartz Stainless Steel Watch MK4933,9,0,0.00%,0.00%,9,0,0.00%,0.00%,77.78%,0.00%,0,0,0.00%,0.00%,₹0.00,₹0.00,0,0
B0FKBW8L5H,B0FKBW8L5H,Michael Kors Georgie Gold Quartz Stainless Steel Watch MK4931,19,0,0.01%,0.00%,23,0,0.01%,0.00%,83.33%,0.00%,0,0,0.00%,0.00%,₹0.00,₹0.00,0,0
B0FKBWS861,B0FKBWS861,Michael Kors Georgie Gold Quartz Stainless Steel Watch MK4934,36,0,0.02%,0.00%,47,0,0.02%,0.00%,76.74%,0.00%,0,0,0.00%,0.00%,₹0.00,₹0.00,0,0
B0FQ832739,B0FQ832739,Michael Kors Lexington Gold Quartz Stainless Steel Watch MK9245SET,34,0,0.02%,0.00%,47,0,0.02%,0.00%,100.00%,0.00%,0,0,0.00%,0.00%,₹0.00,₹0.00,0,0
B0FQ8BFNPN,B0FQ8BFNPN,Michael Kors Phoebe Silver Quartz Stainless Steel Watch MK4963,10,0,0.00%,0.00%,11,0,0.00%,0.00%,100.00%,0.00%,0,0,0.00%,0.00%,₹0.00,₹0.00,0,0
B0FQ8K147H,B0FQ8K147H,Michael Kors Lexington Silver Quartz Stainless Steel Watch MK9242,34,0,0.02%,0.00%,65,0,0.02%,0.00%,94.83%,0.00%,0,0,0.00%,0.00%,₹0.00,₹0.00,0,0
B0FRV4KDN4,B0FRV4KDN4,Armani Exchange Sync Multicolor Quartz Stainless Steel Watch AX4199,35,2,0.02%,0.05%,38,2,0.01%,0.04%,97.30%,0.00%,0,0,0.00%,0.00%,₹0.00,₹0.00,0,0
B0FRVBBDM9,B0FRVBBDM9,Armani Exchange Black Watch AX4621,102,0,0.05%,0.00%,137,0,0.05%,0.00%,61.60%,0.00%,0,0,0.00%,0.00%,₹0.00,₹0.00,0,0
B0FRVG8SR6,B0FRVG8SR6,Armani Exchange Analog Green Dial Men's Watch-AX1970,10,0,0.00%,0.00%,12,0,0.00%,0.00%,100.00%,0.00%,0,0,0.00%,0.00%,₹0.00,₹0.00,0,0
B0FRVT4SJ1,B0FRVT4SJ1,Armani Exchange Analog Green Dial Men's Watch-AX2765,15,0,0.01%,0.00%,19,0,0.01%,0.00%,100.00%,0.00%,0,0,0.00%,0.00%,₹0.00,₹0.00,0,0
B0FRVZ29NP,B0FRVZ29NP,Armani Exchange Silver Watch Set AX7176SET,105,0,0.05%,0.00%,136,0,0.05%,0.00%,99.22%,0.00%,0,0,0.00%,0.00%,₹0.00,₹0.00,0,0
B0FRVZCYH9,B0FRVZCYH9,Armani Exchange Black Quartz Rubber Watch AX1769,44,0,0.02%,0.00%,54,0,0.02%,0.00%,98.04%,0.00%,0,0,0.00%,0.00%,₹0.00,₹0.00,0,0
B0FRW51FQF,B0FRW51FQF,Armani Exchange Black Watch AX4173,16,2,0.01%,0.05%,18,2,0.01%,0.04%,100.00%,100.00%,0,0,0.00%,0.00%,₹0.00,₹0.00,0,0
B0FS6JY8XW,B0FS6JY8XW,Michael Kors Essex Nude Watch MK4964,10,0,0.00%,0.00%,14,0,0.00%,0.00%,100.00%,0.00%,0,0,0.00%,0.00%,₹0.00,₹0.00,0,0
B0FS6M8FSK,B0FS6M8FSK,Michael Kors Essex Red Watch MK4966,57,0,0.03%,0.00%,69,0,0.02%,0.00%,96.97%,0.00%,0,0,0.00%,0.00%,₹0.00,₹0.00,0,0
B0FS6N1YT5,B0FS6N1YT5,Michael Kors Essex 2-Tone Watch MK4967,20,0,0.01%,0.00%,23,0,0.01%,0.00%,86.36%,0.00%,0,0,0.00%,0.00%,₹0.00,₹0.00,0,0
B0FTK3KCY6,B0FTK3KCY6,Fossil Campbell Silver Quartz Stainless Steel Watch FS6140,66,1,0.03%,0.03%,94,1,0.03%,0.02%,96.59%,100.00%,0,0,0.00%,0.00%,₹0.00,₹0.00,0,0
B0FTK7KQ1P,B0FTK7KQ1P,Fossil Machine Silver Quartz Stainless Steel Watch FS6144,74,5,0.03%,0.13%,102,5,0.04%,0.09%,95.40%,100.00%,0,0,0.00%,0.00%,₹0.00,₹0.00,0,0
B0FTKJC5JW,B0FTKJC5JW,Fossil Neutra Brown Quartz Leather Watch FS6143,67,2,0.03%,0.05%,96,3,0.03%,0.06%,74.12%,0.00%,0,0,0.00%,0.00%,₹0.00,₹0.00,0,0
