(Parent) ASIN,(Child) ASIN,Title,Sessions - Total,Sessions - Total - B2B,Session Percentage - Total,Session Percentage - Total - B2B,Page Views - Total,Page Views - Total - B2B,Page Views Percentage - Total,Page Views Percentage - Total - B2B,Featured Offer Percentage,Featured Offer Percentage - B2B,Units Ordered,Units Ordered - B2B,Unit Session Percentage,Unit Session Percentage - B2B,Ordered Product Sales,Ordered Product Sales - B2B,Total Order Items,Total Order Items - B2B
B00KNK7UHI,B00KNK7UHI,Diesel Stainless Steel Mr Daddy 2 Analog Black Dial Red Strap (Big Dial Red Strap) Men's Watch - Dz7313,"1,967",19,0.92%,0.49%,"2,271",22,0.81%,0.41%,75.23%,73.33%,0,0,0.00%,0.00%,₹0.00,₹0.00,0,0
B00PW3J8LM,B00PW3J8LM,"Fossil Men Leather Townsman Analog Black Dial Watch -Me3061, Band Color-Brown",197,5,0.09%,0.13%,250,6,0.09%,0.11%,96.98%,100.00%,0,0,0.00%,0.00%,₹0.00,₹0.00,0,0
B00Z52HG6O,B00Z52HG6O,Michael Kors Slim Runway Analog Rose Gold Dial Women's Watch-MK3197,9,0,0.00%,0.00%,9,0,0.00%,0.00%,100.00%,0.00%,0,0,0.00%,0.00%,₹0.00,₹0.00,0,0
B01GZZZ328,B01GZZZ328,Emporio Armani Luigi Analog White Dial Men's Watch - AR2502,405,5,0.19%,0.13%,524,8,0.19%,0.15%,98.09%,100.00%,0,0,0.00%,0.00%,₹0.00,₹0.00,0,0
B01ISNU3X4,B01ISNU3X4,"TONOR Dynamic Karaoke Microphone for Singing with 4.5m XLR Cable, Metal Handheld Mic Compatible with Karaoke Machine/Speaker/Amp/Mixer for Karaoke Singing, Speech, Wedding, Stage and Outdoor Activity","1,737",34,0.81%,0.87%,"2,557",46,0.91%,0.86%,0.04%,0.00%,0,0,0.00%,0.00%,₹0.00,₹0.00,0,0
B01MTYS3BW,B01MTYS3BW,Diesel Analog Stainless Steel Black Dial and Band (Big dial) Men's Watch-DZ7395,"1,717",44,0.80%,1.13%,"2,256",63,0.80%,1.18%,1.40%,0.00%,0,0,0.00%,0.00%,₹0.00,₹0.00,0,0
B0769YW2KN,B0769YW2KN,"Fossil Leather Analog Black Dial Men's Watch - Me3154, Band Color-Brown",187,5,0.09%,0.13%,232,6,0.08%,0.11%,74.64%,100.00%,0,0,0.00%,0.00%,₹0.00,₹0.00,0,0
B077SMJP9Z,B077SMJP9Z,"Skagen Stainless Steel Analog White Dial Women Watch - Skw2694, Rose Gold Band",538,2,0.25%,0.05%,649,2,0.23%,0.04%,0.16%,0.00%,0,0,0.00%,0.00%,₹0.00,₹0.00,0,0
B077SN2LNP,B077SN2LNP,Michael Kors Lexington Analog Black Dial Men's Watch-MK8603,131,2,0.06%,0.05%,178,3,0.06%,0.06%,95.57%,100.00%,0,0,0.00%,0.00%,₹0.00,₹0.00,0,0
B078Y2PJL4,B078Y2PJL4,"Fossil Stainless Steel Women Karli Rose Gold Dial Analog Watch Bq3181, Rose Gold Band",0,0,0.00%,0.00%,0,0,0.00%,0.00%,0.00%,0.00%,0,0,0.00%,0.00%,₹0.00,₹0.00,0,0
B079XB5RXH,B079XB5RXH,Michael Kors Ritz Analogue Women's Watch (Rose Gold Dial Rose Gold Colored Strap),558,8,0.26%,0.20%,697,10,0.25%,0.19%,99.69%,100.00%,0,0,0.00%,0.00%,₹0.00,₹0.00,0,0
B07MM5MH6F,B07MM5MH6F,Fossil Neutra Analog Grey Dial Men's Watch-FS5512,782,8,0.36%,0.20%,"1,034",9,0.37%,0.17%,86.49%,100.00%,0,0,0.00%,0.00%,₹0.00,₹0.00,0,0
B07QL3PH84,B07QL3PH84,Fossil Men's Elgin Card Case Leather Wallet,2,0,0.00%,0.00%,2,0,0.00%,0.00%,0.00%,0.00%,0,0,0.00%,0.00%,₹0.00,₹0.00,0,0
B07QSK7DHR,B07QSK7DHR,Michael Kors Analog Gold Dial Women's Watch-MK4339,389,1,0.18%,0.03%,446,1,0.16%,0.02%,92.08%,0.00%,0,0,0.00%,0.00%,₹0.00,₹0.00,0,0
B07QW9DDGB,B07QW9DDGB,Michael Kors Maci Blue Watch MK2833,4,0,0.00%,0.00%,5,0,0.00%,0.00%,100.00%,0.00%,0,0,0.00%,0.00%,₹0.00,₹0.00,0,0
B07RPQWF6B,B07RPQWF6B,Fossil Women Tillie Mini White Dial Rosegold Band Quartz Stainless Steel Analog Watch BQ3502,0,0,0.00%,0.00%,0,0,0.00%,0.00%,0.00%,0.00%,0,0,0.00%,0.00%,₹0.00,₹0.00,0,0
B07SZSVT1F,B07SZSVT1F,"Diesel Stainless Steel Analog Silver Dial Men's Watch-Dz2213, Band Color:Black",34,0,0.02%,0.00%,51,0,0.02%,0.00%,97.67%,0.00%,0,0,0.00%,0.00%,₹0.00,₹0.00,0,0
B07T1X89FZ,B07T1X89FZ,"Diesel Stainless Steel Analog Silver Dial Men's Watch-Dz2215, Band Color:Green",23,0,0.01%,0.00%,27,0,0.01%,0.00%,73.08%,0.00%,0,0,0.00%,0.00%,₹0.00,₹0.00,0,0
B07T1X8TKH,B07T1X8TKH,"Diesel Stainless Steel Analog White Dial Men's Watch-Dz2214, Band Color:Gold",7,0,0.00%,0.00%,8,0,0.00%,0.00%,75.00%,0.00%,0,0,0.00%,0.00%,₹0.00,₹0.00,0,0
B07T1X96CL,B07T1X96CL,"Diesel Leather Analog Multicolor Dial Men's Watch-Dz4667, Band Color -Black",45,0,0.02%,0.00%,57,0,0.02%,0.00%,23.08%,0.00%,0,0,0.00%,0.00%,₹0.00,₹0.00,0,0
B07T2XY7V5,B07T2XY7V5,Diesel Spiked Black Quartz Leather Watch DZ4671,9,2,0.00%,0.05%,12,2,0.00%,0.04%,100.00%,100.00%,0,0,0.00%,0.00%,₹0.00,₹0.00,0,0
B07T2XYGR5,B07T2XYGR5,Diesel Men Spiked Green Quartz Stainless Steel Chronograph Watch DZ4670,80,1,0.04%,0.03%,98,2,0.03%,0.04%,97.73%,100.00%,0,0,0.00%,0.00%,₹0.00,₹0.00,0,0
B07T2XYHYD,B07T2XYHYD,Diesel D-Era White Quartz Leather Watch DZ5613,3,0,0.00%,0.00%,4,0,0.00%,0.00%,100.00%,0.00%,0,0,0.00%,0.00%,₹0.00,₹0.00,0,0
B07T2XZ5K4,B07T2XZ5K4,Diesel Analog Silver Dial Men's Watch-DZ2219,15,2,0.01%,0.05%,15,2,0.01%,0.04%,100.00%,100.00%,0,0,0.00%,0.00%,₹0.00,₹0.00,0,0
B07T3ZLNM3,B07T3ZLNM3,"Diesel Leather Analog Silver Dial Men's Watch-Dz4665, Band Color -Brown","1,310",20,0.61%,0.51%,"1,566",26,0.56%,0.49%,76.91%,75.00%,0,0,0.00%,0.00%,₹0.00,₹0.00,0,0
B07T3ZPD9X,B07T3ZPD9X,Diesel D-Era Black Quartz Leather Watch DZ5612,10,0,0.00%,0.00%,10,0,0.00%,0.00%,100.00%,0.00%,0,0,0.00%,0.00%,₹0.00,₹0.00,0,0
B07T53T1KV,B07T53T1KV,Diesel Mr. Daddy Slim Grey Quartz Stainless Steel Watch DZ7487,221,4,0.10%,0.10%,282,4,0.10%,0.07%,89.19%,100.00%,0,0,0.00%,0.00%,₹0.00,₹0.00,0,0
B07T53XXCF,B07T53XXCF,Diesel Analog Black Dial Men's Watch-DZ2196,8,0,0.00%,0.00%,8,0,0.00%,0.00%,100.00%,0.00%,0,0,0.00%,0.00%,₹0.00,₹0.00,0,0
B07T62VK1C,B07T62VK1C,"Diesel Stainless Steel Analog White Dial Men's Watch-Dz2212, Band Color:Silver",47,1,0.02%,0.03%,64,1,0.02%,0.02%,100.00%,0.00%,0,0,0.00%,0.00%,₹0.00,₹0.00,0,0
B07T62XNWY,B07T62XNWY,Diesel D-Era Silver Quartz Stainless Steel Watch DZ5609,9,0,0.00%,0.00%,13,0,0.00%,0.00%,100.00%,0.00%,0,0,0.00%,0.00%,₹0.00,₹0.00,0,0
B07T63MQ9G,B07T63MQ9G,"Diesel Leather Analog Black Dial Men's Watch-Dz2210Set, Band Color -Black",1,0,0.00%,0.00%,1,0,0.00%,0.00%,100.00%,0.00%,0,0,0.00%,0.00%,₹0.00,₹0.00,0,0
B07T63ZJTR,B07T63ZJTR,"Diesel Stainless Steel Analog Yellow Dial Men's Watch-Dz4662, Band Color -Gold",113,1,0.05%,0.03%,154,1,0.05%,0.02%,93.66%,0.00%,0,0,0.00%,0.00%,₹0.00,₹0.00,0,0
B07WLWN2ZT,B07WLWN2ZT,"TONOR USB Gaming Microphone, Computer Condenser PC Mic with Tripod Stand & Pop for Streaming, Podcasting, Vocal Recording, Compatible with iMac PC Laptop Desktop Windows Computer, TC-777",387,1,0.18%,0.03%,499,1,0.18%,0.02%,0.00%,0.00%,0,0,0.00%,0.00%,₹0.00,₹0.00,0,0
B0846PC77Q,B0846PC77Q,Armani Exchange Analog Black Dial Men's Watch-AX2413,178,2,0.08%,0.05%,240,2,0.09%,0.04%,95.83%,100.00%,0,0,0.00%,0.00%,₹0.00,₹0.00,0,0
B088NYP2LX,B088NYP2LX,"MVMT Stainless Steel Caviar Analog Black Dial Men Watch-28000052-D, Black Band",1,0,0.00%,0.00%,1,0,0.00%,0.00%,100.00%,0.00%,0,0,0.00%,0.00%,₹0.00,₹0.00,0,0
B08BCLYN66,B08BCLYN66,Armani Exchange Gold Quartz Stainless Steel Watch AX5734,21,1,0.01%,0.03%,25,1,0.01%,0.02%,95.83%,0.00%,0,0,0.00%,0.00%,₹0.00,₹0.00,0,0
B08CVP2HXP,B08CVP2HXP,"TONOR USB Microphone, Condenser Computer PC Mic with Tripod Stand, Metal,Pop Filter, Shock Mount for Gaming,Streaming,Podcasting,YouTube, Voice Over,Skype, Twitch,Compatible with Laptop Desktop, TC30",478,6,0.22%,0.15%,678,10,0.24%,0.19%,1.79%,0.00%,0,0,0.00%,0.00%,₹0.00,₹0.00,0,0
B08LNJ6Z9H,B08LNJ6Z9H,"PreSonus Revelator USB-C Microphone for podcasting, live streaming, with built-in voice effects plus loopback mixer for gaming, casting, and recording interviews over Skype, Zoom, Discord",4,0,0.00%,0.00%,5,0,0.00%,0.00%,100.00%,0.00%,0,0,0.00%,0.00%,₹0.00,₹0.00,0,0
B08R6P2518,B08R6P2518,Fossil Men Leather Everett Black Card Case Ml4398001,403,10,0.19%,0.26%,461,12,0.16%,0.22%,89.34%,100.00%,0,0,0.00%,0.00%,₹0.00,₹0.00,0,0
B08XBYKWW3,B08XBYKWW3,Emporio Armani Diver Analog Green Dial Men's Watch-AR11338,299,4,0.14%,0.10%,381,4,0.14%,0.07%,94.91%,100.00%,0,0,0.00%,0.00%,₹0.00,₹0.00,0,0
B09BBK2LV4,B09BBK2LV4,"Emporio Armani Analog Black Dial Men's Watch-AR11360 Stainless Steel, silver Strap",505,10,0.24%,0.26%,603,11,0.21%,0.21%,91.21%,75.00%,0,0,0.00%,0.00%,₹0.00,₹0.00,0,0
B09GYMBKMQ,B09GYMBKMQ,Armani Exchange Black Watch AX2429,59,1,0.03%,0.03%,60,1,0.02%,0.02%,78.33%,0.00%,0,0,0.00%,0.00%,₹0.00,₹0.00,0,0
B09NC2NFR9,B09NC2NFR9,Fossil Machine Analog Black Dial Men's Watch-FS5901,155,4,0.07%,0.10%,212,6,0.08%,0.11%,85.00%,100.00%,0,0,0.00%,0.00%,₹0.00,₹0.00,0,0
B0B4G7VWXD,B0B4G7VWXD,"Audio Array AA-04 Metal Spider Shock Mount for Condenser Microphone | Anti Vibration, Suspension, Isolation | 4 Size Bottom Screws & Extra Replacement Elastic Bands | Recommended For Rode, Samson, etc",183,6,0.09%,0.15%,274,8,0.10%,0.15%,3.32%,0.00%,0,0,0.00%,0.00%,₹0.00,₹0.00,0,0
B0B4G8ZB64,B0B4G8ZB64,"Audio Array AM-C3 XLR to TRS Dynamic Handheld Karaoke Microphone | Premium Metal Built with 3M Cable | Singing, Public Meetings, Studio Recording, Live Show, Party, Church, Wedding",193,2,0.09%,0.05%,272,3,0.10%,0.06%,0.82%,0.00%,0,0,0.00%,0.00%,₹0.00,₹0.00,0,0
B0B4KC7VBM,B0B4KC7VBM,"Audio Array AM-C5 USB Plug & Play Conference Mic for Mac OS & Windows | Conference, Recording, Skype, Online Class with Range Upto 5M | One Touch Mute Button & Light Indicator (NOT A Speaker)",364,33,0.17%,0.85%,495,44,0.18%,0.82%,0.00%,0.00%,0,0,0.00%,0.00%,₹0.00,₹0.00,0,0
B0B75LLWV6,B0B75LLWV6,Emporio Armani Analog White Dial Women's Watch-AR11484,37,3,0.02%,0.08%,39,4,0.01%,0.07%,100.00%,100.00%,0,0,0.00%,0.00%,₹0.00,₹0.00,0,0
B0BFZRGPJ6,B0BFZRGPJ6,Emporio Armani Analog Green Dial Men's Watch-AR11500,564,17,0.26%,0.44%,732,30,0.26%,0.56%,94.08%,100.00%,0,0,0.00%,0.00%,₹0.00,₹0.00,0,0
B0BQ34TRDX,B0BQ34TRDX,Fossil Raquel Analog White Dial Women's Watch-Es5271 - Stainless Steel,92,1,0.04%,0.03%,124,1,0.04%,0.02%,81.90%,100.00%,0,0,0.00%,0.00%,₹0.00,₹0.00,0,0
B0BQ35JRM3,B0BQ35JRM3,"Fossil Machine Analog Black Dial Men's Watch-FS5971 Stainless Steel, Black Strap",125,2,0.06%,0.05%,163,2,0.06%,0.04%,95.42%,100.00%,0,0,0.00%,0.00%,₹0.00,₹0.00,0,0
B0BQZG6C28,B0BQZG6C28,Emporio Armani Analog White Dial Women's Watch-AR80065SET,6,0,0.00%,0.00%,8,0,0.00%,0.00%,100.00%,0.00%,0,0,0.00%,0.00%,₹0.00,₹0.00,0,0
B0BQZGJHKV,B0BQZGJHKV,Armani Exchange Analog Black Dial Men's Watch-AX1867,0,0,0.00%,0.00%,0,0,0.00%,0.00%,0.00%,0.00%,0,0,0.00%,0.00%,₹0.00,₹0.00,0,0
B0BRKFP94K,B0BRKFP94K,"TONOR TD510 Dynamic Microphone, USB/XLR PC Microphone for Podcast, Recording, Live Streaming & Gaming, XLR Cardioid Studio Mic Music Voice-Over with Quick Mute, Headphone Output, Volume Control",200,4,0.09%,0.10%,295,5,0.10%,0.09%,5.33%,0.00%,0,0,0.00%,0.00%,₹0.00,₹0.00,0,0
B0BS4BFLZW,B0BS4BFLZW,Michael Kors Harlowe Analog Gold Dial Women's Watch-MK4709,86,2,0.04%,0.05%,103,2,0.04%,0.04%,100.00%,100.00%,0,0,0.00%,0.00%,₹0.00,₹0.00,0,0
B0C77PPS9S,B0C77PPS9S,Fossil Analog White Dial Women's Watch-Es5310 - Leather,787,14,0.37%,0.36%,955,19,0.34%,0.36%,87.10%,87.50%,0,0,0.00%,0.00%,₹0.00,₹0.00,0,0
B0C7WKTMFC,B0C7WKTMFC,Michael Kors Analog Black Dial Men's Stainless Steel Watch-Mk9113,103,0,0.05%,0.00%,127,0,0.05%,0.00%,92.56%,0.00%,0,0,0.00%,0.00%,₹0.00,₹0.00,0,0
B0C89RHY4W,B0C89RHY4W,Fossil Analog White Dial Women's Watch-Es5306 - Stainless Steel,226,0,0.11%,0.00%,274,0,0.10%,0.00%,85.38%,0.00%,0,0,0.00%,0.00%,₹0.00,₹0.00,0,0
B0CBCWGTGR,B0CBCWGTGR,"Diesel Leather Analog Blue Dial Men Watch-Dz2189, Brown Band",83,1,0.04%,0.03%,94,1,0.03%,0.02%,73.26%,0.00%,0,0,0.00%,0.00%,₹0.00,₹0.00,0,0
B0CCHGLV6Y,B0CCHGLV6Y,Skagen Analog White Dial Women's Watch-SKW3101,52,1,0.02%,0.03%,62,1,0.02%,0.02%,100.00%,0.00%,0,0,0.00%,0.00%,₹0.00,₹0.00,0,0
B0CCHKHCTD,B0CCHKHCTD,Emporio Armani Analog Gray Dial Men's Ceramic Watch-Ar70010,372,9,0.17%,0.23%,450,11,0.16%,0.21%,56.12%,75.00%,0,0,0.00%,0.00%,₹0.00,₹0.00,0,0
B0CCHLL1ZJ,B0CCHLL1ZJ,Emporio Armani Analog Silver Dial Women's Watch-AR11568,2,0,0.00%,0.00%,3,0,0.00%,0.00%,100.00%,0.00%,0,0,0.00%,0.00%,₹0.00,₹0.00,0,0
B0CCHNK41V,B0CCHNK41V,Skagen Analog Gray Dial Men's Watch-SKW6891,869,26,0.41%,0.67%,"1,088",29,0.39%,0.54%,100.00%,100.00%,0,0,0.00%,0.00%,₹0.00,₹0.00,0,0
B0CDQ55W2M,B0CDQ55W2M,"nexlev Travel Neck Pillow | Orthopedic Premium Memory Foam | for Airplane, Car, Train, Office use & Cervical Pain | Machine Washable | 360 Support | Carry Pouch for Storage | NP-02",13,1,0.01%,0.03%,14,2,0.00%,0.04%,0.00%,0.00%,0,0,0.00%,0.00%,₹0.00,₹0.00,0,0
B0CDQ5NBH8,B0CDQ5NBH8,nexlev Premium Memory Foam Neck Pillow with 360-Degree Head Support | Lightweight Comfortable Travel Pillow with Storage Bag for Sleeping | Traveling Flight Car Train Bus and Home Use NP-05 (Pink),3,0,0.00%,0.00%,4,0,0.00%,0.00%,66.67%,0.00%,0,0,0.00%,0.00%,₹0.00,₹0.00,0,0
B0CDQ98FDM,B0CDQ98FDM,"nexlev Travel Neck Pillow | Orthopedic Premium Memory Foam | for Airplane, Car, Train, Office use & Cervical Pain | Machine Washable | 360 Support | Carry Pouch for Storage | NP-01",35,1,0.02%,0.03%,43,4,0.02%,0.07%,2.50%,0.00%,0,0,0.00%,0.00%,₹0.00,₹0.00,0,0
B0CDQHYGLW,B0CDQHYGLW,Emporio Armani Analog Multicolor Dial Women's Watch-AR11558,62,2,0.03%,0.05%,79,2,0.03%,0.04%,100.00%,100.00%,0,0,0.00%,0.00%,₹0.00,₹0.00,0,0
B0CF5TCQKL,B0CF5TCQKL,"Audio Array AA-21 Desktop Mount Speaker Stands | 15KG Capacity | Height, Tilt & Rotation Adjustable | Smart Cable Management | for Sound Editing, Gaming, Music Production | Black (Set of 2)",351,9,0.16%,0.23%,488,9,0.17%,0.17%,0.00%,0.00%,0,0,0.00%,0.00%,₹0.00,₹0.00,0,0
B0CFBB587Z,B0CFBB587Z,Fossil Stainless Steel Analog Brown Dial Men's Watch-Me3253,"1,463",13,0.68%,0.33%,"2,054",15,0.73%,0.28%,88.72%,100.00%,0,0,0.00%,0.00%,₹0.00,₹0.00,0,0
B0CGSQGH17,B0CGSQGH17,Skagen Analog White Dial Women's Watch-SKW3121,112,3,0.05%,0.08%,125,4,0.04%,0.07%,100.00%,100.00%,0,0,0.00%,0.00%,₹0.00,₹0.00,0,0
B0CHXTNMNX,B0CHXTNMNX,"Armani Exchange Stainless Steel Analog Blue Dial Men's Watch-Ax7151Set, Band Color:Gold",241,1,0.11%,0.03%,299,1,0.11%,0.02%,92.19%,0.00%,0,0,0.00%,0.00%,₹0.00,₹0.00,0,0
B0CJ6ZW8F6,B0CJ6ZW8F6,"Fossil Watch Ring Gold dial ES5319 for Women, Analog, Stainless Steel, Gold Strap",543,1,0.25%,0.03%,639,1,0.23%,0.02%,80.67%,0.00%,0,0,0.00%,0.00%,₹0.00,₹0.00,0,0
B0CLVK5F4Q,B0CLVK5F4Q,Armani Exchange Analog Black Dial Men's Watch,1,0,0.00%,0.00%,1,0,0.00%,0.00%,0.00%,0.00%,0,0,0.00%,0.00%,₹0.00,₹0.00,0,0
B0CM9L1QZG,B0CM9L1QZG,"Audio Array AM-W16 Solo Wireless Lapel Over Ear Mic|in-Built ANC,Plug N Play,LongBattery Life,Ultra-Low Latency,Upto 30M Range|Compatible with iPhone&Android|Vlogging,Streaming,Teaching,YouTube,Black",255,3,0.12%,0.08%,355,6,0.13%,0.11%,0.00%,0.00%,0,0,0.00%,0.00%,₹0.00,₹0.00,0,0
B0CMXRJYGK,B0CMXRJYGK,"Promate Screwdriver Set with 48 S2 Steel Bits, Anodic Oxidation and Magnetic Storage Box, ProTools-51M",14,1,0.01%,0.03%,16,2,0.01%,0.04%,100.00%,100.00%,0,0,0.00%,0.00%,₹0.00,₹0.00,0,0
B0CQNSQ9BJ,B0CQNSQ9BJ,"Promate Screwdriver Set with 120 CR-V Steel Bits, Foldable Cylindrical Case and Durable Construction, ProTools-126M",3,0,0.00%,0.00%,4,0,0.00%,0.00%,100.00%,0.00%,0,0,0.00%,0.00%,₹0.00,₹0.00,0,0
B0CR5JQFD5,B0CR5JQFD5,"Armani Exchange Stainless Steel Analog Black Dial Men's Watch-Ax2761, Band Color:Black",116,1,0.05%,0.03%,138,2,0.05%,0.04%,99.26%,0.00%,0,0,0.00%,0.00%,₹0.00,₹0.00,0,0
B0CR5PZRNY,B0CR5PZRNY,"Emporio Armani Stainless Steel Analog Blue Dial Men's Watch-Ar11582, Band Color:Silver",118,2,0.06%,0.05%,140,2,0.05%,0.04%,96.15%,100.00%,0,0,0.00%,0.00%,₹0.00,₹0.00,0,0
B0CR5QRNQN,B0CR5QRNQN,Emporio Armani Analog White Dial Men's Watch-AR60076,85,0,0.04%,0.00%,138,0,0.05%,0.00%,80.49%,0.00%,0,0,0.00%,0.00%,₹0.00,₹0.00,0,0
B0CR5RR8Z6,B0CR5RR8Z6,"Emporio Armani Stainless Steel Analog Multicolor Dial Women's Watch-Ar11596, Dial-Color:Silver, Band Color:Silver",23,0,0.01%,0.00%,29,0,0.01%,0.00%,96.15%,0.00%,0,0,0.00%,0.00%,₹0.00,₹0.00,0,0
B0CR5RZRMH,B0CR5RZRMH,"Emporio Armani Stainless Steel Analog Black Dial Men's Watch-Ar11589, Band Color:Black",245,7,0.11%,0.18%,338,11,0.12%,0.21%,98.98%,100.00%,0,0,0.00%,0.00%,₹0.00,₹0.00,0,0
B0CR5S175Y,B0CR5S175Y,"Armani Exchange Stainless Steel Analog Black Dial Men's Watch-Ax2454, Band Color:Grey",81,0,0.04%,0.00%,101,0,0.04%,0.00%,90.53%,0.00%,0,0,0.00%,0.00%,₹0.00,₹0.00,0,0
B0CRCTQH2C,B0CRCTQH2C,"Michael Kors Stainless Steel Analog White Dial Women's Watch-Mk4805, Band Color:Gold",37,0,0.02%,0.00%,40,0,0.01%,0.00%,100.00%,0.00%,0,0,0.00%,0.00%,₹0.00,₹0.00,0,0
B0CRCZYDY6,B0CRCZYDY6,"Michael Kors Stainless Steel Analog White Dial Women's Watch-Mk4817Set, Band Color:Two-Tone",76,0,0.04%,0.00%,94,0,0.03%,0.00%,97.73%,0.00%,0,0,0.00%,0.00%,₹0.00,₹0.00,0,0
B0CRD29D6X,B0CRD29D6X,Michael Kors Runway Rose Gold Watch MK7458,37,1,0.02%,0.03%,62,1,0.02%,0.02%,98.25%,0.00%,0,0,0.00%,0.00%,₹0.00,₹0.00,0,0
B0CRD2CVZL,B0CRD2CVZL,Fossil Analog Women Gold Gold Scarlette Quartz Stainless Steel Watch ES5338,270,4,0.13%,0.10%,344,5,0.12%,0.09%,35.48%,0.00%,0,0,0.00%,0.00%,₹0.00,₹0.00,0,0
B0CRD3QWVJ,B0CRD3QWVJ,Fossil Carlie Analog Women Silver Quartz Stainless Steel Watch ES5331,107,2,0.05%,0.05%,125,2,0.04%,0.04%,84.43%,100.00%,0,0,0.00%,0.00%,₹0.00,₹0.00,0,0
B0CRD7DH79,B0CRD7DH79,"Fossil Men Sport Tourer Silver Quartz Stainless Steel Chronograph Watch Fs6045, Black Dial, Silver Band",85,1,0.04%,0.03%,113,3,0.04%,0.06%,42.11%,100.00%,0,0,0.00%,0.00%,₹0.00,₹0.00,0,0
B0CRSQDJJ5,B0CRSQDJJ5,"Michael Kors Analog Green Dial Men's Stainless Steel Watch-Mk9152, Band Color:Silver",142,1,0.07%,0.03%,185,1,0.07%,0.02%,94.55%,0.00%,0,0,0.00%,0.00%,₹0.00,₹0.00,0,0
B0CRT23BD5,B0CRT23BD5,"Michael Kors Stainless Steel Analog Blue Dial Men's Watch-Mk9153, Band Color:Gold",28,0,0.01%,0.00%,30,0,0.01%,0.00%,100.00%,0.00%,0,0,0.00%,0.00%,₹0.00,₹0.00,0,0
B0CSK4ZCQH,B0CSK4ZCQH,Michael Kors Analog White Dial Men's Metal Band Watch-MK9163,71,1,0.03%,0.03%,80,1,0.03%,0.02%,93.51%,100.00%,0,0,0.00%,0.00%,₹0.00,₹0.00,0,0
B0CSK63BKG,B0CSK63BKG,Michael Kors Analog Blue Dial Men's Metal Band Watch-MK9156,37,0,0.02%,0.00%,50,0,0.02%,0.00%,100.00%,0.00%,0,0,0.00%,0.00%,₹0.00,₹0.00,0,0
B0CWRLQ99S,B0CWRLQ99S,"Armani Exchange Stainless Steel Analog Gray Dial Men's Watch-Ax1764, Band Color-Silver",32,0,0.01%,0.00%,48,0,0.02%,0.00%,100.00%,0.00%,0,0,0.00%,0.00%,₹0.00,₹0.00,0,0
B0CYN8F826,B0CYN8F826,"Armani Exchange Stainless Steel Analog Gray Dial Women's Watch-Ax5616, Band Color-Pink",26,0,0.01%,0.00%,31,0,0.01%,0.00%,96.43%,0.00%,0,0,0.00%,0.00%,₹0.00,₹0.00,0,0
B0CYNMJNWY,B0CYNMJNWY,"Armani Exchange Silicone Analog Black Dial Men's Watch-Ax7159Set, Band Color-Black",462,9,0.22%,0.23%,576,13,0.21%,0.24%,69.53%,77.78%,0,0,0.00%,0.00%,₹0.00,₹0.00,0,0
B0CZ8X8CBD,B0CZ8X8CBD,"Fossil Stainless Steel Analog Green Dial Men's Watch-Fs6056, Band Color-Silver",306,6,0.14%,0.15%,357,8,0.13%,0.15%,99.41%,100.00%,0,0,0.00%,0.00%,₹0.00,₹0.00,0,0
B0CZ8ZKPJ9,B0CZ8ZKPJ9,Fossil Analog Women Blue Dive Black Dial Multi-Colour Quartz Stainless Steel Watch ES5349,355,1,0.17%,0.03%,471,1,0.17%,0.02%,59.18%,100.00%,0,0,0.00%,0.00%,₹0.00,₹0.00,0,0
B0CZ91YKMP,B0CZ91YKMP,Fossil Blue Dive Gold Quartz Stainless Steel Watch ES5350,51,0,0.02%,0.00%,82,0,0.03%,0.00%,36.51%,0.00%,0,0,0.00%,0.00%,₹0.00,₹0.00,0,0
B0CZ93JG5X,B0CZ93JG5X,Michael Kors Emery Silver Watch MK4829,137,1,0.06%,0.03%,161,1,0.06%,0.02%,93.46%,100.00%,0,0,0.00%,0.00%,₹0.00,₹0.00,0,0
B0CZ94B6QL,B0CZ94B6QL,"Michael Kors Stainless Steel Analog Multicolor Dial Women's Watch-Mk4822, Band Color-Gold",33,0,0.02%,0.00%,38,0,0.01%,0.00%,100.00%,0.00%,0,0,0.00%,0.00%,₹0.00,₹0.00,0,0
B0CZ9HTWNC,B0CZ9HTWNC,Michael Kors Sage Silver Watch MK4824,40,1,0.02%,0.03%,59,1,0.02%,0.02%,63.46%,0.00%,0,0,0.00%,0.00%,₹0.00,₹0.00,0,0
B0D2G1VDXS,B0D2G1VDXS,Fossil Nate Men's Watch with Oversized Chronograph Watch Dial and Stainless Steel or Leather Band,2,0,0.00%,0.00%,6,0,0.00%,0.00%,0.00%,0.00%,0,0,0.00%,0.00%,₹0.00,₹0.00,0,0
B0D2LD6BYJ,B0D2LD6BYJ,"NexLev 6-in-1 trimmer | Sensitive Bikini Trimmer for Women | Skin Safe with Rounded Tips & Foil Shaver| Hair Removal for Intimate Areas, Face, Arms, Legs & Body | 90 min Runtime |2H Quick Charge |T-02",116,1,0.05%,0.03%,151,1,0.05%,0.02%,0.00%,0.00%,0,0,0.00%,0.00%,₹0.00,₹0.00,0,0
B0D2LFMY48,B0D2LFMY48,"Nexlev Hair Styling Straightener & Curler| 2 in 1 Hair Styler| 200°C in 30 Seconds| Long Ceramic Floating Plates| Rounded Body for Curls| Plate Lock| Portable HS-01, Hair Straightener Tong - Black",153,0,0.07%,0.00%,164,0,0.06%,0.00%,3.27%,0.00%,0,0,0.00%,0.00%,₹0.00,₹0.00,0,0
B0D383WQPB,B0D383WQPB,NexLev Foldable Garment Steamer for Home & Travel | Convenient Vertical Steaming | 1200W | 120 ml | Lightweight & Compact | 30s Fast Heating | Iron for all Cloth Types | 2 M cord | Anti Spill | GS-05,"2,386",61,1.11%,1.56%,"3,045",82,1.08%,1.53%,1.17%,100.00%,0,0,0.00%,0.00%,₹0.00,₹0.00,0,0
B0D637B562,B0D637B562,Nexlev Splash Pet Water Fountain with LED Light | 2.0L Capacity | Ultra Quiet Cat Drinking Fountain with Filter | Automatic Pet Water Fountain for Cats and Small Dogs | Blue (WF-02-BL),165,6,0.08%,0.15%,234,8,0.08%,0.15%,2.03%,80.00%,0,0,0.00%,0.00%,₹0.00,₹0.00,0,0
B0D63FKYZ5,B0D63FKYZ5,NexLev Scalp Massager for Stress Relief | Head Massager for Hair Growth | 96 Tangle Free Silicone Kneading Nodes | Hand Like Massage | 120 Min Runtime | Type C | Washable Heads | 3 Modes | HM-01,58,0,0.03%,0.00%,69,0,0.02%,0.00%,0.00%,0.00%,0,0,0.00%,0.00%,₹0.00,₹0.00,0,0
B0D672NXC8,B0D672NXC8,"Nexlev SWIPE Steam Cleaner | 3.5 Bar Strong Steam|Multipurpose Steam Cleaner for Car, Kitchen, Bathroom, Floor, Window, Glass, Upholstery| 8 Accessories Kit|Safety Lock| Large 700ML Water Tank | SC-03",0,0,0.00%,0.00%,0,0,0.00%,0.00%,0.00%,0.00%,0,0,0.00%,0.00%,₹0.00,₹0.00,0,0
B0D83Q7L8W,B0D83Q7L8W,"NexLev Ionic Hot Air Brush | 3 in 1 Blow Dryer, Straightener, Volumizer & Styler | 360° Airflow Vents | Ceramic Tourmaline Coated Brushing Head | Tangle Free Bristle |3 Speed & 2 Heat Settings | V-01",0,0,0.00%,0.00%,0,0,0.00%,0.00%,0.00%,0.00%,0,0,0.00%,0.00%,₹0.00,₹0.00,0,0
B0D842173P,B0D842173P,Nexlev Electric Toothbrush| 40000 vibrations/min|USB Type C| 5 Modes| 2 Min timer| 30 sec Quad Interval| 4 Replaceable Brushheads With Cover| IPX7 Waterproof| For Adults|Sparkle Pro ETC-05 Sunset Pink,12,0,0.01%,0.00%,16,0,0.01%,0.00%,28.57%,0.00%,0,0,0.00%,0.00%,₹0.00,₹0.00,0,0
B0D8445KJN,B0D8445KJN,"NexLev Lint Remover | For Woolen Sweaters Shirts Socks Jackets Suede Leggings | Pill, Rue & Burr Remover | 30 Min Use |Type C |Defuzzer | Lint Brush for Coat | 2 Modes | SS Blade | Safety Lock | LR-01",196,1,0.09%,0.03%,246,1,0.09%,0.02%,34.38%,0.00%,0,0,0.00%,0.00%,₹0.00,₹0.00,0,0
B0D845B2DG,B0D845B2DG,"NexLev Lint Remover | for Woolen Sweaters Shirts Socks Jackets Suede Leggings Curtains & Carpets | Pill, Rue & Burr Remover | 120 Min Use |TypeC | Lint Brush for Coat| SS Blade | Safety Lock | LR-02",453,15,0.21%,0.38%,658,22,0.23%,0.41%,0.53%,30.00%,0,0,0.00%,0.00%,₹0.00,₹0.00,0,0
B0D84YD59Y,B0D84YD59Y,"Armani Exchange Stainless Steel Analog Silver Dial Women's Watch-Ax5725, Band Color:Gold",104,3,0.05%,0.08%,125,4,0.04%,0.07%,92.31%,0.00%,0,0,0.00%,0.00%,₹0.00,₹0.00,0,0
B0D85171BL,B0D85171BL,"Armani Exchange Stainless Steel Analog Silver Dial Women's Watch-Ax5724, Band Color:Silver",106,4,0.05%,0.10%,126,4,0.04%,0.07%,82.05%,100.00%,0,0,0.00%,0.00%,₹0.00,₹0.00,0,0
B0D853Y52R,B0D853Y52R,"Armani Exchange Stainless Steel Analog Black Dial Men's Watch-Ax4181, Band Color:Multicolor",602,15,0.28%,0.38%,745,16,0.27%,0.30%,91.00%,100.00%,0,0,0.00%,0.00%,₹0.00,₹0.00,0,0
B0D8572WTJ,B0D8572WTJ,"Armani Exchange Stainless Steel Analog Black Dial Men's Watch-Ax4183, Band Color:Black",188,2,0.09%,0.05%,244,2,0.09%,0.04%,99.56%,100.00%,0,0,0.00%,0.00%,₹0.00,₹0.00,0,0
B0D858SPK4,B0D858SPK4,"Armani Exchange Stainless Steel Analog Silver Dial Women's Watch-Ax7161Set, Band Color:Multicolor",42,0,0.02%,0.00%,47,0,0.02%,0.00%,100.00%,0.00%,0,0,0.00%,0.00%,₹0.00,₹0.00,0,0
B0D86ZC9YT,B0D86ZC9YT,Nexlev Just Style Pro Hair Dryer |2100 W for Quick & Easy Blowdry | Double Heat Protection Technology | 3 Heat Settings & Cool Shot Function For Salon-Like Styling at Home (HD-01),127,2,0.06%,0.05%,145,4,0.05%,0.07%,0.00%,0.00%,0,0,0.00%,0.00%,₹0.00,₹0.00,0,0
B0D933B79H,B0D933B79H,"Fossil Leather Analog Beige Dial Men's Watch-Fs6071, Band Color:Brown",146,2,0.07%,0.05%,189,3,0.07%,0.06%,80.23%,0.00%,0,0,0.00%,0.00%,₹0.00,₹0.00,0,0
B0D9345QY7,B0D9345QY7,"Emporio Armani Stainless Steel Analog Green Dial Men's Watch-Ar60080, Band Color:Silver",321,7,0.15%,0.18%,412,11,0.15%,0.21%,99.73%,100.00%,0,0,0.00%,0.00%,₹0.00,₹0.00,0,0
B0D935TKFD,B0D935TKFD,"Emporio Armani Stainless Steel Analog Multicolor Dial Women's Watch-Ar11625, Band Color:Silver",42,1,0.02%,0.03%,57,1,0.02%,0.02%,93.75%,100.00%,0,0,0.00%,0.00%,₹0.00,₹0.00,0,0
B0D935TWSR,B0D935TWSR,"Emporio Armani Stainless Steel Analog Multicolor Dial Men's Watch-Ar11637, Band Color:Silver",95,2,0.04%,0.05%,133,2,0.05%,0.04%,100.00%,0.00%,0,0,0.00%,0.00%,₹0.00,₹0.00,0,0
B0D935VW9J,B0D935VW9J,"Emporio Armani Stainless Steel Analog Multicolor Dial Women's Watch-Ar11626, Band Color:Multicolor",73,1,0.03%,0.03%,87,1,0.03%,0.02%,100.00%,100.00%,0,0,0.00%,0.00%,₹0.00,₹0.00,0,0
B0D9363BB2,B0D9363BB2,Emporio Armani Analog Silver Dial Women's Watch-AR11623,128,5,0.06%,0.13%,156,5,0.06%,0.09%,97.04%,100.00%,0,0,0.00%,0.00%,₹0.00,₹0.00,0,0
B0D936CMG1,B0D936CMG1,"Emporio Armani Stainless Steel Analog Green Dial Men's Watch-Ar11621, Band Color:Silver",146,2,0.07%,0.05%,177,4,0.06%,0.07%,93.59%,0.00%,0,0,0.00%,0.00%,₹0.00,₹0.00,0,0
B0D936FLK4,B0D936FLK4,"Emporio Armani Stainless Steel Analog Black Dial Men's Watch-Ar11622, Band Color:Silver",54,0,0.03%,0.00%,65,0,0.02%,0.00%,98.33%,0.00%,0,0,0.00%,0.00%,₹0.00,₹0.00,0,0
