(Parent) ASIN,(Child) ASIN,Title,Sessions - Total,Sessions - Total - B2B,Session Percentage - Total,Session Percentage - Total - B2B,Page Views - Total,Page Views - Total - B2B,Page Views Percentage - Total,Page Views Percentage - Total - B2B,Featured Offer Percentage,Featured Offer Percentage - B2B,Units Ordered,Units Ordered - B2B,Unit Session Percentage,Unit Session Percentage - B2B,Ordered Product Sales,Ordered Product Sales - B2B,Total Order Items,Total Order Items - B2B
B0CH9JR3HL,B0CH9JR3HL,"TONOR Top Ring Light Kit, 10 Inch Ring Light with Heavy Duty Bracket Arm and Phone Holder for Video Recording, Live Streaming, Drawing, Nail Makeup",8,0,0.00%,0.00%,13,0,0.00%,0.00%,100.00%,0.00%,0,0,0.00%,0.00%,₹0.00,₹0.00,0,0
B0CJR76Y7G,B0CJR76Y7G,"Audio Array AA-25 Handheld Microphone Interview Adapter for Wireless Lapel Microphones | Supports, Rode Go, DJI, Hollyland mics etc | Foam Cover with Built-in Cold Shoe Mount",333,9,0.15%,0.21%,492,10,0.16%,0.17%,0.00%,0.00%,0,0,0.00%,0.00%,₹0.00,₹0.00,0,0
B0CM6NVLT9,B0CM6NVLT9,"Audio Array AI-11 USB Bluetooth Soundcard, 1Ch Mixer, Audio Interface | 2 Condenser In, 2 Out |2 Live Out+1 Accompany In | OTG for mobile and PC/MAC | Effects | Streaming, Podcasting, Gaming, Singing","1,341",29,0.60%,0.68%,"2,120",44,0.71%,0.75%,1.01%,0.00%,0,0,0.00%,0.00%,₹0.00,₹0.00,0,0
B0CM6WH4ZT,B0CM6WH4ZT,"Audio Array AI-12 USB Bluetooth Soundcard | 1Ch Mixer interface | 2 mic inputs, 2 smartphone & PC/Mac outputs | Karaoke Recording, Mobile/PC Streaming, Live Broadcasting | Singing, Recording,Gaming","1,148",16,0.51%,0.38%,"1,603",21,0.53%,0.36%,0.07%,0.00%,0,0,0.00%,0.00%,₹0.00,₹0.00,0,0
B0CM9KJZWQ,B0CM9KJZWQ,"Audio Array AM-C44 XLR/USB Professional Dynamic Podcast Microphone | Built-in Monitoring | One Touch Mute & Volume Control | 192kHz/24bit Full Metal Build | 2M XLR & USB Cable | Streaming, Podcasting",350,7,0.16%,0.16%,478,8,0.16%,0.14%,0.00%,0.00%,0,0,0.00%,0.00%,₹0.00,₹0.00,0,0
B0CM9L1QZG,B0CM9L1QZG,"Audio Array AM-W16 Solo Wireless Lapel Over Ear Mic|in-Built ANC,Plug N Play,LongBattery Life,Ultra-Low Latency,Upto 30M Range|Compatible with iPhone&Android|Vlogging,Streaming,Teaching,YouTube,Black",255,3,0.11%,0.07%,355,6,0.12%,0.10%,18.18%,0.00%,0,0,0.00%,0.00%,₹0.00,₹0.00,0,0
B0CM9P5CCK,B0CM9P5CCK,"Audio Array AM-W17 Dual Wireless Lapel Mic|in-Built ANC, Plug N Play,Long Battery Life, Ultra-Low Latency,Upto 30M Range|Compatible with iPhone & Android|Vlogging, Streaming, Teaching,YouTube, Black",201,4,0.09%,0.09%,298,5,0.10%,0.09%,3.90%,0.00%,0,0,0.00%,0.00%,₹0.00,₹0.00,0,0
B0CPFS24ML,B0CPFS24ML,"White Mulberry Gaming Desk, Computer Desk with Carbon Fiber Surface, Z Shaped Gaming Table, Computer Table, Workstation, Home Office Desk with Cup Holder and Headphone Holder | (117 * 67 * 71 CM)","3,848",118,1.71%,2.78%,"5,829",177,1.94%,3.03%,0.40%,0.00%,0,0,0.00%,0.00%,₹0.00,₹0.00,0,0
B0CX1XK5R6,B0CX1XK5R6,Audio Array AM-W46 Groove Wireless Bluetooth 5.3 Bookshelf Speaker 30W | 5400mAh upto 24h Long Battery | 3 EQ Modes | Stylish Premium Metal Body | Superior Bass Quality,0,0,0.00%,0.00%,0,0,0.00%,0.00%,0.00%,0.00%,0,0,0.00%,0.00%,₹0.00,₹0.00,0,0
B0CYSMBCB8,B0CYSMBCB8,NexLev Steam Cleaner | For Complete Home Kitchen Bathroom Window Car & Office Cleaning | 9 Accessories | 450 ML | Window Pane Sink Grime Chimney Grease Water Stain Cleaner| 4 Meter Cord | 1000W |SC-02,0,0,0.00%,0.00%,0,0,0.00%,0.00%,0.00%,0.00%,0,0,0.00%,0.00%,₹0.00,₹0.00,0,0
B0D2LD6BYJ,B0D2LD6BYJ,"NexLev 6-in-1 trimmer | Sensitive Bikini Trimmer for Women | Skin Safe with Rounded Tips & Foil Shaver| Hair Removal for Intimate Areas, Face, Arms, Legs & Body | 90 min Runtime |2H Quick Charge |T-02",116,1,0.05%,0.02%,151,1,0.05%,0.02%,10.53%,0.00%,0,0,0.00%,0.00%,₹0.00,₹0.00,0,0
B0D2LFMY48,B0D2LFMY48,"Nexlev Hair Styling Straightener & Curler| 2 in 1 Hair Styler| 200°C in 30 Seconds| Long Ceramic Floating Plates| Rounded Body for Curls| Plate Lock| Portable HS-01, Hair Straightener Tong - Black",153,0,0.07%,0.00%,164,0,0.05%,0.00%,0.00%,0.00%,0,0,0.00%,0.00%,₹0.00,₹0.00,0,0
B0D2LGR3GG,B0D2LGR3GG,"NexLev 6-in-1 trimmer | Sensitive Bikini Trimmer for Women | Skin Safe with Rounded Tips & Safety Guards| Hair Removal for Intimate Areas, Face, Arms, Legs & Body | 90 min Runtime | Type C | T-01",90,0,0.04%,0.00%,106,0,0.04%,0.00%,0.00%,0.00%,0,0,0.00%,0.00%,₹0.00,₹0.00,0,0
B0D2LJSQXZ,B0D2LJSQXZ,NexLev Steam Mop | Chemical Free Mopping | Floor Cleaning + Carpet Steaming | 4 Extra Mop Pads | 400 ML | 1300W | Floor Disinfectant | For All Floor Types | 4mtr long Cord | Wet & Dry Mopping | SM-01,937,17,0.42%,0.40%,"1,241",17,0.41%,0.29%,0.09%,0.00%,0,0,0.00%,0.00%,₹0.00,₹0.00,0,0
B0D3LK9RMZ,B0D3LK9RMZ,"Lewitt Connect 2 Dual USB-C 2-in/ 2-out Audio interface with DSP, Mobile In and Out, 2 Mic Preamps, 2 Headphones Outputs, Loopback for Recording, Streaming & Podcasting - Mac/PC/iOS/iPadOS/Android",267,8,0.12%,0.19%,341,11,0.11%,0.19%,69.38%,42.86%,0,0,0.00%,0.00%,₹0.00,₹0.00,0,0
B0D3LZWTHV,B0D3LZWTHV,"Audio Array AM-C45 XLR/USB Professional RGB Dynamic Podcast Microphone | Built-in Monitoring | One Touch Mute Volume & Noise-Cancellation | 2M USB Cable & Metal Base | Streaming, Podcasting, Singing",491,17,0.22%,0.40%,695,20,0.23%,0.34%,1.13%,0.00%,0,0,0.00%,0.00%,₹0.00,₹0.00,0,0
B0D3M86SH1,B0D3M86SH1,Audio Array AA-19BL RGB Low Profile Boomarm Stand with Riser | 71cm reach & 20 RGB lighting effects & Built-In Cable Management | Matte finish with Flexible adjustments | 2Kg Weight Capacity | Black,405,13,0.18%,0.31%,463,13,0.15%,0.22%,0.00%,0.00%,0,0,0.00%,0.00%,₹0.00,₹0.00,0,0
B0D3Q2T5XX,B0D3Q2T5XX,Audio Array AA-19WL RGB Low Profile Boomarm Stand with Riser | 71cm reach & 20 RGB lighting effects & Built-In Cable Management | Matte finish with Flexible adjustments | 2Kg Weight Capacity | White,251,9,0.11%,0.21%,282,10,0.09%,0.17%,1.96%,0.00%,0,0,0.00%,0.00%,₹0.00,₹0.00,0,0
B0D63FKYZ5,B0D63FKYZ5,NexLev Scalp Massager for Stress Relief | Head Massager for Hair Growth | 96 Tangle Free Silicone Kneading Nodes | Hand Like Massage | 120 Min Runtime | Type C | Washable Heads | 3 Modes | HM-01,58,0,0.03%,0.00%,69,0,0.02%,0.00%,0.00%,0.00%,0,0,0.00%,0.00%,₹0.00,₹0.00,0,0
B0D8445KJN,B0D8445KJN,"NexLev Lint Remover | For Woolen Sweaters Shirts Socks Jackets Suede Leggings | Pill, Rue & Burr Remover | 30 Min Use |Type C |Defuzzer | Lint Brush for Coat | 2 Modes | SS Blade | Safety Lock | LR-01",196,1,0.09%,0.02%,246,1,0.08%,0.02%,3.57%,0.00%,0,0,0.00%,0.00%,₹0.00,₹0.00,0,0
B0D86ZC9YT,B0D86ZC9YT,Nexlev Just Style Pro Hair Dryer |2100 W for Quick & Easy Blowdry | Double Heat Protection Technology | 3 Heat Settings & Cool Shot Function For Salon-Like Styling at Home (HD-01),127,2,0.06%,0.05%,145,4,0.05%,0.07%,0.00%,0.00%,0,0,0.00%,0.00%,₹0.00,₹0.00,0,0
B0D9KCNVNM,B0D9KCNVNM,Nexlev Oscillating Electric Toothbrush | 8000 vibrations/min | USB Type C Charging|3 modes| 2 Minute Timer |Quad Change Reminder| IPX7 Waterproof | For adults| 1 year warranty| |Sparkle Pro (ETR-06),76,2,0.03%,0.05%,100,2,0.03%,0.03%,4.65%,0.00%,0,0,0.00%,0.00%,₹0.00,₹0.00,0,0
B0D9KFQG8Q,B0D9KFQG8Q,"Nexlev Skin Scrubber |Red & Blue LED Therapy| Blackhead Remover| Pore Cleaner| Skin Lifting & tightening, wrinkle remover| 2 Silicone Cleaning Heads| Facial Cleansing|Type C Charging| Elixir Pro LE-03",213,5,0.09%,0.12%,229,7,0.08%,0.12%,0.44%,0.00%,0,0,0.00%,0.00%,₹0.00,₹0.00,0,0
B0DCK4DR1B,B0DCK4DR1B,Nexlev Skin Lift Device | 7 Color LED | Face & Neck Skin Lifting| 3 Massage Modes| Face Sculpting Tool |Micro-currents to reduce Wrinkles| Hot Compress | Rechargeable| Type-C| 180 Min Use| Glow+ LE-04,115,2,0.05%,0.05%,150,2,0.05%,0.03%,3.05%,0.00%,0,0,0.00%,0.00%,₹0.00,₹0.00,0,0
B0DCK7J87D,B0DCK7J87D,NexLev Cordless Spin Mop|50 Min Runtime|2 Extra Mop Pads | Type C | For Home Kitchen & Office Use | Water Spray Function|Self Propelling|Mopping for All Floor Types|LED for Corners and Underbed|SPM-01,94,3,0.04%,0.07%,138,5,0.05%,0.09%,100.00%,100.00%,0,0,0.00%,0.00%,₹0.00,₹0.00,0,0
B0DDC3GVZW,B0DDC3GVZW,nexlev Cordless Electric Car Vacuum Cleaner VacuSafe| Seat-Belt Cutter| Window Breaker Hammer| LED Torch|4000 mAh| High Power Suction | Copper Motor| Type-C Emergency Car Escape Tool| Portable| VC-03,85,3,0.04%,0.07%,101,3,0.03%,0.05%,1.98%,0.00%,0,0,0.00%,0.00%,₹0.00,₹0.00,0,0
B0DFCDKMWR,B0DFCDKMWR,NexLev Cordless Electric Heating Pad| Period Cramp & Back Pain Relief Massager | 9 modes| Menstrual Cramp Relief|Type C| Crampfree Periods | Portable | Gift for Women| Strap upto 40 Inch |Blue CM-01,"1,113",29,0.50%,0.68%,"1,500",50,0.50%,0.86%,0.15%,0.00%,0,0,0.00%,0.00%,₹0.00,₹0.00,0,0
B0DFM4JZV9,B0DFM4JZV9,"Nexlev Tyre Inflator for Car | Touch Control |150 PSI |12V DC| 4 Nozzles | Digital Tyre Pressure Gauge| Carry Bag | Suitable for Bike, Bicycle or Any Inflatable | Emergency LED Light | TI-01",28,1,0.01%,0.02%,34,1,0.01%,0.02%,0.00%,0.00%,0,0,0.00%,0.00%,₹0.00,₹0.00,0,0
B0DFMKY4TT,B0DFMKY4TT,"Audio Array AM-W35 UHF Dual Wireless Premium Karaoke Microphones | 800mah 5-6 Hours Battery Backup | Range up to 50M | Karaoke Singing, Wedding, DJ, Church | PA System, Amplifier, Mixer, Party Box",756,11,0.34%,0.26%,959,12,0.32%,0.21%,9.88%,0.00%,0,0,0.00%,0.00%,₹0.00,₹0.00,0,0
B0DFMLQBMC,B0DFMLQBMC,"Audio Array AM-W20 Magnetic Wireless Lapel Microphone Set | One Touch Smart Noise Reduction | 48KHz/24Bit Hi-fi Recording | 50M Range | 800mAh 48Hrs Long Battery Backup | Vlogging, Podcast, Streaming",27,0,0.01%,0.00%,34,0,0.01%,0.00%,78.13%,0.00%,0,0,0.00%,0.00%,₹0.00,₹0.00,0,0
B0DFMLS8JG,B0DFMLS8JG,"Audio Array AM-W32 UHF Dual Wireless Premium Metal Microphones | Built in Battery 2000mAh 6-8 Hours | Type-C Charging | 60M Range | Karaoke Singing, Wedding, Event | Built-in Volume and Echo Control",451,9,0.20%,0.21%,640,10,0.21%,0.17%,3.16%,0.00%,0,0,0.00%,0.00%,₹0.00,₹0.00,0,0
B0DFMMTWLY,B0DFMMTWLY,"Audio Array AM-W33 UHF Metal Solo Wireless Microphone Set | 2000mAh 6-8 Hours Battery Backup | Range up to 50M | Karaoke Singing, Wedding, DJ, Church | PA System, Amplifier, Mixer, Party Box",815,14,0.36%,0.33%,"1,135",14,0.38%,0.24%,2.27%,0.00%,0,0,0.00%,0.00%,₹0.00,₹0.00,0,0
B0DFMNGFTD,B0DFMNGFTD,"Audio Array AM-W36 UHF Dual Wireless Premium Metal Microphone with Charging | 2X XLR Outs & 1/4"" Mix Out | 328ft/100M Range | Karaoke Singing, Wedding, Events | PA System, Amplifier, Mixer, Party Box","1,382",31,0.61%,0.73%,"1,900",51,0.63%,0.87%,2.86%,0.00%,0,0,0.00%,0.00%,₹0.00,₹0.00,0,0
B0DFMQCGT1,B0DFMQCGT1,"Audio Array AM-W21 Wireless Microphone Kit | Built in Recording, Noise Reduction & Echo | Smartphones, Cameras, Laptops | Dual-Channel Recording, 200 feet Transmission Range, 48-Hour Battery Life",22,0,0.01%,0.00%,41,0,0.01%,0.00%,19.35%,0.00%,0,0,0.00%,0.00%,₹0.00,₹0.00,0,0
B0DFMRG2K4,B0DFMRG2K4,"NexLev All in One Body Trimmer for Men | Suitable for Beard, Body, Balls, Pubic Hair, Private Parts | 90 Min Runtime |Type C | IPX 7 Waterproof | No Nicks No Cuts | 2 Safety Combs| Extra Blade | TM-02",79,0,0.04%,0.00%,94,0,0.03%,0.00%,0.00%,0.00%,0,0,0.00%,0.00%,₹0.00,₹0.00,0,0
B0DJFH4K8B,B0DJFH4K8B,NexLev Cordless Tyre Inflator for Cars & Bikes|150 PSI| 2x2000 mAh Powerbank| Type-C Port| 5 Pre Set Mode|Auto Shut-Off |Digital Display| LED Light | Multiple Nozzles| AER Pro TIC-03,118,2,0.05%,0.05%,145,2,0.05%,0.03%,3.82%,0.00%,0,0,0.00%,0.00%,₹0.00,₹0.00,0,0
B0DJFH6RTL,B0DJFH6RTL,"NexLev Portable Tyre Inflator for Car, Bike, Cycle|150 PSI Pressure| 120 Watt Air Pump|12V Car Plug| Digital Display| Auto Shut-Off| Emergency LED Light| 3m Cord| 3 Air Nozzles| Compact| AER TI-02",45,1,0.02%,0.02%,53,1,0.02%,0.02%,0.00%,0.00%,0,0,0.00%,0.00%,₹0.00,₹0.00,0,0
B0DJFJZMC6,B0DJFJZMC6,"Nexlev Cordless & Corded Tyre Inflator|150 PSI| 6000 mAh Powerbank|LED Light | Type C Port |Digital Display| 5 Pre-Set Modes|Auto Shut-Off |Multiple Nozzles for Cars, Bikes, Cycle| AER Pro Max TIC-04",176,4,0.08%,0.09%,219,4,0.07%,0.07%,5.50%,0.00%,0,0,0.00%,0.00%,₹0.00,₹0.00,0,0
B0DK9NRBWJ,B0DK9NRBWJ,NexLev Intimate Trimmer for Men|Ceramic Blade|120 Min Runtime|Type C Charge | IPX7 Waterproof | 7000RPM Copper Motor| Cordless|LED Light| Travel Lock| Wet/Dry Groin & Body Shaver | Intimate Pro TM-03,22,0,0.01%,0.00%,32,0,0.01%,0.00%,17.86%,0.00%,0,0,0.00%,0.00%,₹0.00,₹0.00,0,0
B0DKJZDY72,B0DKJZDY72,nexlev Cordless Vacuum Cleaner & Blower |BLDC Copper Motor |HEPA with Stainless Steel Cover | for Home Office & Car Cleaning|4 Attachments | Blower for Dust & Inflatables | Portable & Compact | VC-04,96,0,0.04%,0.00%,115,0,0.04%,0.00%,5.88%,0.00%,0,0,0.00%,0.00%,₹0.00,₹0.00,0,0
B0DNJF1BLS,B0DNJF1BLS,nexlev Drip Coffee Maker |Filter Coffee for Home & Office | 4-6 Cups | Warming Plate|Borosilicate Carafe | Reusable & Washable Filter | Anti Drip | 750 ml | Cone Filter | Water Level Indicator |CF-01,130,4,0.06%,0.09%,167,7,0.06%,0.12%,1.37%,0.00%,0,0,0.00%,0.00%,₹0.00,₹0.00,0,0
B0DNJJKBKG,B0DNJJKBKG,NexLev Neck & Back Massager | Deep Tissue Shiatsu Roller | Cervical Pain Relief | 3 Speeds | 8 Kneading Nodes | Quick Pain Relief | Auto Shut Off | 1 year Warranty | BM-02,64,1,0.03%,0.02%,83,1,0.03%,0.02%,0.00%,0.00%,0,0,0.00%,0.00%,₹0.00,₹0.00,0,0
B0DNJP9T35,B0DNJP9T35,"NexLev Spin Scrubber|6 Scrubbing Heads| For Kitchen, Bathroom, Tub, Glass | Complete cleaning tool for Home, Office & Car| 90 min runtime | 2600 mAh | Cordless Type C | 2 Modes|Adjustable Handle|SS-02",309,7,0.14%,0.16%,413,9,0.14%,0.15%,11.92%,0.00%,0,0,0.00%,0.00%,₹0.00,₹0.00,0,0
B0DP2Z5DQ9,B0DP2Z5DQ9,"White Mulberry 10-Step Height Adjustable Single Screen Monitor Stand for 17-32 Inch Monitor, 8 kg Load, VESA 75x75/100x100, DIY Installation (Black)",147,5,0.07%,0.12%,221,5,0.07%,0.09%,28.19%,0.00%,0,0,0.00%,0.00%,₹0.00,₹0.00,0,0
B0DT6Y7KJM,B0DT6Y7KJM,"NexLev Ionic 4 in 1 Hot Air Brush + Straightener | 2 Step Styler Volumizer | Blow Dryer, Styler, Straightener & Waves | 360° Airflow | Tangle Free Bristle |Ceramic Tourmaline Coated Barrel | 1200W | V-02",125,1,0.06%,0.02%,157,1,0.05%,0.02%,11.03%,0.00%,0,0,0.00%,0.00%,₹0.00,₹0.00,0,0
B0DTK4FY1G,B0DTK4FY1G,"NexLev Spin Scrubber with Soap Spray | 6 heads| For Kitchen, Tub, Glass, Complete cleaning tool for Home, Office & Car| 90 min runtime | 4500 mAh | Cordless Type C | Adjustable Handle|SS-01, White",425,9,0.19%,0.21%,523,18,0.17%,0.31%,6.03%,12.50%,0,0,0.00%,0.00%,₹0.00,₹0.00,0,0
B0DV8XH455,B0DV8XH455,NexLev Shiatsu Neck Shoulder & Back Massager | 8 Kneading Nodes | 4 Modes | Deep Tissue Massage for Cervical Pain Relief | Adjustable & Hands free Design | Portable | Deep Tissue Relief | BM-03,14,0,0.01%,0.00%,16,0,0.01%,0.00%,100.00%,0.00%,0,0,0.00%,0.00%,₹0.00,₹0.00,0,0
B0DVC8NYY2,B0DVC8NYY2,"NexLev Cool Mist Humidifier | 2.2L| For Office, Indoor Plants, Baby Nursery | Quiet Operation | Works 30Hrs on Low Setting | 360° Nozzle | Auto Shut-Off | Adjustable Knob | Leak Proof | HU-02",261,3,0.12%,0.07%,374,3,0.12%,0.05%,0.00%,0.00%,0,0,0.00%,0.00%,₹0.00,₹0.00,0,0
B0DVC9PRSD,B0DVC9PRSD,NexLev Professional Air Purifier for 650 sq ft Area| 8500 Hrs Filter Life|True HEPA 13 Filter |Captures 99.99% Virus and PM 2.5 Particle|For Home & Office|Remote Control & WiFi |Sleep & Auto Mode|A6,"1,235",80,0.55%,1.88%,"1,777",138,0.59%,2.36%,0.00%,0.00%,0,0,0.00%,0.00%,₹0.00,₹0.00,0,0
B0DVCDD5VC,B0DVCDD5VC,"nexlev Travel Neck Pillow | Orthopedic Premium Memory Foam | for Airplane, Car, Train, Office use & Cervical Pain | Machine Washable | 360 Support | Carry Pouch for Storage | NP-07",5,0,0.00%,0.00%,5,0,0.00%,0.00%,0.00%,0.00%,0,0,0.00%,0.00%,₹0.00,₹0.00,0,0
B0F2HYY7JF,B0F2HYY7JF,"Audio Array AM-W21 Dual Wireless Lapel Microphones | TFT Card Recording, Noise Cancellation & Echo | Android, iOS, DSLR, Laptops | 360° Pickup, Plug n Play, 60M Working Range, 48-Hour Battery Life",56,1,0.02%,0.02%,77,1,0.03%,0.02%,7.35%,0.00%,0,0,0.00%,0.00%,₹0.00,₹0.00,0,0
B0F2J6TL8W,B0F2J6TL8W,MAONO WM820 A1 & WM820 A2 Wireless Microphone Variation,1,0,0.00%,0.00%,1,0,0.00%,0.00%,0.00%,0.00%,0,0,0.00%,0.00%,₹0.00,₹0.00,0,0
B0FH43M37N,B0FH43M37N,"Nektar Impact LX49 mk3 MIDI Keyboard Controller | 49 Key Velocity-Sensitive Keyboard with DAW Integration, Pads, Faders, Encoders, Scale & Chord Mode, NKS Support, Compatible with Mac/PC",368,7,0.16%,0.16%,476,13,0.16%,0.22%,5.66%,0.00%,0,0,0.00%,0.00%,₹0.00,₹0.00,0,0
B0FH475LZZ,B0FH475LZZ,"Nektar Impact LX61 mk3 MIDI Keyboard Controller | 61 Key Velocity-Sensitive Keyboard with DAW Integration, Pads, Faders, Encoders, Scale & Chord Mode, NKS Support, Compatible with Mac/PC",680,12,0.30%,0.28%,907,15,0.30%,0.26%,4.36%,8.33%,0,0,0.00%,0.00%,₹0.00,₹0.00,0,0
B0FJ1ZB4G9,B0FJ1ZB4G9,Nexlev Electric Toothbrush| 40000 vibrations/min|USB Type C| 5 Modes| 2 Min timer| 30 sec Quad Interval| 4 Replaceable Brush Heads With Cover| IPX7 Waterproof| For Adults| ETC-08 MidNight Blue,37,1,0.02%,0.02%,49,1,0.02%,0.02%,9.09%,0.00%,0,0,0.00%,0.00%,₹0.00,₹0.00,0,0
B0FJ8SFNRH,B0FJ8SFNRH,"NexLev Grand Electric Water Kettle | 1.8 L | 1500 Watts | Stainless Steel | For Home, Office | Auto Cut Off | For Boiling Water, making Tea & Coffee, Instant Noodles, Soup | Cool Touch Handle |KE-03",13,0,0.01%,0.00%,15,0,0.01%,0.00%,0.00%,0.00%,0,0,0.00%,0.00%,₹0.00,₹0.00,0,0
B0FN4FHH5Y,B0FN4FHH5Y,"White Mulberry Dual Screen POS Machine Stand for 17""-32"" Monitors(9kg) w/Card Reader, Printer & Barcode Scanner Holders| VESA 75x75/100x100 Compatible| Adjustable Tilt, Swivel & Rotation| Grommet Base",16,1,0.01%,0.02%,19,1,0.01%,0.02%,100.00%,100.00%,0,0,0.00%,0.00%,₹0.00,₹0.00,0,0
B0FN4HDBN5,B0FN4HDBN5,"White Mulberry Single Screen POS Machine Stand w/Keyboard Tray, Card Reader, Printer, Barcode Scanner Holder| Fits 17""-32"" Monitors (9kg), VESA 75x75/100x100| Height Adjustable Pole, Cable Management",16,0,0.01%,0.00%,20,0,0.01%,0.00%,100.00%,0.00%,0,0,0.00%,0.00%,₹0.00,₹0.00,0,0
B0FN4JG97R,B0FN4JG97R,"White Mulberry Single Screen Pole Mounted Heavy-Duty Mechanical Spring Monitor Arm for 17-40 Inch |2-22kgs| Flat & Curved Screens, Universal Desk Mount with Swivel, Tilt, Rotation",22,2,0.01%,0.05%,24,2,0.01%,0.03%,100.00%,100.00%,0,0,0.00%,0.00%,₹0.00,₹0.00,0,0
B0FPR7VFCH,B0FPR7VFCH,"Audio Array AM-W19 Wireless Lavalier Microphone|192kHz/24bit |AI Noise Cancellation for iPhone/Android, 32h Charging Case, Plug & Play for Vlogging, Streaming, Meetings, Video Recording",538,6,0.24%,0.14%,712,6,0.24%,0.10%,1.40%,0.00%,0,0,0.00%,0.00%,₹0.00,₹0.00,0,0
B0FRGDHX19,B0FRGDHX19,"Audio Array AC-6XL Mic Cable 6.35mm Jack Male to XLR 3PIN Female Cord Wire | Microphone/Guitar Cable | Black, 1pc Pack (6 Meter/19.6 Feet)",1,0,0.00%,0.00%,1,0,0.00%,0.00%,0.00%,0.00%,0,0,0.00%,0.00%,₹0.00,₹0.00,0,0
B0FSF1N457,B0FSF1N457,NexLev Mini Electric Chopper | 3D Stainless Steel Blade | Food Grade Bowl | for Mincing Garlic Ginger Onion Vegetable Meat Nuts | 250 ml | One Touch Operation | MC-01,761,17,0.34%,0.40%,971,20,0.32%,0.34%,9.07%,11.11%,0,0,0.00%,0.00%,₹0.00,₹0.00,0,0
B0FSWHRN6J,B0FSWHRN6J,Audio Array Professional Recording Studio (AI-04 & PB-01 & PB-03 & PB-04),1,0,0.00%,0.00%,1,0,0.00%,0.00%,0.00%,0.00%,0,0,0.00%,0.00%,₹0.00,₹0.00,0,0
B0FY62L381,B0FY62L381, ,14,1,0.01%,0.02%,17,1,0.01%,0.02%,0.00%,0.00%,0,0,0.00%,0.00%,₹0.00,₹0.00,0,0
B0G829DYZX,B0G829DYZX,"nexlev VC-01, VC-06 & Accessories Variation",1,0,0.00%,0.00%,1,0,0.00%,0.00%,0.00%,0.00%,0,0,0.00%,0.00%,₹0.00,₹0.00,0,0